Language_ID	Feature_ID	Feature	Value	Answer	Comment	Source	Possible Values	Suggested standardised comments
blag1240	GB014	Is there weight-sensitive suprasegmental prominence, suprasegmental prominence can be loudness, duration, pitch, i.e. stress or tone phenomena?	1.0	y		Steinhauer 2014: 154-155	2:no data;3:?;1:y;0:n	nan
blag1240	GB020	Are there definite or specific articles?	3.0	n		nan	1: present;2:y;3:n;0: absent	Not mentioned, Form same as demonstratives, Form same as pronoun, Definiteness marking is done by an element with another function such as numeral classifiers, Definiteness marking is very restricted
blag1240	GB021	Is an indefinite NP obligatorily accompanied by an indefinite (or non-specific) article?	3.0	n/a		nan	3:n/a;1: present;2:n;0: absent	Not mentioned, It exists but it is not obligatory, Same as numeral 'one'
blag1240	GB022	Are there prenominal articles?	3.0	n/a		nan	3:n/a;1: present;2:n;0: absent	Not mentioned, The definite article is prenominal, The indefinite article is prenominal, The definite article is a prefix, The indefinite article is a prefix
blag1240	GB023	Are there postnominal articles?	4.0	n/a		nan	4:n/a;1: present;2:y;3:n;0: absent	Not mentioned, The definite article is postnominal, The indefinite article is postnominal, The definite article is a suffix, The indefinite article is a suffix
blag1240	GB024	What is the order of numeral and noun in the NP?	4.0	2		nan	1: Num-N;3: both.;2: N-Num;4:2	Not mentioned, Mostly numeral-noun with a few exceptions, Mostly noun-numeral with a few exceptions, Either order occurs with any numeral
blag1240	GB025	What is the order of demonstrative and noun in the NP?	5.0	2		nan	3: both.;1: Dem-N;4:3;5:2;2: N-Dem	Not mentioned, Different demonstratives take different orders, There is free variation, Demonstrative construction has a form both before and after the noun, Demonstrative are treated as suffixes, Demonstrative are treated as prefixes
blag1240	GB026	Are there 'discontinuous noun phrases'?	2.0	n		nan	1: present;2:n;0: absent	Not mentioned
blag1240	GB027	Is there a difference between the marking of NP coordination ('John and Mary went to market') and the marking of comitative phrases ('John went to market with Mary')?	5.0	?	no data	nan	5:?;0: absent;4:no data;1: present;2:y;3:n	Not mentioned
blag1240	GB028	Is there an inclusive/exclusive distinction?	2.0	y		nan	1: present;2:y;0: absent	Not mentioned
blag1240	GB029	Is there a minimal-augmented system?	0.0	n		nan	0:n	nan
blag1240	GB030	Is there a gender distinction in 3rd person pronouns (or demonstratives, if no 3rd person pronouns)?	2.0	n		nan	1: present;2:n;0: absent	Not mentioned
blag1240	GB031	Is there a dual (or unit augmented) in addition to a plural (or augmented) number category in pronouns?	3.0	y	Pronouns based on -ole	Steinhauer 2014: 184	4:?;1: present;3:y;2:n;0: absent	Not mentioned
blag1240	GB032	Are 1st and 2nd persons conflated in any context?	2.0	n		nan	1: present;3:y;2:n;0: absent	Not mentioned, Same pronoun form covering both first and second person in some context, Person is marked on the verb and there is a context where first and second person are the same
blag1240	GB033	Are 2nd and 3rd persons conflated in non-singular numbers?	0.0	n		nan	0:n	nan
blag1240	GB034	Are person categories neutralized under some conditions?	2.0	n		nan	1: present;2:n;0: absent	Not mentioned, Under negation, In a certain TAM context, Unclear whether the verb form counts as finite
blag1240	GB035	Is there an opposition between three or more distance terms in the demonstrative system?	2.0	y		nan	4:?;1: present;2:y;3:n;0: absent	Not mentioned, The distinction is distance from speaker versus hearer
blag1240	GB036	Is elevation morphologically marked in demonstratives?	2.0	y		nan	4:?;0: absent;5:n/a;1: present;2:y;3:n	Not mentioned
blag1240	GB037	Is the opposition visible-non-visible marked on demonstratives?	3.0	y	vala '(the one) as was/is visible'	Steinhauer 2014: 181	4:?;1: present;3:y;2:n;0: absent	Not mentioned
blag1240	GB038	Are there demonstrative classifiers?	2.0	n		nan	3:?;1: present;2:n;0: absent	Not mentioned, The demonstrative classifier system is the same as another classifier system, Demonstratives agree with what is treated as noun classes
blag1240	GB039	Are there declensions (partly) determined by number of the noun?	2.0	n		nan	1: present;2:n;0: absent	Not mentioned, There are different forms for marking number depending on the noun class, There are different forms for marking number which seem to be phonologically conditioned, The markers are adjacentbut not treated as bound
blag1240	GB040	Are there declensions (partly) determined by gender of the noun?	1.0	n/a		nan	1:n/a;0:n	nan
blag1240	GB041	Are there nouns which are suppletive for number?	2.0	n		nan	1: present;2:n;0: absent	Not mentioned
blag1240	GB042	Can singular number be marked on the noun itself?	2.0	n		nan	1: present;2:n;0: absent	Not mentioned, The marker is adjacent to the noun but not treated as morphologically bound
blag1240	GB043	Can dual number be marked on the noun itself?	2.0	n		nan	1: present;2:n;0: absent	Not mentioned, The marker is adjacent to the noun but not treated as morphologically bound
blag1240	GB044	Can plural number be marked on the noun itself?	2.0	n		nan	1: present;3:y;2:n;0: absent	Not mentioned, The marker is adjacent to the noun but not treated as morphologically bound
blag1240	GB045	Is number marking prohibited on certain (types of) nouns?	3.0	n/a		nan	3:n/a;2:?;1:y;0:n	nan
blag1240	GB046	Are there associative plurals?	3.0	n		nan	5:?;0: absent;4:no data;1: present;2:y;3:n	Not mentioned
blag1240	GB047	Is there a productive morphologically marked Action/state nominalization (arrive/arrival)?	2.0	n		nan	4:?;1: present;3:y;2:n;0: absent	Not mentioned, The marker is adjacent to the noun but not treated as morphologically bound, The marker is also a noun
blag1240	GB048	Is there a productive morphologically marked Agentive nominalization (sing-er)?	2.0	n		nan	4:?;1: present;3:y;2:n;0: absent	Not mentioned, The marker is adjacent to the noun but not treated as morphologically bound, The marker means 'person' or similar
blag1240	GB049	Is there a productive morphologically marked Object nominalization (sing; song)?	3.0	y	the suffix -angseems to do something reminiscent to object nominalization	Steinhauer 2014: 163	4:?;1: present;3:y;2:n;0: absent	Not mentioned, The marker is adjacent to the noun but not treated as morphologically bound, The marker means 'thing' or similar
blag1240	GB050	Are there noun classes/genders?	1.0	n		nan	2:?;0:y;1:n	nan
blag1240	GB051	Is sex a relevant category in any noun class/gender system?	3.0	n/a		nan	3:n/a;1: present;2:n;0: absent	Not mentioned, Nouns have semantic classification but the markers are not morphologically bound and are flexible, There is extensive classification but only to parts of the lexicon
blag1240	GB052	Is shape a relevant category in any noun class/gender system?	4.0	n/a		nan	4:n/a;1: present;2:y;3:n;0: absent	Not mentioned, Nouns have semantic classification but the markers are not morphologically bound and are flexible, There is extensive classification but only to parts of the lexicon
blag1240	GB053	Is animacy (without reference to sex) a relevant category in any noun class/gender system?	4.0	n/a		nan	4:n/a;1: present;2:y;3:n;0: absent	Not mentioned, Nouns have semantic classification but the markers are not morphologically bound and are flexible, There is extensive classification but only to parts of the lexicon
blag1240	GB054	Is plant status a relevant category in any noun class/gender system?	?	Not known		nan	1: present;2:n;0: absent	Not mentioned, Nouns have semantic classification but the markers are not morphologically bound and are flexible, There is extensive classification but only to parts of the lexicon
blag1240	GB055	Does the language only have a gender distinction in 3rd person pronouns?	1.0	n/a		nan	1:n/a;0:n	nan
blag1240	GB056	Is there concord within the NP, i.e. agreement of elements within the NP with the noun class of a noun?	2.0	n/a		nan	2:n/a;1:y;0:n	nan
blag1240	GB057	Are there numeral classifiers?	2.0	n		nan	4:?;1: present;3:y;2:n;0: absent	Not mentioned, There are but they also have other functions such as classifying demonstratives, There are words with specific numeral meanings such as 'ten coconuts', There are different numerals used with different nouns
blag1240	GB058	Are there possessive classifiers?	2.0	n		nan	1: present;2:n;0: absent	Not mentioned, There are but they also have other functions such as classifying demonstratives, There are words with specific possessive meaning such as 'my house', The classifiers reflect properties of the possessor rather than the possessum
blag1240	GB059	Is alienable/inalienable a relevant distinction?	2.0	y		nan	1: present;2:y;3:n;0: absent	Not mentioned
blag1240	GB060	Are there different possessive constructions?	0.0	y		nan	0:y;1:n	nan
blag1240	GB061	Can possession be marked by a prefix?	2.0	y		nan	1: present;2:y;3:n;0: absent	Not mentioned, The marker is adjacent to the noun but not treated as morphologically bound
blag1240	GB062	Can possession be marked by a suffix?	2.0	n		nan	1: present;3:y;2:n;0: absent	Not mentioned, The marker is adjacent to the noun but not treated as morphologically bound
blag1240	GB063	Can possession be marked on the nominal possessor?	2.0	n		nan	1: present;3:y;2:n;0: absent	Not mentioned, The marker is adjacent to the noun but not treated as morphologically bound
blag1240	GB064	Can possession be marked on the nominal possessee?	2.0	y		nan	1: present;2:y;3:n;0: absent	Not mentioned, The marker is adjacent to the noun but not treated as morphologically bound
blag1240	GB065	What is the order of possessor and possessed in the attributive possessive construction?	5.0	1		nan	2:Possessed-Possessor;1:Possessor-Possessed;5:1;4:both;6:3	Not mentioned, Pronouns use the opposite order
blag1240	GB066	Are there different orders of elements in a possessive phrase for different classes of possession?	0.0	n		nan	1:y;0:n	nan
blag1240	GB067	What is the counting system?	1.0	1		nan	2:decimal;1:1;0:2	nan
blag1240	GB068	Do core adjectives (defined semantically as property concepts; value, shape, age, dimension) act like verbs in predicative position?	2.0	y		nan	5:?;0: absent;4:no data;1: present;2:y;3:n	Not mentioned, Neither verbs nor adjectives receive marking, Some TAM and voice marking on verbs is not shared by adjectives
blag1240	GB069	Do core adjectives (defined semantically as property concepts; value, shape, age, dimension) used attributively require the same morphological treatment as verbs?	3.0	n		nan	1: present;2:y;3:n;0: absent	Not mentioned, Neither verbs nor adjectives receive marking, Some TAM and voice marking on verbs is not shared by adjectives
blag1240	GB070	Is there case marking for core nominal NPs (i.e., S, A or O function)?	2.0	n		nan	1: present;3:y;2:n;0: absent	Not mentioned, The markers are adjacent to the noun but not treated as morphologically bound
blag1240	GB071	Is there case marking for core pronouns?	2.0	n		nan	1: present;3:y;2:n;0: absent	Not mentioned, The markers are adjacent to the noun but not treated as morphologically bound
blag1240	GB072	Is there case marking for oblique nominal NPs?	2.0	n		nan	1: present;2:n;0: absent	Not mentioned, The markers are adjacent to the noun but not treated as morphologically bound
blag1240	GB073	Is there case marking for oblique pronouns?	2.0	n		nan	1: present;2:n;0: absent	Not mentioned, The markers are adjacent to the noun but not treated as morphologically bound
blag1240	GB074	Are there prepositions?	2.0	n		nan	3:?;1: present;4:y;2:n;0: absent	Not mentioned, The markers are treated as bound to the noun, The adpositions are often also lexical nouns and verbs, Only one or very few
blag1240	GB075	Are there postpositions?	3.0	y		nan	4:?;1: present;3:y;2:n;0: absent	Not mentioned, The markers are treated as bound to the noun, The adpositions are often also lexical nouns and verbs, Only one or very few
blag1240	GB076	Are there adpositions to mark core NPs?	2.0	n		nan	4:?;0: absent;5:n/a;1: present;3:y;2:n	Not mentioned, The markers are treated as bound to the noun, The adpositions are often also lexical nouns and verbs
blag1240	GB077	Are there adpositions to mark oblique NPs?	3.0	y		nan	4:?;0: absent;5:n/a;1: present;3:y;2:n	Not mentioned, The markers are treated as bound to the noun, The adpositions are often also lexical nouns and verbs
blag1240	GB078	Is there a distinction between locational and directional adpositions?	0.0	n		nan	3:n/a;2:?;1:y;0:n	nan
blag1240	GB079	Do verbs have prefixes/proclitics, other than those that ONLY mark A, S or O (do include portmanteau: A & S + TAM)?	2.0	n		nan	1: present;3:y;2:n;0: absent	Not mentioned, The markers are adjacent to the verb but not treated as morphologically bound, Only one or very few
blag1240	GB080	Do verbs have suffixes/enclitics, other than those that ONLY mark A, S or O (do include portmanteau: A & S + TAM)?	2.0	y		nan	5:?;0: absent;4:no data;1: present;2:y;3:n	Not mentioned, The markers are adjacent to the verb but not treated as morphologically bound, Only one or very few
blag1240	GB081	Can infixation be used on verbs for derivational, aspectual, or voice-changing purposes?	2.0	n		nan	1: present;3:y;2:n;0: absent	Not mentioned, It is a type of reduplication, Some other doubt about why it is an infix
blag1240	GB082	Is there present tense regularly morphologically marked on the verb?	2.0	n		nan	1: present;2:n;0: absent	Not mentioned, The marker is described as non-past rather than specifically present, The marker conveys both tense and aspect, The markers are adjacent to the verb but not treated as morphologically bound
blag1240	GB083	Is there past tense regularly morphologically marked on the verb?	2.0	n		nan	1: present;2:n;0: absent	Not mentioned, The markers are adjacent to the verb but not treated as morphologically bound
blag1240	GB084	Is there future tense regularly morphologically marked on the verb?	2.0	n		nan	1: present;2:n;0: absent	Not mentioned, The marker is described as conveying non-past rather than specifically future, The markers are adjacent to the verb but not treated as morphologically bound
blag1240	GB085	Are there multiple past or future tenses, distinguishing distance from Time of Reference, marked on the verb?	1.0	n/a		nan	1:n/a;0:n	nan
blag1240	GB086	Is a distinction between punctual/continuous aspect available as a morphological choice?	3.0	n		nan	1: present;2:y;3:n;0: absent	Not mentioned, The marker is adjacent to the verb but not treated as morphologically bound
blag1240	GB087	Is a distinction between realis/irrealis mood available as a morphological choice?	2.0	n		nan	1: present;3:y;2:n;0: absent	Not mentioned, The markers are adjacent to the verb but not treated as morphologically bound, It is called 'realis'/'irrealis' by the grammar
blag1240	GB088	Is there an apprehensive modal category marked on the verb also known as 'evitative', 'lest', etc.?	2.0	n		nan	1: present;2:n;0: absent	Not mentioned, The markers are adjacent to the verb but not treated as morphologically bound, There is a marker but it has other functions
blag1240	GB089	Is the S participant (at least sometimes) marked by a suffix/enclitic?	2.0	n		nan	1: present;3:y;2:n;0: absent	Not mentioned, The markers are adjacent to the verb but not treated as morphologically bound
blag1240	GB090	Is the S participant (at least sometimes) marked by a prefix/proclitic?	3.0	n		nan	4:?;1: present;2:y;3:n;0: absent	Not mentioned, The markers are adjacent to the verb but not treated as morphologically bound
blag1240	GB091	Is the A participant (at least sometimes) marked by a suffix/enclitic?	2.0	n		nan	3:?;1: present;4:y;2:n;0: absent	Not mentioned, The markers are adjacent to the verb but not treated as morphologically bound
blag1240	GB092	Is the A participant (at least sometimes) marked by a prefix/proclitic?	2.0	n		nan	1: present;3:y;2:n;0: absent	Not mentioned, The markers are adjacent to the verb but not treated as morphologically bound
blag1240	GB093	Is the O participant (at least sometimes) marked by a suffix/enclitic?	2.0	n		nan	1: present;3:y;2:n;0: absent	Not mentioned, The markers are adjacent to the verb but not treated as morphologically bound
blag1240	GB094	Is the O participant (at least sometimes) marked by a prefix/proclitic?	2.0	y		nan	1: present;2:y;3:n;0: absent	Not mentioned, The markers are adjacent to the verb but not treated as morphologically bound
blag1240	GB095	Are variations in marking strategies of core participants based on TAM distinctions?	3.0	y		nan	4:n/a;1: present;3:y;2:n;0: absent	Not mentioned
blag1240	GB096	Are variations in marking strategies of core participants based on verb classes?	2.0	y		nan	4:n/a;1: present;2:y;3:n;0: absent	Not mentioned
blag1240	GB097	Are variations in marking strategies of core participants based on clause type, e.g. main vs. subordinate?	2.0	n		nan	4:?;3:no data;0: absent;5:n/a;1: present;2:n	Not mentioned
blag1240	GB098	Are variations in marking strategies of core participants based on person distinctions?	2.0	n		nan	4:n/a;1: present;3:y;2:n;0: absent	Not mentioned
blag1240	GB099	Do verb stems alter according to the person of a core participant?	2.0	n		nan	3:?;1: present;2:n;0: absent	Not mentioned
blag1240	GB100	Is number ever marked separately from person on the verb?	0.0	n		nan	1:y;0:n	nan
blag1240	GB101	Are person, number and any TAM category (i.e. 3 or more categories in all) marked by portmanteau morphemes on verbs?	0.0	n		nan	0:n	nan
blag1240	GB102	Are categories such as person, number, gender related to a single participant discontinuously marked on a verb?	0.0	n		nan	0:n	nan
blag1240	GB103	Are benefactive nominals marked on the verb?	3.0	y		Steinhauer 2014: 171	1: present;3:y;2:n;0: absent	Not mentioned, The markers are adjacent to the verb but not treated as morphologically bound
blag1240	GB104	Can instruments be marked on the verb?	2.0	n		Steinhauer 2014: 212	4:?;1: present;3:y;2:n;0: absent	Not mentioned, The markers are adjacent to the verb but not treated as morphologically bound
blag1240	GB105	Can recipients be treated as a transitive object, i.e. as Direct Object?	2.0	y		nan	1: present;2:y;3:n;0: absent	Not mentioned
blag1240	GB106	Are there syntactically ditransitive verbs?	3.0	y		nan	1: present;3:y;2:n;0: absent	Not mentioned, Only one or very few such as 'give'
blag1240	GB107	Is negation marked morphologically on the verb?	2.0	n		nan	1: present;2:n;0: absent	Not mentioned, The marker is adjacent to the property word but not treated as morphologically bound
blag1240	GB108	Can locative or direction be morphologically marked on the verb?	3.0	n		nan	4:?;1: present;2:y;3:n;0: absent	Not mentioned, The markers are adjacent to the verb but not treated as morphologically bound
blag1240	GB109	Are there suppletive verbs for number of participants?	2.0	n		nan	1: present;3:y;2:n;0: absent	Not mentioned, Only one example
blag1240	GB110	Are there suppletive verbs for tense or aspect?	2.0	n		nan	1: present;2:n;0: absent	Not mentioned, One or very few, Unclear whether the suppletive pattern is a conjugation class
blag1240	GB111	Are there conjugation classes?	3.0	n		nan	1: present;2:y;3:n;0: absent	Not mentioned, The markers are adjacent to the verb but not treated as morphologically bound, They are transitive versus intransitive verbs
blag1240	GB112	Are there (several) verbs which can be used either transitively or intransitively with no morphological marking?	4.0	?	no data	nan	4:?;1: present;3:y;2:n;0: absent	Not mentioned, There are only very few examples are or restricted in some way
blag1240	GB113	Is there transitivising morphology (include clitics)?	3.0	y		nan	1: present;3:y;2:n;0: absent	Not mentioned, The markers are adjacent to the verb but not treated as morphologically bound
blag1240	GB114	Is there morphology (include clitics) to mark a reflexive action?	5.0	?		nan	5:?;0: absent;4:no data;1: present;3:y;2:n	Not mentioned, The marker is adjacent to the verb but not treated as morphologically bound
blag1240	GB115	Is there morphology (include clitics) to mark a reciprocal action?	2.0	y	the pronominal prefix t- marks reciprocal on verbs. 	Steinhauer 2014: 192	4:?;1: present;2:y;3:n;0: absent	Not mentioned, The markers are adjacent to the verb but not treated as morphologically bound
blag1240	GB116	Do verbs classify the shape, size, consistency or position of absolutive arguments by means of incorporated nouns, verbal affixes or suppletive verb stems?	3.0	y		nan	1: present;3:y;2:n;0: absent	Not mentioned, Perhaps some examples but it does not seem to be a systematic feature of verbs, Resembles the noun class system, Resembles the noun classifier system
blag1240	GB117	Is there a copula for predicate nominals?	2.0	n		nan	1: present;3:y;2:n;0: absent	Not mentioned, There is but it is not obligatory, There is but it is restricted such as in the past tense only, There is but it is a demonstrative
blag1240	GB118	Are there serial verb constructions?	2.0	y		nan	1: present;2:y;0: absent	Not mentioned, Hard to distinguish from verb compounding, Limited to some verbs e.g. English 'go buy food'
blag1240	GB119	Are there modal auxiliaries?	3.0	n	modal adverbs do exist	Steinhauer 2014: 273	5:?;0: absent;4:no data;1: present;2:y;3:n	nan
blag1240	GB120	Are there aspectual auxiliaries?	3.0	n	aspectual adverbs exist	Steinhauer 2014: 273	1: present;2:y;3:n;0: absent	nan
blag1240	GB121	Are there tense auxiliaries?	2.0	n		nan	1: present;3:y;2:n;0: absent	nan
blag1240	GB122	Is verb compounding a regular process?	3.0	n	"Verbal compounds are rare.
put. down) 'not finish (a task/ job)'."	Steinhauer 2014: 164	5:?;0: absent;4:no data;1: present;2:y;3:n	Not mentioned, Hard to distinguish from serial verb constructions
blag1240	GB123	Are there verb-adjunct (aka light-verb) constructions?	3.0	n		nan	1: present;2:y;3:n;0: absent	Not mentioned
blag1240	GB124	Is incorporation of nouns into verbs a productive intransitivizing process?	2.0	n		nan	4:?;1: present;3:y;2:n;0: absent	Not mentioned, The noun appears adjacent to the verb but is not treated as morphologically bound
blag1240	GB125	Is there productive incorporation of non-nominal elements (adjectives, locatives, etc.) into verbs?	3.0	y	Postpositions can be incorporated	Steinhauer 2014: 199	4:?;1: present;3:y;2:n;0: absent	Not mentioned, The marker is adjacent to the verb but not treated as morphologically bound
blag1240	GB126	Is there one or more existential verb?	3.0	n		nan	4:?;1: present;2:y;3:n;0: absent	Not mentioned, It exists but is the same as the copula, It exists but also encodes position
blag1240	GB127	Are there positional (classificatory) verbs?	3.0	n		nan	6:?;0: absent;5:no data;2:y;1: present;3:n;4:y?	Not mentioned, They are not fully obligatory
blag1240	GB128	Is the verb 'give' morphologically peculiar (different from most other verbs)?	1.0	y	the verb -enang 'give' is the only ditransive root verb and has a number of unexpected or irregular forms in some persons. 	Steinhauer 2014: 169-170	1:y;0:n	nan
blag1240	GB129	Is there a notably small number, i.e. about 100 or less, of verbs in the language?	2.0	n		nan	1: present;2:n;0: absent	Not mentioned
blag1240	GB130	What is the pragmatically unmarked order of S and V in intransitive clauses?	4.0	1		nan	3: both;4:1;1: SV;2: VS	Not mentioned, Pronouns have opposite order, Different depending on clause type or TAM etc., Occurs with a type of focus construction
blag1240	GB131	Is a pragmatically unmarked constituent order verb-initial for transitive clauses?	2.0	n		nan	1: present;2:n;0: absent	Not mentioned, Pronouns have a different order, Different depending on clause type or TAM etc.
blag1240	GB132	Is a pragmatically unmarked constituent order verb-medial for transitive clauses?	2.0	n		nan	1: present;3:y;2:n;0: absent	Not mentioned, Pronouns have a different order, Different depending on clause type or TAM etc.
blag1240	GB133	Is a pragmatically unmarked constituent order verb-final for transitive clauses?	2.0	y		nan	1: present;2:y;3:n;0: absent	Not mentioned, Pronouns have a different order, Different depending on clause type or TAM etc.
blag1240	GB134	Is the order of constituents the same in main and subordinate clauses?	2.0	y	The only subordinate clauses discussed are relative clauses	nan	4:n/a;3:?;1: present;2:y;0: absent	Not mentioned, Only in some type of subordinate clauses, Order is more restricted in main clauses, Order is more restricted in subordinate clauses
blag1240	GB135	Do clausal objects occur in the same position as nominal objects?	4.0	?	no data	nan	4:?;0: absent;5:n/a;1: present;2:y;3:n	Not mentioned
blag1240	GB136	Is constituent order fixed?	2.0	y		nan	1: present;2:y;0: absent	Not mentioned that there is any variation, There is variation due to topicalisation and focus
blag1240	GB137	Can negation be marked clause-finally?	2.0	y		nan	1: present;2:y;3:n;0: absent	Not mentioned, Only in some sentences where a normally initial element such as the subject is not present, Negation is marked on the verb which appears clause-initially
blag1240	GB138	Can negation be marked clause-initially?	2.0	n		nan	1: present;3:y;2:n;0: absent	Not mentioned, Only in some sentences where a normally final element such as the direct object is not present, Negation is marked on the verb which appears clause-finally
blag1240	GB139	Is there a difference between imperative and declarative negation?	2.0	y	prohibitive 'ake 'don't' is a loan from Lamaholot and is predicate initial	Steinhauer 2014: 175	3:?;1: present;2:y;0: absent	Not mentioned, Difference in word order, Difference in the form of the negator, Difference in the presence of a particular element which is not analysed as part of the negator
