Feature_ID	Language_ID	Feature	Value	Answer	Comment	Source	Possible Values	Suggested standardised comments
GB014	keda1252	Is there weight-sensitive suprasegmental prominence, suprasegmental prominence can be loudness, duration, pitch, i.e. stress or tone phenomena?	0	n		nan	0:n;2:no data;1:y;3:?	
GB020	keda1252	Are there definite or specific articles?	3	n		nan	3:n;1: present;2:y;0: absent	Not mentioned, Form same as demonstratives, Form same as pronoun, Definiteness marking is done by an element with another function such as numeral classifiers, Definiteness marking is very restricted
GB021	keda1252	Is an indefinite NP obligatorily accompanied by an indefinite (or non-specific) article?	?	Not known		nan	2:n;1: present;0: absent	Not mentioned, It exists but it is not obligatory, Same as numeral 'one'
GB022	keda1252	Are there prenominal articles?	?	Not known		nan	2:n;1: present;0: absent	Not mentioned, The definite article is prenominal, The indefinite article is prenominal, The definite article is a prefix, The indefinite article is a prefix
GB023	keda1252	Are there postnominal articles?	?	Not known		nan	3:n;1: present;2:y;0: absent	Not mentioned, The definite article is postnominal, The indefinite article is postnominal, The definite article is a suffix, The indefinite article is a suffix
GB024	keda1252	What is the order of numeral and noun in the NP?	4	2		Samely 1991: 151	3: both.;2: N-Num;4:2;1: Num-N	Not mentioned, Mostly numeral-noun with a few exceptions, Mostly noun-numeral with a few exceptions, Either order occurs with any numeral
GB025	keda1252	What is the order of demonstrative and noun in the NP?	5	2		nan	3: both.;1: Dem-N;4:3;5:2;2: N-Dem	Not mentioned, Different demonstratives take different orders, There is free variation, Demonstrative construction has a form both before and after the noun, Demonstrative are treated as suffixes, Demonstrative are treated as prefixes
GB026	keda1252	Are there 'discontinuous noun phrases'?	2	n		nan	2:n;1: present;0: absent	Not mentioned
GB027	keda1252	Is there a difference between the marking of NP coordination ('John and Mary went to market') and the marking of comitative phrases ('John went to market with Mary')?	3	n	(n)ore 'and, be with' 	Samely 1991: 155, 157; Samely and Barnes 2013: 492	0: absent;3:n;1: present;4:no data;2:y;5:?	Not mentioned
GB028	keda1252	Is there an inclusive/exclusive distinction?	2	y		nan	0: absent;1: present;2:y	Not mentioned
GB029	keda1252	Is there a minimal-augmented system?	0	n		nan	0:n	
GB030	keda1252	Is there a gender distinction in 3rd person pronouns (or demonstratives, if no 3rd person pronouns)?	2	n		nan	2:n;1: present;0: absent	Not mentioned
GB031	keda1252	Is there a dual (or unit augmented) in addition to a plural (or augmented) number category in pronouns?	3	y	dual pronoun paradigm is formed on the basis of sue 'two' followed by glottal.stop-pronominal suffix	Samely 1991: 99	2:n;1: present;0: absent;3:y;4:?	Not mentioned
GB032	keda1252	Are 1st and 2nd persons conflated in any context?	2	n		nan	2:n;1: present;3:y;0: absent	Not mentioned, Same pronoun form covering both first and second person in some context, Person is marked on the verb and there is a context where first and second person are the same
GB033	keda1252	Are 2nd and 3rd persons conflated in non-singular numbers?	0	n		nan	0:n	
GB034	keda1252	Are person categories neutralized under some conditions?	2	n		nan	2:n;1: present;0: absent	Not mentioned, Under negation, In a certain TAM context, Unclear whether the verb form counts as finite
GB035	keda1252	Is there an opposition between three or more distance terms in the demonstrative system?	3	n		nan	3:n;1: present;0: absent;2:y;4:?	Not mentioned, The distinction is distance from speaker versus hearer
GB036	keda1252	Is elevation morphologically marked in demonstratives?	3	n		nan	3:n;1: present;0: absent;2:y;4:?	Not mentioned
GB037	keda1252	Is the opposition visible-non-visible marked on demonstratives?	2	n		nan	2:n;1: present;0: absent;3:y;4:?	Not mentioned
GB038	keda1252	Are there demonstrative classifiers?	2	n		nan	2:n;1: present;0: absent;3:?	Not mentioned, The demonstrative classifier system is the same as another classifier system, Demonstratives agree with what is treated as noun classes
GB039	keda1252	Are there declensions (partly) determined by number of the noun?	2	n		nan	2:n;1: present;0: absent	Not mentioned, There are different forms for marking number depending on the noun class, There are different forms for marking number which seem to be phonologically conditioned, The markers are adjacentbut not treated as bound
GB040	keda1252	Are there declensions (partly) determined by gender of the noun?	?	Not known		nan	0:n	
GB041	keda1252	Are there nouns which are suppletive for number?	2	n		nan	2:n;1: present;0: absent	Not mentioned
GB042	keda1252	Can singular number be marked on the noun itself?	2	n		nan	2:n;1: present;0: absent	Not mentioned, The marker is adjacent to the noun but not treated as morphologically bound
GB043	keda1252	Can dual number be marked on the noun itself?	2	n		nan	2:n;1: present;0: absent	Not mentioned, The marker is adjacent to the noun but not treated as morphologically bound
GB044	keda1252	Can plural number be marked on the noun itself?	2	n		nan	2:n;1: present;3:y;0: absent	Not mentioned, The marker is adjacent to the noun but not treated as morphologically bound
GB045	keda1252	Is number marking prohibited on certain (types of) nouns?	?	Not known		nan	0:n;1:y;2:?	
GB046	keda1252	Are there associative plurals?	5	?		nan	0: absent;3:n;1: present;4:no data;2:y;5:?	Not mentioned
GB047	keda1252	Is there a productive morphologically marked Action/state nominalization (arrive/arrival)?	3	y		nan	2:n;1: present;0: absent;3:y;4:?	Not mentioned, The marker is adjacent to the noun but not treated as morphologically bound, The marker is also a noun
GB048	keda1252	Is there a productive morphologically marked Agentive nominalization (sing-er)?	2	n	wala is a free form meaning 'lord, master, Sir' and is used to derive agent noun compounds (help > help wala 'helper', play > play wala 'player'. NB In Western Pantar, the word wala 'person' has a similar function (Holton 2015: 46, in Schapper ed.). Kedang also has ata 'person' and W Pantar also has aname 'person'). 	Samely 1991: 67	2:n;1: present;0: absent;3:y;4:?	Not mentioned, The marker is adjacent to the noun but not treated as morphologically bound, The marker means 'person' or similar
GB049	keda1252	Is there a productive morphologically marked Object nominalization (sing; song)?	2	n		nan	2:n;1: present;0: absent;3:y;4:?	Not mentioned, The marker is adjacent to the noun but not treated as morphologically bound, The marker means 'thing' or similar
GB050	keda1252	Are there noun classes/genders?	1	n		nan	1:n;0:y;2:?	
GB051	keda1252	Is sex a relevant category in any noun class/gender system?	?	Not known		nan	2:n;1: present;0: absent	Not mentioned, Nouns have semantic classification but the markers are not morphologically bound and are flexible, There is extensive classification but only to parts of the lexicon
GB052	keda1252	Is shape a relevant category in any noun class/gender system?	?	Not known		nan	3:n;1: present;2:y;0: absent	Not mentioned, Nouns have semantic classification but the markers are not morphologically bound and are flexible, There is extensive classification but only to parts of the lexicon
GB053	keda1252	Is animacy (without reference to sex) a relevant category in any noun class/gender system?	?	Not known		nan	3:n;1: present;2:y;0: absent	Not mentioned, Nouns have semantic classification but the markers are not morphologically bound and are flexible, There is extensive classification but only to parts of the lexicon
GB054	keda1252	Is plant status a relevant category in any noun class/gender system?	?	Not known		nan	2:n;1: present;0: absent	Not mentioned, Nouns have semantic classification but the markers are not morphologically bound and are flexible, There is extensive classification but only to parts of the lexicon
GB055	keda1252	Does the language only have a gender distinction in 3rd person pronouns?	?	Not known		nan	0:n	
GB056	keda1252	Is there concord within the NP, i.e. agreement of elements within the NP with the noun class of a noun?	?	Not known		nan	0:n;1:y	
GB057	keda1252	Are there numeral classifiers?	3	y		Samely 1991:96, 90 	2:n;1: present;0: absent;3:y;4:?	Not mentioned, There are but they also have other functions such as classifying demonstratives, There are words with specific numeral meanings such as 'ten coconuts', There are different numerals used with different nouns
GB058	keda1252	Are there possessive classifiers?	2	n		nan	2:n;1: present;0: absent	Not mentioned, There are but they also have other functions such as classifying demonstratives, There are words with specific possessive meaning such as 'my house', The classifiers reflect properties of the possessor rather than the possessum
GB059	keda1252	Is alienable/inalienable a relevant distinction?	3	n		nan	3:n;1: present;2:y;0: absent	Not mentioned
GB060	keda1252	Are there different possessive constructions?	1	n		nan	1:n;0:y	
GB061	keda1252	Can possession be marked by a prefix?	3	n		nan	3:n;1: present;2:y;0: absent	Not mentioned, The marker is adjacent to the noun but not treated as morphologically bound
GB062	keda1252	Can possession be marked by a suffix?	2	n		nan	2:n;1: present;3:y;0: absent	Not mentioned, The marker is adjacent to the noun but not treated as morphologically bound
GB063	keda1252	Can possession be marked on the nominal possessor?	2	n		nan	2:n;1: present;3:y;0: absent	Not mentioned, The marker is adjacent to the noun but not treated as morphologically bound
GB064	keda1252	Can possession be marked on the nominal possessee?	3	n		nan	3:n;1: present;2:y;0: absent	Not mentioned, The marker is adjacent to the noun but not treated as morphologically bound
GB065	keda1252	What is the order of possessor and possessed in the attributive possessive construction?	5	1		Samely 1991: 152	5:1;2:Possessed-Possessor;4:both;1:Possessor-Possessed;6:3	Not mentioned, Pronouns use the opposite order
GB066	keda1252	Are there different orders of elements in a possessive phrase for different classes of possession?	0	n		nan	0:n;1:y	
GB067	keda1252	What is the counting system?	1	1	leme >apaɁ '5 4' = 'nine'	Samely 1991: 96	1:1;0:2;2:decimal	
GB068	keda1252	Do core adjectives (defined semantically as property concepts; value, shape, age, dimension) act like verbs in predicative position?	2	y	they take subject enclitics, e.g. =ne '3sg'	Samely  1991: 84	0: absent;3:n;1: present;4:no data;2:y;5:?	Not mentioned, Neither verbs nor adjectives receive marking, Some TAM and voice marking on verbs is not shared by adjectives
GB069	keda1252	Do core adjectives (defined semantically as property concepts; value, shape, age, dimension) used attributively require the same morphological treatment as verbs?	3	n	they take a suffix -n when used attributively	Samely  1991: 84	3:n;1: present;2:y;0: absent	Not mentioned, Neither verbs nor adjectives receive marking, Some TAM and voice marking on verbs is not shared by adjectives
GB070	keda1252	Is there case marking for core nominal NPs (i.e., S, A or O function)?	2	n		nan	2:n;1: present;3:y;0: absent	Not mentioned, The markers are adjacent to the noun but not treated as morphologically bound
GB071	keda1252	Is there case marking for core pronouns?	3	y		nan	2:n;1: present;3:y;0: absent	Not mentioned, The markers are adjacent to the noun but not treated as morphologically bound
GB072	keda1252	Is there case marking for oblique nominal NPs?	2	n		nan	2:n;1: present;0: absent	Not mentioned, The markers are adjacent to the noun but not treated as morphologically bound
GB073	keda1252	Is there case marking for oblique pronouns?	2	n		nan	2:n;1: present;0: absent	Not mentioned, The markers are adjacent to the noun but not treated as morphologically bound
GB074	keda1252	Are there prepositions?	4	y	e.g. bè 'general locative preposition'	Samely 1991: 116	2:n;1: present;0: absent;4:y;3:?	Not mentioned, The markers are treated as bound to the noun, The adpositions are often also lexical nouns and verbs, Only one or very few
GB075	keda1252	Are there postpositions?	2	n		nan	2:n;1: present;0: absent;3:y;4:?	Not mentioned, The markers are treated as bound to the noun, The adpositions are often also lexical nouns and verbs, Only one or very few
GB076	keda1252	Are there adpositions to mark core NPs?	2	n		nan	2:n;1: present;0: absent;3:y;4:?	Not mentioned, The markers are treated as bound to the noun, The adpositions are often also lexical nouns and verbs
GB077	keda1252	Are there adpositions to mark oblique NPs?	3	y		nan	2:n;1: present;0: absent;3:y;4:?	Not mentioned, The markers are treated as bound to the noun, The adpositions are often also lexical nouns and verbs
GB078	keda1252	Is there a distinction between locational and directional adpositions?	0	n	The preposition bè means 'in', 'at' 'on', 'towards' or 'to'	Samely 1991: 116	0:n;1:y;2:?	
GB079	keda1252	Do verbs have prefixes/proclitics, other than those that ONLY mark A, S or O (do include portmanteau: A & S + TAM)?	2	n		nan	2:n;1: present;3:y;0: absent	Not mentioned, The markers are adjacent to the verb but not treated as morphologically bound, Only one or very few
GB080	keda1252	Do verbs have suffixes/enclitics, other than those that ONLY mark A, S or O (do include portmanteau: A & S + TAM)?	3	n		nan	0: absent;3:n;1: present;4:no data;2:y;5:?	Not mentioned, The markers are adjacent to the verb but not treated as morphologically bound, Only one or very few
GB081	keda1252	Can infixation be used on verbs for derivational, aspectual, or voice-changing purposes?	3	y	nominalizing infix -an-	Samely 1991: 66	2:n;1: present;3:y;0: absent	Not mentioned, It is a type of reduplication, Some other doubt about why it is an infix
GB082	keda1252	Is there present tense regularly morphologically marked on the verb?	2	n		nan	2:n;1: present;0: absent	Not mentioned, The marker is described as non-past rather than specifically present, The marker conveys both tense and aspect, The markers are adjacent to the verb but not treated as morphologically bound
GB083	keda1252	Is there past tense regularly morphologically marked on the verb?	2	n		nan	2:n;1: present;0: absent	Not mentioned, The markers are adjacent to the verb but not treated as morphologically bound
GB084	keda1252	Is there future tense regularly morphologically marked on the verb?	2	n		nan	2:n;1: present;0: absent	Not mentioned, The marker is described as conveying non-past rather than specifically future, The markers are adjacent to the verb but not treated as morphologically bound
GB085	keda1252	Are there multiple past or future tenses, distinguishing distance from Time of Reference, marked on the verb?	?	Not known		nan	0:n	
GB086	keda1252	Is a distinction between punctual/continuous aspect available as a morphological choice?	3	n		nan	3:n;1: present;2:y;0: absent	Not mentioned, The marker is adjacent to the verb but not treated as morphologically bound
GB087	keda1252	Is a distinction between realis/irrealis mood available as a morphological choice?	2	n		nan	2:n;1: present;3:y;0: absent	Not mentioned, The markers are adjacent to the verb but not treated as morphologically bound, It is called 'realis'/'irrealis' by the grammar
GB088	keda1252	Is there an apprehensive modal category marked on the verb also known as 'evitative', 'lest', etc.?	2	n		nan	2:n;1: present;0: absent	Not mentioned, The markers are adjacent to the verb but not treated as morphologically bound, There is a marker but it has other functions
GB089	keda1252	Is the S participant (at least sometimes) marked by a suffix/enclitic?	3	y		nan	2:n;1: present;3:y;0: absent	Not mentioned, The markers are adjacent to the verb but not treated as morphologically bound
GB090	keda1252	Is the S participant (at least sometimes) marked by a prefix/proclitic?	3	n	if preverbal, it is a free form	Samely 1991: 71-74	3:n;1: present;0: absent;2:y;4:?	Not mentioned, The markers are adjacent to the verb but not treated as morphologically bound
GB091	keda1252	Is the A participant (at least sometimes) marked by a suffix/enclitic?	4	y		Samely 1991: 71, example (5) and (6)	2:n;1: present;0: absent;4:y;3:?	Not mentioned, The markers are adjacent to the verb but not treated as morphologically bound
GB092	keda1252	Is the A participant (at least sometimes) marked by a prefix/proclitic?	2	n		nan	2:n;1: present;3:y;0: absent	Not mentioned, The markers are adjacent to the verb but not treated as morphologically bound
GB093	keda1252	Is the O participant (at least sometimes) marked by a suffix/enclitic?	3	y		nan	2:n;1: present;3:y;0: absent	Not mentioned, The markers are adjacent to the verb but not treated as morphologically bound
GB094	keda1252	Is the O participant (at least sometimes) marked by a prefix/proclitic?	3	n		nan	3:n;1: present;2:y;0: absent	Not mentioned, The markers are adjacent to the verb but not treated as morphologically bound
GB095	keda1252	Are variations in marking strategies of core participants based on TAM distinctions?	3	y		nan	2:n;1: present;3:y;0: absent	Not mentioned
GB096	keda1252	Are variations in marking strategies of core participants based on verb classes?	3	n		nan	3:n;1: present;2:y;0: absent	Not mentioned
GB097	keda1252	Are variations in marking strategies of core participants based on clause type, e.g. main vs. subordinate?	2	n		nan	2:n;1: present;3:no data;0: absent;4:?	Not mentioned
GB098	keda1252	Are variations in marking strategies of core participants based on person distinctions?	2	n		nan	2:n;1: present;3:y;0: absent	Not mentioned
GB099	keda1252	Do verb stems alter according to the person of a core participant?	2	n		nan	2:n;1: present;0: absent;3:?	Not mentioned
GB100	keda1252	Is number ever marked separately from person on the verb?	0	n		nan	0:n;1:y	
GB101	keda1252	Are person, number and any TAM category (i.e. 3 or more categories in all) marked by portmanteau morphemes on verbs?	0	n		nan	0:n	
GB102	keda1252	Are categories such as person, number, gender related to a single participant discontinuously marked on a verb?	0	n		nan	0:n	
GB103	keda1252	Are benefactive nominals marked on the verb?	2	n		nan	2:n;1: present;3:y;0: absent	Not mentioned, The markers are adjacent to the verb but not treated as morphologically bound
GB104	keda1252	Can instruments be marked on the verb?	2	n		nan	2:n;1: present;0: absent;3:y;4:?	Not mentioned, The markers are adjacent to the verb but not treated as morphologically bound
GB105	keda1252	Can recipients be treated as a transitive object, i.e. as Direct Object?	3	n		nan	3:n;1: present;2:y;0: absent	Not mentioned
GB106	keda1252	Are there syntactically ditransitive verbs?	3	y		Samely 1991: 71 ex (7)	2:n;1: present;3:y;0: absent	Not mentioned, Only one or very few such as 'give'
GB107	keda1252	Is negation marked morphologically on the verb?	2	n		nan	2:n;1: present;0: absent	Not mentioned, The marker is adjacent to the property word but not treated as morphologically bound
GB108	keda1252	Can locative or direction be morphologically marked on the verb?	3	n		nan	3:n;1: present;0: absent;2:y;4:?	Not mentioned, The markers are adjacent to the verb but not treated as morphologically bound
GB109	keda1252	Are there suppletive verbs for number of participants?	2	n		nan	2:n;1: present;3:y;0: absent	Not mentioned, Only one example
GB110	keda1252	Are there suppletive verbs for tense or aspect?	2	n		nan	2:n;1: present;0: absent	Not mentioned, One or very few, Unclear whether the suppletive pattern is a conjugation class
GB111	keda1252	Are there conjugation classes?	2	y		nan	3:n;1: present;2:y;0: absent	Not mentioned, The markers are adjacent to the verb but not treated as morphologically bound, They are transitive versus intransitive verbs
GB112	keda1252	Are there (several) verbs which can be used either transitively or intransitively with no morphological marking?	3	y		nan	2:n;1: present;0: absent;3:y;4:?	Not mentioned, There are only very few examples are or restricted in some way
GB113	keda1252	Is there transitivising morphology (include clitics)?	2	n		nan	2:n;1: present;3:y;0: absent	Not mentioned, The markers are adjacent to the verb but not treated as morphologically bound
GB114	keda1252	Is there morphology (include clitics) to mark a reflexive action?	2	n	wèɁ 'body' used to form reflexive verbs e.g.  leave each other, hide each other, hand each other, surrender oneself	Samely 1991	0: absent;2:n;1: present;4:no data;3:y;5:?	Not mentioned, The marker is adjacent to the verb but not treated as morphologically bound
GB115	keda1252	Is there morphology (include clitics) to mark a reciprocal action?	3	n	wèɁ 'body' used to form reflexive verbs e.g.  leave each other, hide each other, hand each other, surrender oneself	nan	3:n;1: present;0: absent;2:y;4:?	Not mentioned, The markers are adjacent to the verb but not treated as morphologically bound
GB116	keda1252	Do verbs classify the shape, size, consistency or position of absolutive arguments by means of incorporated nouns, verbal affixes or suppletive verb stems?	2	n		nan	2:n;1: present;3:y;0: absent	Not mentioned, Perhaps some examples but it does not seem to be a systematic feature of verbs, Resembles the noun class system, Resembles the noun classifier system
GB117	keda1252	Is there a copula for predicate nominals?	2	n		nan	2:n;1: present;3:y;0: absent	Not mentioned, There is but it is not obligatory, There is but it is restricted such as in the past tense only, There is but it is a demonstrative
GB118	keda1252	Are there serial verb constructions?	2	y		nan	0: absent;1: present;2:y	Not mentioned, Hard to distinguish from verb compounding, Limited to some verbs e.g. English 'go buy food'
GB119	keda1252	Are there modal auxiliaries?	2	y		nan	0: absent;3:n;1: present;4:no data;2:y;5:?	
GB120	keda1252	Are there aspectual auxiliaries?	2	y		nan	3:n;1: present;2:y;0: absent	
GB121	keda1252	Are there tense auxiliaries?	3	y		nan	2:n;1: present;3:y;0: absent	
GB122	keda1252	Is verb compounding a regular process?	2	y		Samely 1991: 108	0: absent;3:n;1: present;4:no data;2:y;5:?	Not mentioned, Hard to distinguish from serial verb constructions
GB123	keda1252	Are there verb-adjunct (aka light-verb) constructions?	3	n		nan	3:n;1: present;2:y;0: absent	Not mentioned
GB124	keda1252	Is incorporation of nouns into verbs a productive intransitivizing process?	2	n		nan	2:n;1: present;0: absent;3:y;4:?	Not mentioned, The noun appears adjacent to the verb but is not treated as morphologically bound
GB125	keda1252	Is there productive incorporation of non-nominal elements (adjectives, locatives, etc.) into verbs?	2	n		nan	2:n;1: present;0: absent;3:y;4:?	Not mentioned, The marker is adjacent to the verb but not treated as morphologically bound
GB126	keda1252	Is there one or more existential verb?	2	y	nore 'there is/are'	Samely 1991: 84, 186	3:n;1: present;0: absent;2:y;4:?	Not mentioned, It exists but is the same as the copula, It exists but also encodes position
GB127	keda1252	Are there positional (classificatory) verbs?	3	n		nan	0: absent;4:y?;3:n;1: present;5:no data;2:y;6:?	Not mentioned, They are not fully obligatory
GB128	keda1252	Is the verb 'give' morphologically peculiar (different from most other verbs)?	0	n		nan	0:n;1:y	
GB129	keda1252	Is there a notably small number, i.e. about 100 or less, of verbs in the language?	2	n		nan	2:n;1: present;0: absent	Not mentioned
GB130	keda1252	What is the pragmatically unmarked order of S and V in intransitive clauses?	4	1		nan	4:1;1: SV;3: both;2: VS	Not mentioned, Pronouns have opposite order, Different depending on clause type or TAM etc., Occurs with a type of focus construction
GB131	keda1252	Is a pragmatically unmarked constituent order verb-initial for transitive clauses?	2	n		nan	2:n;1: present;0: absent	Not mentioned, Pronouns have a different order, Different depending on clause type or TAM etc.
GB132	keda1252	Is a pragmatically unmarked constituent order verb-medial for transitive clauses?	3	y		nan	2:n;1: present;3:y;0: absent	Not mentioned, Pronouns have a different order, Different depending on clause type or TAM etc.
GB133	keda1252	Is a pragmatically unmarked constituent order verb-final for transitive clauses?	3	n		nan	3:n;1: present;2:y;0: absent	Not mentioned, Pronouns have a different order, Different depending on clause type or TAM etc.
GB134	keda1252	Is the order of constituents the same in main and subordinate clauses?	2	y		Samely 1991: 73 ex (20)	0: absent;1: present;2:y;3:?	Not mentioned, Only in some type of subordinate clauses, Order is more restricted in main clauses, Order is more restricted in subordinate clauses
GB135	keda1252	Do clausal objects occur in the same position as nominal objects?	2	y	quotes follow hoing  'tell s.o.', thoughts follow kèlèn  'to think' 	Samely 1991: 158, 74	3:n;1: present;0: absent;2:y;4:?	Not mentioned
GB136	keda1252	Is constituent order fixed?	2	y		nan	0: absent;1: present;2:y	Not mentioned that there is any variation, There is variation due to topicalisation and focus
GB137	keda1252	Can negation be marked clause-finally?	3	n		nan	3:n;1: present;2:y;0: absent	Not mentioned, Only in some sentences where a normally initial element such as the subject is not present, Negation is marked on the verb which appears clause-initially
GB138	keda1252	Can negation be marked clause-initially?	2	n		nan	2:n;1: present;3:y;0: absent	Not mentioned, Only in some sentences where a normally final element such as the direct object is not present, Negation is marked on the verb which appears clause-finally
GB139	keda1252	Is there a difference between imperative and declarative negation?	2	y	prohibitive kora	Samely 1991: 77	0: absent;1: present;2:y;3:?	Not mentioned, Difference in word order, Difference in the form of the negator, Difference in the presence of a particular element which is not analysed as part of the negator
