Feature_ID	Language_ID	Feature	Value	Answer	Comment	Source	Possible Values	Suggested standardised comments
GB140	keda1252	Are verbal and non-verbal predicates marked by the same negator?	3	y	declarative ohaɁ negates verbal and nominal predicates	Samely 1991: 74, 77	2:n;1: present;0: absent;3:y;4:?	Not mentioned, A special negator or negative form of the verb is used for existential meanings, A special negator or negative form of the copula is used with nominal predicates, A special negator or negative form of the copula is used with predicative adjectives, Other negative forms but which are discounted by the clarifying comment
GB141	keda1252	Are S and O conflated morphologically in at least some basic constructions, i.e. simple main clauses?	2	y		nan	3:n;1: present;0: absent;2:y;4:?	Not mentioned
GB142	keda1252	Are S and A conflated morphologically in at least some basic constructions, i.e. simple main clauses?	2	y		nan	3:n;1: present;0: absent;2:y;4:?	Not mentioned
GB143	keda1252	Are S and O conflated morphologically across clause boundaries, i.e. acting as syntactic pivot?	0	n		nan	0:n;2:no data;1:y;3:?	
GB144	keda1252	Are S and A conflated morphologically across clause boundaries, i.e. acting as syntactic pivot?	0	n		nan	0:n;2:no data;1:y;3:?	
GB145	keda1252	Do S and O operate in the same way, and differently from A, for the purpose of any syntactic construction?	1	n		nan	1:n;0:y;2:?	
GB146	keda1252	Is there a morpho-syntactic distinction between predicates expressing controlled versus uncontrolled events or states?	3	n		nan	3:n;1: present;0: absent;2:y;4:?	Not mentioned, The experiencer is expressed as an object, Only for mental states and emotions, There are verbs with unusual case frames but not necessarily controlled versus uncontrolled
GB147	keda1252	Is there a morphologically marked passive construction?	2	n		nan	2:n;1: present;0: absent;3:?	Not mentioned, The marker is adjacent to the verb but not treated as morphologically bound
GB148	keda1252	Is there a morphologically marked antipassive?	2	n		nan	2:n;1: present;0: absent;3:?	Not mentioned, The marker is adjacent to the verb but not treated as morphologically bound
GB149	keda1252	Is there a morphologically marked inverse?	2	n		nan	2:n;1: present;3:y;0: absent	Not mentioned, The marker is adjacent to the verb but not treated as morphologically bound
GB150	keda1252	Is there clause chaining?	3	n		nan	0: absent;3:n;1: present;4:no data;2:y;5:?	Not mentioned, Hard to distinguish from serial verb constructions
GB151	keda1252	Is there a morphologically-marked switch reference system?	2	n		nan	2:n;1: present;3:y;0: absent	Not mentioned
GB152	keda1252	Is there a morphologically marked distinction between simultaneous and sequential clauses?	3	n		nan	3:n;1: present;0: absent;2:y;4:?	Not mentioned, There is a marker adjacent to the verb but not treated as morphologically bound
GB153	keda1252	Is the verb 'say' or a quotative construction used in desiderative constructions?	0	n	laha 'do, make' and 'want, wish' (tele 'say')	Samely 1991: 71, 224	0:n;2:y;1:?	
GB154	keda1252	Are causatives formed by serial verb constructions?	0	y		nan	1:n;0:y;2:?	
GB155	keda1252	Are causatives formed by affixes/clitics?	2	n		nan	2:n;1: present;3:y;0: absent	Not mentioned, The marker is adjacent to the verb but not treated as morphologically bound
GB156	keda1252	Are causatives formed by constructions involving 'say'?	2	n		nan	2:n;1: present;0: absent	Not mentioned
GB157	keda1252	Is there tail-head linkage?	6	?		nan	0: absent;3:n;1: present;5:no data;4:no d ata;2:y;6:?	Not mentioned
GB158	keda1252	Are verbs reduplicated?	3	n		nan	0: absent;3:n;1: present;4:no data;2:y;5:?	Not mentioned, Some examples but not productive, Possible partial reduplication, There are instances of repeated verbs but that does not count as reduplication
GB159	keda1252	Are nouns reduplicated?	2	n		nan	0: absent;2:n;1: present;4:no data;3:y;5:?	Not mentioned, Some examples but not productive, Possible partial reduplication, The prototypical noun 'book book' type reduplication is known to exist but not other types
GB160	keda1252	Are elements apart from verbs or nouns reduplicated?	2	y	adjectives in superlative construction are reduplicated: wetaq haraka ria-ria neɁe 'house a.litt.e big big 3sg.POSS' 'the biggest house' 	nan	0: absent;4:n;1: present;3:no data;2:y;5:?	Not mentioned, Numerals are reduplicated, Adjectives are reduplicated but are arguably a type of verb, Possible partial reduplication
GB162	keda1252	Is there a distinction between masculine and feminine in 1st person pronouns?	0	n		nan	0:n	
GB163	keda1252	How many genders/noun classes are there?	?	Not known		nan	1:2;3:?;0:several;2:n	
GB165	keda1252	Can trial number be marked on the noun itself?	2	n		nan	2:n;1: present;0: absent	Not mentioned, The marker is adjacent to the noun but not treated as morphologically bound
GB166	keda1252	Can paucal number be marked on the noun itself?	2	n		nan	2:n;1: present;0: absent	Not mentioned, The marker is adjacent to the noun but not treated as morphologically bound
GB167	keda1252	Are there logophoric pronouns for the 3rd person?	2	n		nan	2:n;1: present;0: absent	Not mentioned
GB168	keda1252	Is there a distinction between inanimate and animate in 3rd person singular pronouns?	1	n		nan	1:n;0:y	
GB169	keda1252	Is there a distinction between masculine and feminine in 3rd person singular pronouns?	0	n		nan	0:n	
GB170	keda1252	Can an attributive nominal modifier denoting a property concept agree with any gender/noun class of the noun it modifies?	?	Not known		nan	2:n;1: present;0: absent	Not mentioned, An additional marker dependent on the gender of the noun is present but not called agreement
GB171	keda1252	Can an adnominal demonstrative agree in gender/noun class with the noun it modifies?	?	Not known		nan	2:n;1: present;3:y;0: absent	Not mentioned, An additional marker dependent on the gender of the noun is present but not called agreement
GB172	keda1252	Can articles agree with the gender/noun class of the noun they modify?	?	Not known		nan	2:n;1: present;0: absent	Not mentioned, An additional marker dependent on the gender of the noun is present but not called agreement, It is not clear whether it is an article
GB173	keda1252	Are noun class and number always marked by a portmanteau morpheme on the noun?	?	Not known		nan	0:n	
GB174	keda1252	Are noun class and number marked by a portmanteau morpheme on the noun in singular?	?	Not known		nan	0:n	
GB175	keda1252	Are noun class and number marked by a portmanteau morpheme on the noun in plural?	?	Not known		nan	0:n	
GB176	keda1252	Can agreement of gender/noun class and number be marked by a portmanteau morpheme on other items in the noun phrase?	?	Not known		nan	0:n	
GB177	keda1252	Can the verb carry a marker of animacy of argument, unrelated to any gender/noun class of the argument?	3	n		nan	3:n;1: present;0: absent;2:y;4:?	Not mentioned, Animacy is treated as a gender and therefore the question does not make sense, The marker is adjacent to the verb but not treated as morphologically bound
GB178	keda1252	Are there several different singular genders/noun classes that can have the same plural gender/noun class?	?	Not known		nan	0:n	
GB179	keda1252	Are there genders/noun classes that cannot take number marking?	?	Not known		nan	0:n	
GB181	keda1252	Is number marking obligatory on certain (types of) nouns?	?	Not known		nan	0:n;2:y;1:?	
GB182	keda1252	Is number marking obligatory on animate nouns?	?	Not known		nan	0:n;1:?	
GB183	keda1252	Is number marking obligatory on human nouns?	?	Not known		nan	0:n;1:?	
GB184	keda1252	Can an attributive nominal modifier denoting a property concept agree with the number of the noun it modifies?	2	n		nan	2:n;1: present;0: absent	Not mentioned, An additional marker dependent on the number of the noun is present but not called agreement
GB185	keda1252	Can an adnominal demonstrative agree in number with the noun it modifies?	2	n		nan	2:n;1: present;0: absent	Not mentioned, An additional marker dependent on the number of the noun is present but not called agreement
GB186	keda1252	Can articles agree in number with the noun they modify?	?	Not known		nan	2:n;1: present;0: absent	Not mentioned, An additional marker dependent on the number of the noun is present but not called agreement, It is not clear whether it is an article
GB187	keda1252	Is there any productive diminutive marking on the noun (exclude marking by system of nominal classification only)?	2	n		nan	2:n;1: present;0: absent	Not mentioned, The marker is adjacent to the noun but not treated as morphologically bound
GB188	keda1252	Is there any productive augmentative marking on the noun (exclude marking by system of nominal classification only)?	2	n		nan	2:n;1: present;0: absent	Not mentioned, The marker is adjacent to the noun but not treated as morphologically bound
GB191	keda1252	Is there a morphologically marked middle voice construction?	0	n		nan	0:n;1:?	
GB192	keda1252	Are the noun's phonological properties relevant for any gender assignment?	?	Not known		nan	2:n;1: present;0: absent	Not mentioned, There is gender and it is possible that phonology influences assignment
GB193	keda1252	What is the order of noun and attributive nominal modifier denoting a property concept?	5	2		Samely 1991: 76	4:1;6:n att;0: they cannot be used attributively;2: N - ANM;5:2;3: both;1: ANM - N	Not mentioned, Certain adjectives take a different ordering, Adjectives can take either order
GB194	keda1252	Are there indefinite or non-specific articles?	0	n		nan	0:n;1:y	
GB195	keda1252	Can a noun receive more than one noun class marker at the same time?	?	Not known		nan	0:n	
GB196	keda1252	Is there a gender distinction in 2nd person pronouns?	2	n		nan	2:n;1: present;0: absent	Not mentioned
GB197	keda1252	Is there a gender distinction in 1st person pronouns?	2	n		nan	2:n;1: present;0: absent	Not mentioned
GB198	keda1252	Can a numeral used attributively agree with any gender/noun class of the noun it modifies?	?	Not known		nan	2:n;1: present;3:y;0: absent	Not mentioned, An additional marker dependent on the gender of the noun is present but not called agreement
GB199	keda1252	Can verbs agree with the gender/noun class of the nominal object?	?	Not known		nan	0:n;1:y	
GB200	keda1252	Can verbs agree in number with the nominal object?	2	?	check	nan	1:n;0:y;2:?	
GB202	keda1252	Is there a distinction between masculine and feminine in 2nd person pronouns?	0	n		nan	0:n	
GB203	keda1252	"What is the order of the collective universal quantifier (""all"") and the noun?"	5	2	N followed by rai or réiq = all	Samely and Barnes 2013: 557, 567 	6:3;0: no UQ;5:2;4:0;3: both;2: N-UQ;1: UQ-N;7:?	Not mentioned, 'All' does not modify the noun e.g. it is an adverb
GB204	keda1252	Is there a distinction between collective ('all') and distributive ('every') universal quantifiers?	2	y	di loyo di loyo= 'every day' (di = locative, loyo=day)	Samely and Barnes 2013: 154 	0: absent;6:no;5:n;1: present;4:no data;2:y;3:?	Not mentioned
GB205	keda1252	Is number marking prohibited on inanimate nouns?	?	Not known		nan	0:n;1:?	
GB206	keda1252	Is number marking prohibited on mass nouns?	?	Not known		nan	0:n;1:?	
GB207	keda1252	Is number marking optional on certain (types of) nouns?	?	Not known		nan	0:n;1:y;2:?	
GB208	keda1252	Can singular number be marked by a prefix on the noun?	?	Not known		nan	0:n	
GB209	keda1252	Can singular number be marked by a suffix on the noun?	?	Not known		nan	0:n	
GB210	keda1252	Can singular number be marked by suppletion on the noun?	?	Not known		nan	0:n	
GB211	keda1252	Can singular number be marked by tone alone on the noun?	?	Not known		nan	0:n	
GB212	keda1252	Can dual number be marked by a prefix on the noun?	?	Not known		nan	0:n	
GB213	keda1252	Can dual number be marked by a suffix on the noun?	?	Not known		nan	0:n	
GB214	keda1252	Can dual number be marked by suppletion on the noun?	?	Not known		nan	0:n	
GB215	keda1252	Can dual number be marked by tone alone on the noun?	?	Not known		nan	0:n	
GB216	keda1252	Can dual number be marked by reduplication on the noun?	?	Not known		nan	0:n	
GB217	keda1252	Can plural number be marked by a prefix on the noun?	?	Not known		nan	0:n	
GB218	keda1252	Can plural number be marked by a suffix on the noun?	?	Not known		nan	0:n;1:y	
GB219	keda1252	Can plural number be marked by suppletion on the noun?	?	Not known		nan	0:n	
GB220	keda1252	Can plural number be marked by tone alone on the noun?	?	Not known		nan	0:n	
GB221	keda1252	Can plural number be marked by reduplication on the noun?	?	Not known		nan	0:n;1:y	
GB222	keda1252	Can trial number be marked by a prefix on the noun?	?	Not known		nan	0:n	
GB223	keda1252	Can trial number be marked by a suffix on the noun?	?	Not known		nan	0:n	
GB224	keda1252	Can trial number be marked by suppletion on the noun?	?	Not known		nan	0:n	
GB225	keda1252	Can trial number be marked by tone alone on the noun?	?	Not known		nan	0:n	
GB226	keda1252	Can trial number be marked by reduplication on the noun?	?	Not known		nan	0:n	
GB227	keda1252	Can paucal number be marked by a prefix on the noun?	?	Not known		nan	0:n	
GB228	keda1252	Can paucal number be marked by a suffix on the noun?	?	Not known		nan	0:n	
GB229	keda1252	Can paucal number be marked by suppletion on the noun?	?	Not known		nan	0:n	
GB230	keda1252	Can paucal number be marked by tone alone on the noun?	?	Not known		nan	0:n	
GB231	keda1252	Can paucal number be marked by reduplication on the noun?	?	Not known		nan	0:n	
GB232	keda1252	Can diminutive be marked by a prefix on the noun?	?	Not known		nan	0:n	
GB234	keda1252	Can diminutive be marked by a suffix on the noun?	?	Not known		nan	0:n	
GB235	keda1252	Can diminutive be marked by suppletion on the noun?	?	Not known		nan	0:n	
GB236	keda1252	Can diminutive be marked by tone on the noun?	?	Not known		nan	0:n	
GB237	keda1252	Can diminutive be marked by reduplication on the noun?	?	Not known		nan	0:n	
GB238	keda1252	Can diminutive be marked by noun class selection?	?	Not known		nan	0:n	
GB239	keda1252	Can augmentative be marked by a prefix on the noun?	?	Not known		nan	0:n	
GB240	keda1252	Can augmentative be marked by a suffix on the noun?	?	Not known		nan	0:n	
GB241	keda1252	Can augmentative be marked by suppletion on the noun?	?	Not known		nan	0:n	
GB242	keda1252	Can augmentative be marked by tone on the noun?	?	Not known		nan	0:n	
GB243	keda1252	Can augmentative be marked by reduplication on the noun?	?	Not known		nan	0:n	
GB244	keda1252	Can augmentative be marked by noun class selection?	?	Not known		nan	0:n	
GB245	keda1252	Can gender/noun class be marked by a prefix on the noun?	?	Not known		nan	0:n	
GB246	keda1252	Can gender/noun class be marked by a suffix on the noun?	?	Not known		nan	0:n	
GB247	keda1252	Can gender/noun class be marked by suppletion on the noun?	?	Not known		nan	0:n	
GB248	keda1252	Can gender/noun class be marked by tone on the noun only?	?	Not known		nan	0:n	
GB249	keda1252	Are there variations in marking strategies of core participants?	1	y		nan	0:n;1:y	
GB250	keda1252	Can predicative possession be formed with a habeo-verb?	3	n	koɁ is listed by S 1991 as 'to have, possess' but this is in fact the 1sg.POSS pronoun	Samely 1991: 178	3:n;1: present;0: absent;2:y;4:?	Not mentioned, The habeo verb is also an existential verb
GB251	keda1252	Can predicative possession be formed by an intransitive construction with an locational/existential/copula predicate where the possessum is the subject?	1	n	: my house (is) big-3sg, my house (is) big-3sg.NOML	Samely 1991: 76	1:n;0:y;2:?	
GB252	keda1252	Can predicative possession be formed with a locative possessive?	3	n		nan	3:n;1: present;0: absent;2:y;4:?	Not mentioned
GB253	keda1252	Can predicative possession be formed with a dative possessive?	3	n		nan	3:n;1: present;0: absent;2:y;4:?	Not mentioned
GB254	keda1252	Can predicative possession be formed with a genitive possessive?	3	n		nan	3:n;1: present;0: absent;2:y;4:?	Not mentioned
GB255	keda1252	Can predicative possession be formed with a topic possessive?	2	n		nan	2:n;1: present;0: absent;3:?	Not mentioned
GB256	keda1252	Can predicative possession be formed with a conjunctional possessive?	2	n		nan	2:n;1: present;0: absent;3:?	Not mentioned
GB257	keda1252	Can polar interrogation be marked by intonation only?	2	y	this is inferred from the examples in the text	e.g. Samely 1991: 71, 154	3:n;1: present;0: absent;2:y;4:?	Not mentioned, The question particle carries tone but this might also be intonation
GB258	keda1252	Is the polar interrogative intonation rising?	1	?		nan	2:no data;0:y;1:?	
GB259	keda1252	Is the polar interrogative intonation falling?	1	?		nan	0:n;2:no data;3:y;1:?	
GB260	keda1252	Can polar interrogation be marked by change in word order only?	2	n		nan	2:n;1: present;0: absent	Not mentioned
GB261	keda1252	Can polar interrogation be marked by a particle only?	0	n		nan	0:n;1:y;2:?	
GB262	keda1252	Is there a clause-initial polar interrogative particle?	?	Not known		nan	2:n;1: present;0: absent;3:?	Not mentioned, The elements used in polar interrogation are distributed over the clause
GB263	keda1252	Is there a clause-final polar interrogative particle?	?	Not known		nan	4:n;1: present;0: absent;2:y;3:?	Not mentioned, The elements used in polar interrogation are distributed over the clause
GB264	keda1252	Is there a clause-medial polar interrogative particle?	?	Not known		nan	2:n;1: present;0: absent;3:?	Not mentioned, The elements used in polar interrogation are distributed over the clause
GB265	keda1252	"Can comparative constructions be construed with a verb meaning ""surpass"" or ""exceed""?"	4	y	ketang 'surpass'	Samely 1991: 86	0: absent;3:n;1: present;2:no data;4:y;5:?	Not mentioned
GB266	keda1252	Can comparative constructions be construed with a locative comparative?	2	n		nan	0: absent;2:n;1: present;4:no data;3:y;5:?	Not mentioned
GB267	keda1252	Can comparative constructions be construed with a from-comparative?	0	n		nan	0:n;1:no data;2:y;3:?	
GB268	keda1252	Can comparative constructions be construed with a to-comparative?	0	n		nan	0:n;2:no data;1:y;3:?	
GB269	keda1252	Can comparative constructions be construed with a benefactive comparative?	0	n		nan	0:n;1:no data;2:?	
GB270	keda1252	Can comparative constructions be construed with conjoined clauses?	4	n		nan	0: absent;4:n;1: present;2:no data;3:y;5:?	Not mentioned
GB271	keda1252	Are the predicates in the conjoined comparative construction antonyms?	?	Not known		nan	1:n;0:no data;3:y;2:?	
GB272	keda1252	Do the  predicates in the conjoined comparative construction differ in polarity?	?	Not known		nan	1:n;0:no data;3:y;2:?	
GB273	keda1252	Can comparative constructions be construed with a particle?	2	n		nan	0: absent;2:n;1: present;3:no data;4:y;5:?	Not mentioned
GB274	keda1252	Is the element marking the gradable property concepts in the comparative construction marked for comparison in any way?	2	y	hara(ka) 'a little'	Samely 1991: 86	1:n;0:no data;2:y;3:?	
GB275	keda1252	Is the element marking the property concept in the comparative construction marked by an affix indicating comparision or grading?	2	n		nan	0: absent;2:n;1: present;4:no data;3:y;5:?	Not mentioned, The marker is adjacent to the property word but not treated as morphologically bound
GB276	keda1252	Is the element marking the property concept in the comparative construction marked by a sepeare degree word indicating comparision or grading?	3	y		nan	0: absent;2:n;1: present;4:no data;3:y;5:?	Not mentioned, The marker is adjacent to the property word but not treated as morphologically bound
GB277	keda1252	Can comparative constructions be construed with a at-comparative?	0	n		nan	0:n;2:no data;1:y;3:?	
GB278	keda1252	Is there variation in conflation of arguments marking core participants?	1	n		nan	1:n;2:no data;0:y;3:?	
GB279	keda1252	Is there variation in conflation of core participants based on TAM distinctions?	?	Not known		nan	2:n;1: present;3:no data;0: absent;4:?	Not mentioned
GB280	keda1252	Are variation in conflation of core participants based on verb classes?	?	Not known		nan	1:n;2:no data;0:y;3:?	
GB281	keda1252	Is there variation in conflation of core participants based on clause type, e.g. main vs. subordinate?	?	Not known		nan	2:n;1: present;3:no data;0: absent;4:?	Not mentioned
GB282	keda1252	Are variation in conflation of core participants based on person distinctions?	?	Not known		nan	1:n;2:no data;0:y;3:?	
GB283	keda1252	Can verbs agree with the gender/noun class of the nominal subject?	?	Not known		nan	0:n;1:y	
GB284	keda1252	Can verbs agree with the number of the nominal subject?	2	?	check	nan	0:n;1:y;2:?	
GB285	keda1252	Can polar interrogation be marked by a question particle and verbal morphology?	2	n		nan	2:n;1: present;3:y;0: absent	Not mentioned, The marker is adjacent to the verb but not treated as morphologically bound
GB286	keda1252	Can polar interrogation be marked by verbal morphology only?	2	n		nan	2:n;1: present;0: absent	Not mentioned, The marker is adjacent to the verb but not treated as morphologically bound
GB287	keda1252	Can recipients be treated as a transitive object, i.e. as Direct Object in terms of case marking?	?	Not known		nan	1:y?;0:n	
GB288	keda1252	Can recipients be treated as a transitive object, i.e. as Direct Object in terms of core argument marking by adpositions?	?	Not known		nan	0:n	
GB289	keda1252	Can recipients be treated as a transitive object, i.e. as Direct Object in terms of verbal agreement marking?	?	Not known		nan	0:n;1:y;2:?	
GB290	keda1252	Can recipients be treated as a transitive object, i.e. as Direct Object in terms of verbal person marking (not agreement)?	?	Not known		nan	1:n;0:y	
GB291	keda1252	Can polar interrogation be marked by tone?	?	Not known		nan	2:n;1: present;3:?;0: absent	Not mentioned, The question particle carries tone but this might also be intonation
GB292	keda1252	Is the particle marking polar interrogation not tone?	?	Not known		nan	1:n;0:y;2:?	
GB294	keda1252	Are there ideophones that depict sensory imagery beyond sound?	2	?		nan	0:n;1:no data;2:?	
GB295	keda1252	Can ideophones act like verbs?	3	?		nan	1:n;2:no data;0:y;3:?	
GB295	keda1252	Can ideophones act like verbs?	3	?		nan	1:n;2:no data;0:y;3:?	
GB296	keda1252	Is there a morphosyntactically definable class of ideophones (beyond sound)?	?	Not known		nan	2:n;1: present;4:no data;0: absent;3:?	Not mentioned
GB297	keda1252	Can polar interrogation be marked by a construction of the type “V Neg V”?	?	Not known		nan	0: absent;1: present	Not mentioned
GB298	keda1252	Can standard negation be marked by negative auxiliaries?	?	Not known		nan	0: absent;1: present	Not mentioned, Unclear whether it should count as an auxiliary given that no verbs carry inflection
GB299	keda1252	Can standard negation be marked by a freestanding particle?	?	Not known		nan	0: absent;1: present	Not mentioned
GB300	keda1252	Is there a verb for the function 'give' that is suppletive for any grammatical category?	?	Not known		nan	0: absent;1: present	Not mentioned
GB301	keda1252	Does the language have inclusory constructions productively?	?	Not known		nan	0: absent;1: present	Not mentioned
GB302	keda1252	Is there a dedicated, obligatory and productive construction that marks passive voice, not morphologically on the verb nor on the A argument?	?	Not known		nan	0: absent;1: present	Not mentioned, The marker is adjacent to the verb but it is unclear whether it is morphologically bound
GB303	keda1252	Is there a dedicated, obligatory, productive construction that marks antipassive voice, not morphologically on the verb?	?	Not known		nan	0: absent;1: present	Not mentioned, The marker is adjacent to the verb but it is unclear whether it is morphologically bound
GB304	keda1252	Can the A argument be overtly expressed in a passive clause or be overtly marked to signal a passive clause?	?	Not known		nan	0: absent;1: present	Not mentioned
GB305	keda1252	Are there phonologically independent reflexive pronouns?	?	Not known		nan	0: absent;1: present	Not mentioned, Not clear if they are phonologically independent
GB306	keda1252	Are there reciprocal pronouns that are not-bipartite?	?	Not known		nan	0: absent;1: present	Not mentioned
GB307	keda1252	Are there bipartite reciprocal pronouns?	?	Not known		nan	0: absent;1: present	Not mentioned
GB308	keda1252	Can tense be marked by a productive, obligatory and dedicated construction that is not morphologically bound to the verb?	?	Not known		nan	0: absent;1: present	Not mentioned, The marker is adjacent to the verb but not treated as morphologically bound
GB309	keda1252	Are there multiple past or future tenses, distinguishing distance from Time of Reference, in any form?	?	Not known		nan	0: absent;1: present	Not mentioned, The marker is adjacent to the verb but not treated as morphologically bound
GB310	keda1252	Can aspect be marked by a productive, obligatory and dedicated construction that is not morphologically bound to the verb?	?	Not known		nan	0: absent;1: present	Not mentioned, The marker is adjacent to the verb but not treated as morphologically bound
GB311	keda1252	Can mood be marked by a productive, obligatory and dedicated construction that is not morphologically bound to the verb?	?	Not known		nan	0: absent;1: present	Not mentioned, The marker is adjacent to the verb but not treated as morphologically bound
GB312	keda1252	Can modal distinctions be marked on the verb, productively, dedicatedly and obligatorily?	?	Not known		nan	0: absent;1: present	Not mentioned, The marker is adjacent to the verb but not treated as morphologically bound
GB313	keda1252	Are there possessive pronouns?	?	Not known		nan	0: absent;1: present	Not mentioned
GB314	keda1252	Can augmentative be marked productively by a system of nominal classification?	?	Not known		nan	0: absent;1: present	Not mentioned
GB315	keda1252	Can diminutive be marked productively by a system of nominal classification?	?	Not known		nan	0: absent;1: present	Not mentioned
