Feature_ID	Language_ID	Feature	Value	Answer	Comment	Source	Possible Values	Suggested standardised comments
GB316	keda1252	Can singular number of a noun be marked by a productive, obligatory and dedicated marker in the noun phrase that is not bound to the noun and is not an agreement exponent of a plural marker on the noun?	?	Not known		nan	0: absent;1: present	Not mentioned, The marker is adjacent to the verb and it is unclear whether it is morphologically bound to it
GB317	keda1252	Can dual number of a noun be marked by a productive, obligatory and dedicated marker in the noun phrase that is not bound to the noun and is not an agreement exponent of a plural marker on the noun?	?	Not known		nan	0: absent;1: present	Not mentioned, The marker is adjacent to the verb and it is unclear whether it is morphologically bound to it
GB318	keda1252	Can plural number of a noun be marked by a productive, obligatory and dedicated marker in the noun phrase that is not bound to the noun and is not an agreement exponent of a plural marker on the noun?	?	Not known		nan	0: absent;1: present	Not mentioned, The marker is adjacent to the verb and it is unclear whether it is morphologically bound to it
GB319	keda1252	Can trial number of a noun be marked by a productive, obligatory and dedicated marker in the noun phrase that is not bound to the noun and is not an agreement exponent of a plural marker on the noun?	?	Not known		nan	0: absent;1: present	Not mentioned, The marker is adjacent to the verb and it is unclear whether it is morphologically bound to it
GB320	keda1252	Can paucal number of a noun be marked by a productive, obligatory and dedicated marker in the noun phrase that is not bound to the noun and is not an agreement exponent of a plural marker on the noun?	?	Not known		nan	0: absent;1: present	Not mentioned, The marker is adjacent to the verb and it is unclear whether it is morphologically bound to it
GB321	keda1252	Is there an open class of noun stems that are assigned to gender/noun class categories arbitrarily?	?	Not known		nan	0: absent;1: present	Not mentioned, There may be a gender or noun class system but it seems to be semantic
GB322	keda1252	Does the language encode direct evidentiality (perceived with senses)?	?	Not known		nan	0: absent;1: present	Not mentioned
GB323	keda1252	Does the language encode indirect evidentiality (hearsay, inference, etc.)?	?	Not known		nan	0: absent;1: present	Not mentioned
GB324	keda1252	Are some content interrogatives (who?, what?, etc.) expressed in interrogative verbs?	?	Not known		nan	0: absent;1: present	Not mentioned
GB325	keda1252	Is there a count/mass distinction in content interrogatives (e.g. English how many vs. how much)?	?	Not known		nan	0: absent;1: present	Not mentioned
GB326	keda1252	Do (nominal) content interrogatives normally or frequently occur in situ (i.e. in the normal position for a non-interrogative NP in the same participant role)?	?	Not known		nan	0: absent;1: present	Not mentioned
GB327	keda1252	Can the relative clause follow the noun?	?	Not known		nan	0: absent;1: present	Not mentioned
GB328	keda1252	Can the relative clause precede the noun?	?	Not known		nan	0: absent;1: present	Not mentioned
GB329	keda1252	Are there internally-headed relative clauses?	?	Not known		nan	0: absent;1: present	Not mentioned
GB330	keda1252	Are there correlative relative clauses?	?	Not known		nan	0: absent;1: present	Not mentioned
GB331	keda1252	Are there adjoined relative clauses?	?	Not known		nan	0: absent;1: present	Not mentioned
GB332	keda1252	Are there double-headed relative clauses?	?	Not known		nan	0: absent;1: present	Not mentioned
GB333	keda1252	Is there a decimal counting system?	2	y		nan	0: absent;1: present;2:y	Not mentioned
GB334	keda1252	Is there synchronic evidence for any element of a quinary counting system?	?	Not known		nan	0: absent;1: present	Not mentioned
GB335	keda1252	Is there synchronic evidence for any element of a vigesimal counting system?	?	Not known		nan	0: absent;1: present	Not mentioned
GB336	keda1252	Is there a body-part tallying system?	2	n		nan	2:n;1: present;0: absent	Not mentioned
GB502	keda1252	What is the relative position of possessor pronoun and possessed in the attributive possessive construction?	0	1		nan	0:1;2:2;1:n pospro	
GB503	keda1252	Are S and A marked by the same affix/clitic?	0	y	in some cases, A can be an enclitic just like S is	nan	1:n;0:y	
GB508	keda1252	Are there core adjectives (elements denoting property concepts) that act like nouns?	0	n		nan	0:n	
GB509	keda1252	Are demonstratives used pronominally?	0	y		Samely 1991: 118	1:n;0:y;2:?	
GB510	keda1252	Are demonstratives used adnominally?	0	y		Samely 1991: 119	0:y	
GB511	keda1252	Do demonstratives encode elevation?	0	y	ote 'that up there; eastward', ole 'that down there; westward'	Samely 1991: 119	1:n;0:y;2:?	
GB512	keda1252	Is there an opposition between three or more elevation terms in the demonstrative system?	1	n		nan	1:n;0:y;2:?	
GB514	keda1252	Is animacy distinguished in the demonstrative system?	0	n		nan	0:n;1:y;2:?	
GB515	keda1252	Is humanness distinguished in the demonstrative system?	0	n		nan	0:n;1:?	
GB516	keda1252	How are locationals and demonstratives formally related?	3	2	oyo->/>oyoɁ/	Samely 1991: 127	0:1;2:0;1:3;3:2;4:?	
GB517	keda1252	Is there an opposition between three or more distance terms in the locational system?	1	n		nan	1:n;0:y;2:?	
GB518	keda1252	Do locationals encode elevation?	0	y		nan	1:n;0:y;2:?	
GB519	keda1252	Is there an opposition between three or more elevation terms in the locational system?	1	n		nan	1:n;0:y;2:?	
GB520	keda1252	Do locationals encode direction (based on a coordinate system)?	0	y		nan	1:n;0:y;2:?	
GB521	keda1252	Is the opposition visible-non-visible marked on locationals?	0	n		nan	0:n;1:y;2:?	
R1102	keda1252	How many places of articulation are there for stops?	1	3		nan	2:5;0:4;1:3	
R1103	keda1252	How many places of articulation are there for nasals?	0	3		nan	1:2;0:3	
R1103a	keda1252	Are there as many points of articulation for nasals as there are for stops?	1	y		nan	0:n;1:y	
R1103b	keda1252	Is there contrast between heterorganic and homorganic sequence of nasal and velar stop?	0	n		nan	0:n	
R1105	keda1252	Are there fricative phonemes?	0	y		nan	0:y	
R1106	keda1252	Are there phonemic prenasalised stops?	0	n		nan	0:n	
R1107	keda1252	Is there a phonemic distinction between l/r?	0	y		nan	0:y	
R1108	keda1252	Is there a phonemic velar fricative or glide?	0	n		nan	0:n;1:y	
R1109	keda1252	Is there a voicing contrast between oral (i.e. non-prenasal) stops?	0	y		nan	1:n;0:y	
R1109a	keda1252	Is there a laminal/apical contrast?	0	n		nan	0:n	
R1109b	keda1252	Are there retroflexed consonants?	0	n		nan	0:n	
R1110	keda1252	Is there phonemic consonant length?	0	n		nan	0:n;1:y	
R1111	keda1252	Is there phonemic vowel length?	1	n		nan	1:n;0:y	
R1112	keda1252	Are there contrastive phonation types for vowels?	1	y		nan	0:n;1:y	
R1113a	keda1252	Are there two or more contrastive central vowels?	1	n		nan	1:n;0:y	
R1115	keda1252	Is there lexically determined suprasegmental prominence?	1	n		nan	1:n;0:y	
R1116	keda1252	Is there weight-sensitive suprasegmental prominence	?	Not known		nan	1:n;0:y	
R1117	keda1252	Is there syllable position sensitive suprasegmental prominence?	0	y		Samely and Barnes: 16	1:n;2:no data;0:y;3:?	
R1118	keda1252	Is there a tonal system?	1	n		nan	1:n;0:y	
R1202	keda1252	Are there word-final consonants?	0	y		nan	0:y	
R1203a	keda1252	Are there consonant clusters (not counting prenasalized consonants) in syllable onset?	0	n		nan	0:n;1:y	
R1204	keda1252	Are there consonant clusters (not counting prenasalized consonants) in syllable coda?	0	n		nan	0:n;1:y	
R2203	keda1252	Is number marked in pronouns?	0	y		nan	0:y	
R2504a	keda1252	Is plant status a relevant category in the noun class/gender system?	?	Not known		nan	1:n;0:y	
R2507	keda1252	Is there concord beyond the NP, i.e. agreement of elements outside the NP with the noun class of a noun?	?	Not known		nan	0:n	
R2508	keda1252	Are there classifiers?	0	y	uren: general classifier used as counter for numerals 1-10 and for any countable noun; uluq 'seed, kernel, stone' used with numerals 1-10 and for round objects; ateused as a classifier for humans. 	Samely 1991:96, 90 	1:n;0:y;2:?	
R2601	keda1252	Are there possessive classes?	1	n		nan	1:n;0:y	
R2702	keda1252	Is there evidence for any element of a quinary counting system?	0	y		nan	1:n;0:y	
R2703b	keda1252	Is there a minimal counting system or no clear number altogether?	0	n		nan	0:n	
R3103	keda1252	Do the same morphemes systematically encode both TAM and person?	?	Not known		nan	0:n	
R3502	keda1252	Is gender marked anywhere separately to person?	0	n		nan	0:n	
R3605	keda1252	Is there intransitivising morphology (include clitics)?	0	n		nan	0:n;2:y;1:?	
R4305a	keda1252	Are there relative clauses, i.e. embedded construction by which a clause modifies a head N?	2	n	agent focus pronouons with marker -ti are used to render clauses that are translated as subject relative clauses	Samely 1991: 81	2:n;0:y;1:?	
R4307	keda1252	Are there purposive non-finite subordinate clauses?	0	n		nan	0:n;1:y;2:?	
R4308	keda1252	Are there temporal non-finite subordinate clauses?	1	y	bahe 'completed, finished' follows main clause	Samely 1991: 90-91	0:n;1:y;2:?	
R4308a	keda1252	Are there conditional non-finite subordinate clauses?	0	y	la 'if'	Samely and Barnes 2013: 324	1:n;0:y;2:?	
R4309a	keda1252	Are there complement clauses for speech verbs?	0	y	tèhèɁ-tèlè 'speak-say' is followed by juxtaposed quote	Samely 1991: 151 vv	1:n;3:no data;0:y;2:?	
R4309b	keda1252	Are there complement clauses for perception verbs?	0	y	boraɁ 'see' followed by juxtaposed clause	Samely 1991: 157	1:n;3:no data;0:y;2:?	
R4309c	keda1252	Is there a complementizer that precedes a complement clause?	0	n		nan	0:n;1:no data;2:y;3:?	
R4309d	keda1252	Is there a complementizer that follows a complement clause?	0	n		nan	0:n;1:no data;2:y;3:?	
R4311	keda1252	Are there participle or gerund constructions, morphologically separate from RC or subordinate clauses?	0	n		nan	0:n;1:?	
R5202	keda1252	Is there a construction encoding kin dyads?	2	y	ino amo 'parents'	nan	1:n;0:no data;2:y;3:?	
R5203	keda1252	Is the term for father the same as the term for father's brother  (i.e. F = FB)?	1	y	FB = amo (utun) 'father (small)'	nan	0:n;3:no data;1:y;2:?	
R5204	keda1252	Is the term for mother's brother the same as the term for father's brother (i.e. MB = FB)?	0	n	MB = epu	nan	0:n;3:no data;1:y;2:?	
R5205	keda1252	Are there self-converse grandparent terms?	2	?		nan	0:n;1:no data;2:?	
R5206	keda1252	Is there a terminological distinction between cross- and parallel-cousins?	1	y		nan	0:n;3:no data;1:y;2:?	
R5207	keda1252	Is there a terminological distinction between first and second cousins (for at least some types of cousin)?	1	y		nan	0:n;3:no data;1:y;2:?	
R5208	keda1252	Is there a terminological distinction between patrilateral and matrilateral cousins (for at least some types of cousin)?	1	y		nan	0:n;3:no data;1:y;2:?	
R5209	keda1252	Is the term for a man's child distinct from the term for a woman's child?	0	n		nan	0:n;2:no data;1:?	
R5210	keda1252	Is the term for a man's child the same as the term for a woman's brother's child?	0	y		nan	1:n;3:no data;0:y;2:?	
R5211	keda1252	Is relative age a factor in differentiating at least one sibling term?	0	y	ariɁ 'younger sibling', aɁe 'older sibling'	nan	1:no data;0:y;2:?	
R5212	keda1252	Is sex of referent a factor in differentiating at least one sibling term?	0	n		nan	0:n;3:no data;1:y;2:?	
SD224	keda1252	What is the relative position of possessor noun and possessed in the attributive possessive construction?	0	1		Samely 1991: 154	0:1;1:posn n;2:3	
SD295	keda1252	Do demonstratives encode direction (based on a coordinate system)?	0	y	oli 'landwards', owe 'seawards', oyo 'perpendicular to land-sea line', ote 'eastward', ole 'westwards'	Samely 1991:117-119	1:n;0:y;2:?	
SD319	keda1252	Are S and A marked by the same prefix/proclitic?	?	Not known		nan	0:n;1:y	
SD320	keda1252	Are S and A marked by the same suffix/enclitic?	?	Not known		nan	0:n;1:?	
SD321	keda1252	Are S and O marked by the same affix/clitic?	0	y		nan	1:n;0:y	
SD341	keda1252	Can negation be marked postverbally?	1	n		nan	1:n;0:y	
SD342	keda1252	Can negation be marked preverbally?	1	y		nan	0:n;1:y	
SD343	keda1252	Are there negative verbs?	0	y	daeɁ 'not want, reject,refuse'	Samely 1991: 155, 217	1:n;0:y;2:?	
SD344	keda1252	Are there adjectives (elements denoting property concepts) that act like nouns?	?	Not known		nan	0:n;1:y	
SD369	keda1252	Can ideophones act like their own morphosyntactic class?	2	?		nan	0:n;1:no data;2:?	
SD381	keda1252	Is sex of speaker a factor in differentiating at least one sibling term?	1	n		nan	1:n;3:no data;0:y;2:?	
SD388	keda1252	Are there allophonic phonation types for vowels?	?	Not known		nan	1:n;0:y	
SD389	keda1252	Is there nominalizing morphology?	?	Not known		nan	0:y	
SD390	keda1252	Can horizontal direction be marked in demonstratives?	?	Not known		nan	0:n;1:y	
SD391	keda1252	Is there a predicative possessive construction?	?	Not known		nan	0:y	
SD392	keda1252	Are S and O marked by the same prefix/proclitic?	?	Not known		nan	0:n	
SD393	keda1252	Are S and O marked by the same suffix/enclitic?	?	Not known		nan	0:n	
SD394	keda1252	Are there suppletive forms for negated verbs?	?	Not known		nan	0:y	
SD395	keda1252	Is topological information expressed by adpositions?	?	Not known		nan	0:n	
SD396	keda1252	Is topological information expressed by nouns?	?	Not known		nan	0:y	
SD397	keda1252	Are there native terms expressing directions in space on a geocentric coordinate system (geocentric terms)?	?	Not known		nan	0:y	
SD398	keda1252	Do geocentric terms have deictic use?	?	Not known		nan	0:y	
SD399	keda1252	Can geocentric terms function as adverbs?	?	Not known		nan	0:y	
SD400	keda1252	Can geocentric terms function as adpositions?	?	Not known		nan	0:y	
SD401	keda1252	Can demonstratives function as adverbs (without changing its form)?	?	Not known		nan	1:n;0:y	
SD402	keda1252	Can demonstratives function as prepositions (without changing its form)?	?	Not known		nan	1:n;0:y	
SD403	keda1252	Is it possible to employ an absolute frame of reference when expressing projective spatial relations?	?	Not known		nan	0:y	
SD404	keda1252	Is it possible to employ an intrinsic frame of reference when expressing projective spatial relations?	?	Not known		nan	0:y	
SD405	keda1252	Is it possible to employ a relative frame of reference when expressing projective spatial relations?	?	Not known		nan	0:n;1:?	
SD406	keda1252	Is it possible to use another frame of reference?	?	Not known		nan	0:y;1:?	
SD407	keda1252	Which frame of reference is preferred in the expression of projective spatial relations?	?	Not known		nan	0:a;1:?	
