Feature_ID	Language_ID	Feature	Value	Answer	Comment	Source	Possible Values	Suggested standardised comments
GB142	teiw1235	Are S and A conflated morphologically in at least some basic constructions, i.e. simple main clauses?	3	n		nan	4:?;1: present;2:y;3:n;0: absent	Not mentioned
GB143	teiw1235	Are S and O conflated morphologically across clause boundaries, i.e. acting as syntactic pivot?	0	n		nan	2:no data;3:?;1:y;0:n	
GB144	teiw1235	Are S and A conflated morphologically across clause boundaries, i.e. acting as syntactic pivot?	1	y		nan	2:no data;3:?;1:y;0:n	
GB145	teiw1235	Do S and O operate in the same way, and differently from A, for the purpose of any syntactic construction?	1	n		nan	2:?;0:y;1:n	
GB146	teiw1235	Is there a morpho-syntactic distinction between predicates expressing controlled versus uncontrolled events or states?	3	n		nan	4:?;1: present;2:y;3:n;0: absent	Not mentioned, The experiencer is expressed as an object, Only for mental states and emotions, There are verbs with unusual case frames but not necessarily controlled versus uncontrolled
GB147	teiw1235	Is there a morphologically marked passive construction?	2	n		Klamer 2010: 30, 515	3:?;1: present;2:n;0: absent	Not mentioned, The marker is adjacent to the verb but not treated as morphologically bound
GB148	teiw1235	Is there a morphologically marked antipassive?	2	n		nan	3:?;1: present;2:n;0: absent	Not mentioned, The marker is adjacent to the verb but not treated as morphologically bound
GB149	teiw1235	Is there a morphologically marked inverse?	2	n		nan	1: present;3:y;2:n;0: absent	Not mentioned, The marker is adjacent to the verb but not treated as morphologically bound
GB150	teiw1235	Is there clause chaining?	3	n		Klamer 2010: 31	5:?;0: absent;4:no data;1: present;2:y;3:n	Not mentioned, Hard to distinguish from serial verb constructions
GB151	teiw1235	Is there a morphologically-marked switch reference system?	2	n		Klamer 2010: 395	1: present;3:y;2:n;0: absent	Not mentioned
GB152	teiw1235	Is there a morphologically marked distinction between simultaneous and sequential clauses?	2	y	The difference is encoded with different conjunctions/particles	nan	4:?;1: present;2:y;3:n;0: absent	Not mentioned, There is a marker adjacent to the verb but not treated as morphologically bound
GB153	teiw1235	Is the verb 'say' or a quotative construction used in desiderative constructions?	0	n	The verb xogo' 'want, wish' is used	nan	1:?;2:y;0:n	
GB154	teiw1235	Are causatives formed by serial verb constructions?	1	n	Expressed by sequences of clauses.	Klamer 201): 378	2:?;0:y;1:n	
GB155	teiw1235	Are causatives formed by affixes/clitics?	2	n		nan	1: present;3:y;2:n;0: absent	Not mentioned, The marker is adjacent to the verb but not treated as morphologically bound
GB156	teiw1235	Are causatives formed by constructions involving 'say'?	2	n		nan	1: present;2:n;0: absent	Not mentioned
GB157	teiw1235	Is there tail-head linkage?	3	n		nan	6:?;0: absent;5:no data;1: present;4:no d ata;2:y;3:n	Not mentioned
GB158	teiw1235	Are verbs reduplicated?	2	y		nan	5:?;0: absent;4:no data;1: present;2:y;3:n	Not mentioned, Some examples but not productive, Possible partial reduplication, There are instances of repeated verbs but that does not count as reduplication
GB159	teiw1235	Are nouns reduplicated?	3	y		nan	5:?;0: absent;4:no data;1: present;3:y;2:n	Not mentioned, Some examples but not productive, Possible partial reduplication, The prototypical noun 'book book' type reduplication is known to exist but not other types
GB160	teiw1235	Are elements apart from verbs or nouns reduplicated?	2	y		Klamer 2010:62-63	5:?;0: absent;3:no data;1: present;2:y;4:n	Not mentioned, Numerals are reduplicated, Adjectives are reduplicated but are arguably a type of verb, Possible partial reduplication
GB162	teiw1235	Is there a distinction between masculine and feminine in 1st person pronouns?	0	n		nan	0:n	
GB163	teiw1235	How many genders/noun classes are there?	4	n/a		nan	4:n/a;3:?;2:n;1:2;0:several	
GB165	teiw1235	Can trial number be marked on the noun itself?	2	n		nan	1: present;2:n;0: absent	Not mentioned, The marker is adjacent to the noun but not treated as morphologically bound
GB166	teiw1235	Can paucal number be marked on the noun itself?	2	n		nan	1: present;2:n;0: absent	Not mentioned, The marker is adjacent to the noun but not treated as morphologically bound
GB167	teiw1235	Are there logophoric pronouns for the 3rd person?	2	n		nan	1: present;2:n;0: absent	Not mentioned
GB168	teiw1235	Is there a distinction between inanimate and animate in 3rd person singular pronouns?	1	n		nan	0:y;1:n	
GB169	teiw1235	Is there a distinction between masculine and feminine in 3rd person singular pronouns?	0	n		nan	0:n	
GB170	teiw1235	Can an attributive nominal modifier denoting a property concept agree with any gender/noun class of the noun it modifies?	3	n/a		nan	3:n/a;1: present;2:n;0: absent	Not mentioned, An additional marker dependent on the gender of the noun is present but not called agreement
GB171	teiw1235	Can an adnominal demonstrative agree in gender/noun class with the noun it modifies?	4	n/a		nan	4:n/a;1: present;3:y;2:n;0: absent	Not mentioned, An additional marker dependent on the gender of the noun is present but not called agreement
GB172	teiw1235	Can articles agree with the gender/noun class of the noun they modify?	3	n/a		nan	3:n/a;1: present;2:n;0: absent	Not mentioned, An additional marker dependent on the gender of the noun is present but not called agreement, It is not clear whether it is an article
GB173	teiw1235	Are noun class and number always marked by a portmanteau morpheme on the noun?	1	n/a		nan	1:n/a;0:n	
GB174	teiw1235	Are noun class and number marked by a portmanteau morpheme on the noun in singular?	1	n/a		nan	1:n/a;0:n	
GB175	teiw1235	Are noun class and number marked by a portmanteau morpheme on the noun in plural?	1	n/a		nan	1:n/a;0:n	
GB176	teiw1235	Can agreement of gender/noun class and number be marked by a portmanteau morpheme on other items in the noun phrase?	1	n/a		nan	1:n/a;0:n	
GB177	teiw1235	Can the verb carry a marker of animacy of argument, unrelated to any gender/noun class of the argument?	2	y		nan	4:?;1: present;2:y;3:n;0: absent	Not mentioned, Animacy is treated as a gender and therefore the question does not make sense, The marker is adjacent to the verb but not treated as morphologically bound
GB178	teiw1235	Are there several different singular genders/noun classes that can have the same plural gender/noun class?	1	n/a		nan	1:n/a;0:n	
GB179	teiw1235	Are there genders/noun classes that cannot take number marking?	1	n/a		nan	1:n/a;0:n	
GB181	teiw1235	Is number marking obligatory on certain (types of) nouns?	3	n/a		nan	3:n/a;1:?;2:y;0:n	
GB182	teiw1235	Is number marking obligatory on animate nouns?	2	n/a		nan	2:n/a;1:?;0:n	
GB183	teiw1235	Is number marking obligatory on human nouns?	2	n/a		nan	2:n/a;1:?;0:n	
GB184	teiw1235	Can an attributive nominal modifier denoting a property concept agree with the number of the noun it modifies?	2	n		nan	1: present;2:n;0: absent	Not mentioned, An additional marker dependent on the number of the noun is present but not called agreement
GB185	teiw1235	Can an adnominal demonstrative agree in number with the noun it modifies?	2	n		nan	1: present;2:n;0: absent	Not mentioned, An additional marker dependent on the number of the noun is present but not called agreement
GB186	teiw1235	Can articles agree in number with the noun they modify?	3	n/a		nan	3:n/a;1: present;2:n;0: absent	Not mentioned, An additional marker dependent on the number of the noun is present but not called agreement, It is not clear whether it is an article
GB187	teiw1235	Is there any productive diminutive marking on the noun (exclude marking by system of nominal classification only)?	2	n		nan	3:n/a;1: present;2:n;0: absent	Not mentioned, The marker is adjacent to the noun but not treated as morphologically bound
GB188	teiw1235	Is there any productive augmentative marking on the noun (exclude marking by system of nominal classification only)?	2	n		nan	1: present;2:n;0: absent	Not mentioned, The marker is adjacent to the noun but not treated as morphologically bound
GB191	teiw1235	Is there a morphologically marked middle voice construction?	0	n	Verbs can be used in middle constructions but there is no middle voice.	nan	1:?;0:n	
GB192	teiw1235	Are the noun's phonological properties relevant for any gender assignment?	3	n/a		nan	3:n/a;1: present;2:n;0: absent	Not mentioned, There is gender and it is possible that phonology influences assignment
GB193	teiw1235	What is the order of noun and attributive nominal modifier denoting a property concept?	5	2		nan	0: they cannot be used attributively;4:1;2: N - ANM;6:n att;3: both;5:2;1: ANM - N	Not mentioned, Certain adjectives take a different ordering, Adjectives can take either order
GB194	teiw1235	Are there indefinite or non-specific articles?	0	n		nan	1:y;0:n	
GB195	teiw1235	Can a noun receive more than one noun class marker at the same time?	1	n/a		nan	1:n/a;0:n	
GB196	teiw1235	Is there a gender distinction in 2nd person pronouns?	2	n		nan	1: present;2:n;0: absent	Not mentioned
GB197	teiw1235	Is there a gender distinction in 1st person pronouns?	2	n		nan	1: present;2:n;0: absent	Not mentioned
GB198	teiw1235	Can a numeral used attributively agree with any gender/noun class of the noun it modifies?	4	n/a		nan	4:n/a;1: present;3:y;2:n;0: absent	Not mentioned, An additional marker dependent on the gender of the noun is present but not called agreement
GB199	teiw1235	Can verbs agree with the gender/noun class of the nominal object?	2	n/a	animate objects trigger agreement but are they a separate noun class?	nan	2:n/a;1:y;0:n	
GB200	teiw1235	Can verbs agree in number with the nominal object?	0	y		nan	2:?;0:y;1:n	
GB202	teiw1235	Is there a distinction between masculine and feminine in 2nd person pronouns?	0	n		nan	0:n	
GB203	teiw1235	"What is the order of the collective universal quantifier (""all"") and the noun?"	5	2		nan	7:?;1: UQ-N;2: N-UQ;0: no UQ;4:0;3: both;6:3;5:2	Not mentioned, 'All' does not modify the noun e.g. it is an adverb
GB204	teiw1235	Is there a distinction between collective ('all') and distributive ('every') universal quantifiers?	7	n/a	There is no inherently distributive quantifier 'every'. Distributive quantification is expressed by a distributive pronominal prefix, or a noun meaning 'everything' 	nan	3:?;6:no;0: absent;7:n/a;1: present;2:y;5:n;4:no data	Not mentioned
GB205	teiw1235	Is number marking prohibited on inanimate nouns?	2	n/a		nan	2:n/a;1:?;0:n	
GB206	teiw1235	Is number marking prohibited on mass nouns?	2	n/a		nan	2:n/a;1:?;0:n	
GB207	teiw1235	Is number marking optional on certain (types of) nouns?	3	n/a		nan	3:n/a;2:?;1:y;0:n	
GB208	teiw1235	Can singular number be marked by a prefix on the noun?	1	n/a		nan	1:n/a;0:n	
GB209	teiw1235	Can singular number be marked by a suffix on the noun?	1	n/a		nan	1:n/a;0:n	
GB210	teiw1235	Can singular number be marked by suppletion on the noun?	1	n/a		nan	1:n/a;0:n	
GB211	teiw1235	Can singular number be marked by tone alone on the noun?	1	n/a		nan	1:n/a;0:n	
GB212	teiw1235	Can dual number be marked by a prefix on the noun?	1	n/a		nan	1:n/a;0:n	
GB213	teiw1235	Can dual number be marked by a suffix on the noun?	1	n/a		nan	1:n/a;0:n	
GB214	teiw1235	Can dual number be marked by suppletion on the noun?	1	n/a		nan	1:n/a;0:n	
GB215	teiw1235	Can dual number be marked by tone alone on the noun?	1	n/a		nan	1:n/a;0:n	
GB216	teiw1235	Can dual number be marked by reduplication on the noun?	1	n/a		nan	1:n/a;0:n	
GB217	teiw1235	Can plural number be marked by a prefix on the noun?	1	n/a		nan	1:n/a;0:n	
GB218	teiw1235	Can plural number be marked by a suffix on the noun?	2	n/a	There is a plural word non, which follows the noun.	nan	2:n/a;1:y;0:n	
GB219	teiw1235	Can plural number be marked by suppletion on the noun?	1	n/a		nan	1:n/a;0:n	
GB220	teiw1235	Can plural number be marked by tone alone on the noun?	1	n/a		nan	1:n/a;0:n	
GB221	teiw1235	Can plural number be marked by reduplication on the noun?	2	n/a	p. 64.	nan	2:n/a;1:y;0:n	
GB222	teiw1235	Can trial number be marked by a prefix on the noun?	1	n/a		nan	1:n/a;0:n	
GB223	teiw1235	Can trial number be marked by a suffix on the noun?	1	n/a		nan	1:n/a;0:n	
GB224	teiw1235	Can trial number be marked by suppletion on the noun?	1	n/a		nan	1:n/a;0:n	
GB225	teiw1235	Can trial number be marked by tone alone on the noun?	1	n/a		nan	1:n/a;0:n	
GB226	teiw1235	Can trial number be marked by reduplication on the noun?	1	n/a		nan	1:n/a;0:n	
GB227	teiw1235	Can paucal number be marked by a prefix on the noun?	1	n/a		nan	1:n/a;0:n	
GB228	teiw1235	Can paucal number be marked by a suffix on the noun?	1	n/a		nan	1:n/a;0:n	
GB229	teiw1235	Can paucal number be marked by suppletion on the noun?	1	n/a		nan	1:n/a;0:n	
GB230	teiw1235	Can paucal number be marked by tone alone on the noun?	1	n/a		nan	1:n/a;0:n	
GB231	teiw1235	Can paucal number be marked by reduplication on the noun?	1	n/a		nan	1:n/a;0:n	
GB232	teiw1235	Can diminutive be marked by a prefix on the noun?	1	n/a		nan	1:n/a;0:n	
GB234	teiw1235	Can diminutive be marked by a suffix on the noun?	1	n/a		nan	1:n/a;0:n	
GB235	teiw1235	Can diminutive be marked by suppletion on the noun?	1	n/a		nan	1:n/a;0:n	
GB236	teiw1235	Can diminutive be marked by tone on the noun?	1	n/a		nan	1:n/a;0:n	
GB237	teiw1235	Can diminutive be marked by reduplication on the noun?	1	n/a		nan	1:n/a;0:n	
GB238	teiw1235	Can diminutive be marked by noun class selection?	1	n/a		nan	1:n/a;0:n	
GB239	teiw1235	Can augmentative be marked by a prefix on the noun?	1	n/a		nan	1:n/a;0:n	
GB240	teiw1235	Can augmentative be marked by a suffix on the noun?	1	n/a		nan	1:n/a;0:n	
GB241	teiw1235	Can augmentative be marked by suppletion on the noun?	1	n/a		nan	1:n/a;0:n	
GB242	teiw1235	Can augmentative be marked by tone on the noun?	1	n/a		nan	1:n/a;0:n	
GB243	teiw1235	Can augmentative be marked by reduplication on the noun?	1	n/a		nan	1:n/a;0:n	
GB244	teiw1235	Can augmentative be marked by noun class selection?	1	n/a		nan	1:n/a;0:n	
GB245	teiw1235	Can gender/noun class be marked by a prefix on the noun?	1	n/a		nan	1:n/a;0:n	
GB246	teiw1235	Can gender/noun class be marked by a suffix on the noun?	1	n/a		nan	1:n/a;0:n	
GB247	teiw1235	Can gender/noun class be marked by suppletion on the noun?	1	n/a		nan	1:n/a;0:n	
GB248	teiw1235	Can gender/noun class be marked by tone on the noun only?	1	n/a		nan	1:n/a;0:n	
GB249	teiw1235	Are there variations in marking strategies of core participants?	0	n		nan	1:y;0:n	
GB250	teiw1235	Can predicative possession be formed with a habeo-verb?	3	n		nan	4:?;1: present;2:y;3:n;0: absent	Not mentioned, The habeo verb is also an existential verb
GB251	teiw1235	Can predicative possession be formed by an intransitive construction with an locational/existential/copula predicate where the possessum is the subject?	0	y		nan	2:?;0:y;1:n	
GB252	teiw1235	Can predicative possession be formed with a locative possessive?	2	y		nan	4:?;1: present;2:y;3:n;0: absent	Not mentioned
GB253	teiw1235	Can predicative possession be formed with a dative possessive?	3	n		nan	4:?;1: present;2:y;3:n;0: absent	Not mentioned
GB254	teiw1235	Can predicative possession be formed with a genitive possessive?	2	y		nan	4:?;1: present;2:y;3:n;0: absent	Not mentioned
GB255	teiw1235	Can predicative possession be formed with a topic possessive?	2	n		nan	3:?;1: present;2:n;0: absent	Not mentioned
GB256	teiw1235	Can predicative possession be formed with a conjunctional possessive?	2	n		nan	3:?;1: present;2:n;0: absent	Not mentioned
GB257	teiw1235	Can polar interrogation be marked by intonation only?	2	y	Or not marked by intonation but recognized as such by pragmatics of situation.	Klamer 2010: 277	4:?;1: present;2:y;3:n;0: absent	Not mentioned, The question particle carries tone but this might also be intonation
GB258	teiw1235	Is the polar interrogative intonation rising?	0	y		nan	2:no data;3:n/a;1:?;0:y	
GB259	teiw1235	Is the polar interrogative intonation falling?	0	n		nan	2:no data;4:n/a;1:?;3:y;0:n	
GB260	teiw1235	Can polar interrogation be marked by change in word order only?	2	n		nan	1: present;2:n;0: absent	Not mentioned
GB261	teiw1235	Can polar interrogation be marked by a particle only?	0	n		nan	2:?;1:y;0:n	
GB262	teiw1235	Is there a clause-initial polar interrogative particle?	4	n/a		nan	4:n/a;3:?;1: present;2:n;0: absent	Not mentioned, The elements used in polar interrogation are distributed over the clause
GB263	teiw1235	Is there a clause-final polar interrogative particle?	5	n/a		nan	3:?;0: absent;5:n/a;1: present;2:y;4:n	Not mentioned, The elements used in polar interrogation are distributed over the clause
GB264	teiw1235	Is there a clause-medial polar interrogative particle?	4	n/a		nan	4:n/a;3:?;1: present;2:n;0: absent	Not mentioned, The elements used in polar interrogation are distributed over the clause
GB265	teiw1235	"Can comparative constructions be construed with a verb meaning ""surpass"" or ""exceed""?"	3	n		nan	5:?;0: absent;2:no data;1: present;4:y;3:n	Not mentioned
GB266	teiw1235	Can comparative constructions be construed with a locative comparative?	2	n		nan	5:?;0: absent;4:no data;1: present;3:y;2:n	Not mentioned
GB267	teiw1235	Can comparative constructions be construed with a from-comparative?	0	n		nan	1:no data;3:?;2:y;0:n	
GB268	teiw1235	Can comparative constructions be construed with a to-comparative?	0	n		nan	2:no data;3:?;1:y;0:n	
GB269	teiw1235	Can comparative constructions be construed with a benefactive comparative?	0	n		nan	1:no data;2:?;0:n	
GB270	teiw1235	Can comparative constructions be construed with conjoined clauses?	3	y		nan	5:?;0: absent;2:no data;1: present;3:y;4:n	Not mentioned
GB271	teiw1235	Are the predicates in the conjoined comparative construction antonyms?	1	n		nan	0:no data;4:n/a;2:?;3:y;1:n	
GB272	teiw1235	Do the  predicates in the conjoined comparative construction differ in polarity?	1	n		nan	0:no data;4:n/a;2:?;3:y;1:n	
GB273	teiw1235	Can comparative constructions be construed with a particle?	2	n		nan	5:?;0: absent;3:no data;1: present;4:y;2:n	Not mentioned
GB274	teiw1235	Is the element marking the gradable property concepts in the comparative construction marked for comparison in any way?	2	y		nan	0:no data;3:?;2:y;1:n	
GB275	teiw1235	Is the element marking the property concept in the comparative construction marked by an affix indicating comparision or grading?	2	n		nan	5:?;4:no data;0: absent;6:n/a;1: present;3:y;2:n	Not mentioned, The marker is adjacent to the property word but not treated as morphologically bound
GB276	teiw1235	Is the element marking the property concept in the comparative construction marked by a sepeare degree word indicating comparision or grading?	3	y		nan	5:?;4:no data;0: absent;6:n/a;1: present;3:y;2:n	Not mentioned, The marker is adjacent to the property word but not treated as morphologically bound
GB277	teiw1235	Can comparative constructions be construed with a at-comparative?	0	n		nan	2:no data;3:?;1:y;0:n	
GB278	teiw1235	Is there variation in conflation of arguments marking core participants?	1	n		nan	2:no data;3:?;0:y;1:n	
GB279	teiw1235	Is there variation in conflation of core participants based on TAM distinctions?	5	n/a		nan	4:?;3:no data;0: absent;5:n/a;1: present;2:n	Not mentioned
GB280	teiw1235	Are variation in conflation of core participants based on verb classes?	4	n/a		nan	2:no data;4:n/a;3:?;0:y;1:n	
GB281	teiw1235	Is there variation in conflation of core participants based on clause type, e.g. main vs. subordinate?	5	n/a		nan	4:?;3:no data;0: absent;5:n/a;1: present;2:n	Not mentioned
GB282	teiw1235	Are variation in conflation of core participants based on person distinctions?	4	n/a		nan	2:no data;4:n/a;3:?;0:y;1:n	
GB283	teiw1235	Can verbs agree with the gender/noun class of the nominal subject?	2	n/a		nan	2:n/a;1:y;0:n	
GB284	teiw1235	Can verbs agree with the number of the nominal subject?	0	n		nan	2:?;1:y;0:n	
GB285	teiw1235	Can polar interrogation be marked by a question particle and verbal morphology?	2	n		nan	1: present;3:y;2:n;0: absent	Not mentioned, The marker is adjacent to the verb but not treated as morphologically bound
GB286	teiw1235	Can polar interrogation be marked by verbal morphology only?	2	n		nan	1: present;2:n;0: absent	Not mentioned, The marker is adjacent to the verb but not treated as morphologically bound
GB287	teiw1235	Can recipients be treated as a transitive object, i.e. as Direct Object in terms of case marking?	0	n		nan	2:n/a;1:y?;0:n	
GB288	teiw1235	Can recipients be treated as a transitive object, i.e. as Direct Object in terms of core argument marking by adpositions?	0	n		nan	1:n/a;0:n	
GB289	teiw1235	Can recipients be treated as a transitive object, i.e. as Direct Object in terms of verbal agreement marking?	1	y		nan	3:n/a;2:?;1:y;0:n	
GB290	teiw1235	Can recipients be treated as a transitive object, i.e. as Direct Object in terms of verbal person marking (not agreement)?	0	y		nan	2:n/a;0:y;1:n	
GB291	teiw1235	Can polar interrogation be marked by tone?	4	n/a		nan	4:n/a;3:?;1: present;2:n;0: absent	Not mentioned, The question particle carries tone but this might also be intonation
GB292	teiw1235	Is the particle marking polar interrogation not tone?	3	n/a		nan	3:n/a;2:?;0:y;1:n	
GB294	teiw1235	Are there ideophones that depict sensory imagery beyond sound?	0	n		nan	1:no data;2:?;0:n	
GB295	teiw1235	Can ideophones act like verbs?	1	n		nan	2:no data;3:?;0:y;1:n	
GB296	teiw1235	Is there a morphosyntactically definable class of ideophones (beyond sound)?	?	Not known		nan	4:no data;3:?;1: present;2:n;0: absent	Not mentioned
GB297	teiw1235	Can polar interrogation be marked by a construction of the type “V Neg V”?	?	Not known		nan	1: present;0: absent	Not mentioned
GB298	teiw1235	Can standard negation be marked by negative auxiliaries?	?	Not known		nan	1: present;0: absent	Not mentioned, Unclear whether it should count as an auxiliary given that no verbs carry inflection
GB299	teiw1235	Can standard negation be marked by a freestanding particle?	?	Not known		nan	1: present;0: absent	Not mentioned
GB300	teiw1235	Is there a verb for the function 'give' that is suppletive for any grammatical category?	?	Not known		nan	1: present;0: absent	Not mentioned
GB301	teiw1235	Does the language have inclusory constructions productively?	?	Not known		nan	1: present;0: absent	Not mentioned
GB302	teiw1235	Is there a dedicated, obligatory and productive construction that marks passive voice, not morphologically on the verb nor on the A argument?	?	Not known		nan	1: present;0: absent	Not mentioned, The marker is adjacent to the verb but it is unclear whether it is morphologically bound
GB303	teiw1235	Is there a dedicated, obligatory, productive construction that marks antipassive voice, not morphologically on the verb?	?	Not known		nan	1: present;0: absent	Not mentioned, The marker is adjacent to the verb but it is unclear whether it is morphologically bound
GB304	teiw1235	Can the A argument be overtly expressed in a passive clause or be overtly marked to signal a passive clause?	?	Not known		nan	1: present;0: absent	Not mentioned
GB305	teiw1235	Are there phonologically independent reflexive pronouns?	?	Not known		nan	1: present;0: absent	Not mentioned, Not clear if they are phonologically independent
GB306	teiw1235	Are there reciprocal pronouns that are not-bipartite?	?	Not known		nan	1: present;0: absent	Not mentioned
GB307	teiw1235	Are there bipartite reciprocal pronouns?	?	Not known		nan	1: present;0: absent	Not mentioned
GB308	teiw1235	Can tense be marked by a productive, obligatory and dedicated construction that is not morphologically bound to the verb?	?	Not known		nan	1: present;0: absent	Not mentioned, The marker is adjacent to the verb but not treated as morphologically bound
GB309	teiw1235	Are there multiple past or future tenses, distinguishing distance from Time of Reference, in any form?	?	Not known		nan	1: present;0: absent	Not mentioned, The marker is adjacent to the verb but not treated as morphologically bound
GB310	teiw1235	Can aspect be marked by a productive, obligatory and dedicated construction that is not morphologically bound to the verb?	?	Not known		nan	1: present;0: absent	Not mentioned, The marker is adjacent to the verb but not treated as morphologically bound
GB311	teiw1235	Can mood be marked by a productive, obligatory and dedicated construction that is not morphologically bound to the verb?	?	Not known		nan	1: present;0: absent	Not mentioned, The marker is adjacent to the verb but not treated as morphologically bound
GB312	teiw1235	Can modal distinctions be marked on the verb, productively, dedicatedly and obligatorily?	?	Not known		nan	1: present;0: absent	Not mentioned, The marker is adjacent to the verb but not treated as morphologically bound
GB313	teiw1235	Are there possessive pronouns?	?	Not known		nan	1: present;0: absent	Not mentioned
GB314	teiw1235	Can augmentative be marked productively by a system of nominal classification?	?	Not known		nan	1: present;0: absent	Not mentioned
GB315	teiw1235	Can diminutive be marked productively by a system of nominal classification?	?	Not known		nan	1: present;0: absent	Not mentioned
GB316	teiw1235	Can singular number of a noun be marked by a productive, obligatory and dedicated marker in the noun phrase that is not bound to the noun and is not an agreement exponent of a plural marker on the noun?	?	Not known		nan	1: present;0: absent	Not mentioned, The marker is adjacent to the verb and it is unclear whether it is morphologically bound to it
GB317	teiw1235	Can dual number of a noun be marked by a productive, obligatory and dedicated marker in the noun phrase that is not bound to the noun and is not an agreement exponent of a plural marker on the noun?	?	Not known		nan	1: present;0: absent	Not mentioned, The marker is adjacent to the verb and it is unclear whether it is morphologically bound to it
