Feature_ID	Language_ID	Feature	Value	Answer	Comment	Source	Possible Values	Suggested standardised comments
GB014	teiw1235	Is there weight-sensitive suprasegmental prominence, suprasegmental prominence can be loudness, duration, pitch, i.e. stress or tone phenomena?	1	y	Trochaic stress in Teiwa is established by either counting syllables or morae (p. 54)	nan	2:no data;3:?;1:y;0:n	
GB020	teiw1235	Are there definite or specific articles?	3	n		nan	1: present;2:y;3:n;0: absent	Not mentioned, Form same as demonstratives, Form same as pronoun, Definiteness marking is done by an element with another function such as numeral classifiers, Definiteness marking is very restricted
GB021	teiw1235	Is an indefinite NP obligatorily accompanied by an indefinite (or non-specific) article?	3	n/a		nan	3:n/a;1: present;2:n;0: absent	Not mentioned, It exists but it is not obligatory, Same as numeral 'one'
GB022	teiw1235	Are there prenominal articles?	3	n/a		nan	3:n/a;1: present;2:n;0: absent	Not mentioned, The definite article is prenominal, The indefinite article is prenominal, The definite article is a prefix, The indefinite article is a prefix
GB023	teiw1235	Are there postnominal articles?	4	n/a		nan	4:n/a;1: present;2:y;3:n;0: absent	Not mentioned, The definite article is postnominal, The indefinite article is postnominal, The definite article is a suffix, The indefinite article is a suffix
GB024	teiw1235	What is the order of numeral and noun in the NP?	4	2		nan	1: Num-N;3: both.;2: N-Num;4:2	Not mentioned, Mostly numeral-noun with a few exceptions, Mostly noun-numeral with a few exceptions, Either order occurs with any numeral
GB025	teiw1235	What is the order of demonstrative and noun in the NP?	4	3		nan	3: both.;1: Dem-N;4:3;5:2;2: N-Dem	Not mentioned, Different demonstratives take different orders, There is free variation, Demonstrative construction has a form both before and after the noun, Demonstrative are treated as suffixes, Demonstrative are treated as prefixes
GB026	teiw1235	Are there 'discontinuous noun phrases'?	2	n		nan	1: present;2:n;0: absent	Not mentioned
GB027	teiw1235	Is there a difference between the marking of NP coordination ('John and Mary went to market') and the marking of comitative phrases ('John went to market with Mary')?	2	y	NP coordination with 'ata', comitative with svc with 'pin' = hold	nan	5:?;0: absent;4:no data;1: present;2:y;3:n	Not mentioned
GB028	teiw1235	Is there an inclusive/exclusive distinction?	2	y		nan	1: present;2:y;0: absent	Not mentioned
GB029	teiw1235	Is there a minimal-augmented system?	0	n		nan	0:n	
GB030	teiw1235	Is there a gender distinction in 3rd person pronouns (or demonstratives, if no 3rd person pronouns)?	2	n		nan	1: present;2:n;0: absent	Not mentioned
GB031	teiw1235	Is there a dual (or unit augmented) in addition to a plural (or augmented) number category in pronouns?	3	y		nan	4:?;1: present;3:y;2:n;0: absent	Not mentioned
GB032	teiw1235	Are 1st and 2nd persons conflated in any context?	2	n		nan	1: present;3:y;2:n;0: absent	Not mentioned, Same pronoun form covering both first and second person in some context, Person is marked on the verb and there is a context where first and second person are the same
GB033	teiw1235	Are 2nd and 3rd persons conflated in non-singular numbers?	0	n		nan	0:n	
GB034	teiw1235	Are person categories neutralized under some conditions?	2	n		nan	1: present;2:n;0: absent	Not mentioned, Under negation, In a certain TAM context, Unclear whether the verb form counts as finite
GB035	teiw1235	Is there an opposition between three or more distance terms in the demonstrative system?	3	n		nan	4:?;1: present;2:y;3:n;0: absent	Not mentioned, The distinction is distance from speaker versus hearer
GB036	teiw1235	Is elevation morphologically marked in demonstratives?	5	n/a		nan	4:?;0: absent;5:n/a;1: present;2:y;3:n	Not mentioned
GB037	teiw1235	Is the opposition visible-non-visible marked on demonstratives?	2	n		nan	4:?;1: present;3:y;2:n;0: absent	Not mentioned
GB038	teiw1235	Are there demonstrative classifiers?	2	n		nan	3:?;1: present;2:n;0: absent	Not mentioned, The demonstrative classifier system is the same as another classifier system, Demonstratives agree with what is treated as noun classes
GB039	teiw1235	Are there declensions (partly) determined by number of the noun?	2	n		nan	1: present;2:n;0: absent	Not mentioned, There are different forms for marking number depending on the noun class, There are different forms for marking number which seem to be phonologically conditioned, The markers are adjacentbut not treated as bound
GB040	teiw1235	Are there declensions (partly) determined by gender of the noun?	1	n/a		nan	1:n/a;0:n	
GB041	teiw1235	Are there nouns which are suppletive for number?	2	n		nan	1: present;2:n;0: absent	Not mentioned
GB042	teiw1235	Can singular number be marked on the noun itself?	2	n		nan	1: present;2:n;0: absent	Not mentioned, The marker is adjacent to the noun but not treated as morphologically bound
GB043	teiw1235	Can dual number be marked on the noun itself?	2	n		nan	1: present;2:n;0: absent	Not mentioned, The marker is adjacent to the noun but not treated as morphologically bound
GB044	teiw1235	Can plural number be marked on the noun itself?	2	n		nan	1: present;3:y;2:n;0: absent	Not mentioned, The marker is adjacent to the noun but not treated as morphologically bound
GB045	teiw1235	Is number marking prohibited on certain (types of) nouns?	3	n/a		nan	3:n/a;2:?;1:y;0:n	
GB046	teiw1235	Are there associative plurals?	3	n		nan	5:?;0: absent;4:no data;1: present;2:y;3:n	Not mentioned
GB047	teiw1235	Is there a productive morphologically marked Action/state nominalization (arrive/arrival)?	2	n		nan	4:?;1: present;3:y;2:n;0: absent	Not mentioned, The marker is adjacent to the noun but not treated as morphologically bound, The marker is also a noun
GB048	teiw1235	Is there a productive morphologically marked Agentive nominalization (sing-er)?	2	n		nan	4:?;1: present;3:y;2:n;0: absent	Not mentioned, The marker is adjacent to the noun but not treated as morphologically bound, The marker means 'person' or similar
GB049	teiw1235	Is there a productive morphologically marked Object nominalization (sing; song)?	2	n	there are nominalisations of the arguments of stative predicates, p. 75	nan	4:?;1: present;3:y;2:n;0: absent	Not mentioned, The marker is adjacent to the noun but not treated as morphologically bound, The marker means 'thing' or similar
GB050	teiw1235	Are there noun classes/genders?	1	n		nan	2:?;0:y;1:n	
GB051	teiw1235	Is sex a relevant category in any noun class/gender system?	3	n/a		nan	3:n/a;1: present;2:n;0: absent	Not mentioned, Nouns have semantic classification but the markers are not morphologically bound and are flexible, There is extensive classification but only to parts of the lexicon
GB052	teiw1235	Is shape a relevant category in any noun class/gender system?	4	n/a		nan	4:n/a;1: present;2:y;3:n;0: absent	Not mentioned, Nouns have semantic classification but the markers are not morphologically bound and are flexible, There is extensive classification but only to parts of the lexicon
GB053	teiw1235	Is animacy (without reference to sex) a relevant category in any noun class/gender system?	4	n/a		nan	4:n/a;1: present;2:y;3:n;0: absent	Not mentioned, Nouns have semantic classification but the markers are not morphologically bound and are flexible, There is extensive classification but only to parts of the lexicon
GB054	teiw1235	Is plant status a relevant category in any noun class/gender system?	?	Not known		nan	1: present;2:n;0: absent	Not mentioned, Nouns have semantic classification but the markers are not morphologically bound and are flexible, There is extensive classification but only to parts of the lexicon
GB055	teiw1235	Does the language only have a gender distinction in 3rd person pronouns?	1	n/a		nan	1:n/a;0:n	
GB056	teiw1235	Is there concord within the NP, i.e. agreement of elements within the NP with the noun class of a noun?	2	n/a		nan	2:n/a;1:y;0:n	
GB057	teiw1235	Are there numeral classifiers?	3	y		nan	4:?;1: present;3:y;2:n;0: absent	Not mentioned, There are but they also have other functions such as classifying demonstratives, There are words with specific numeral meanings such as 'ten coconuts', There are different numerals used with different nouns
GB058	teiw1235	Are there possessive classifiers?	2	n		nan	1: present;2:n;0: absent	Not mentioned, There are but they also have other functions such as classifying demonstratives, There are words with specific possessive meaning such as 'my house', The classifiers reflect properties of the possessor rather than the possessum
GB059	teiw1235	Is alienable/inalienable a relevant distinction?	2	y		nan	1: present;2:y;3:n;0: absent	Not mentioned
GB060	teiw1235	Are there different possessive constructions?	0	y		nan	0:y;1:n	
GB061	teiw1235	Can possession be marked by a prefix?	2	y		nan	1: present;2:y;3:n;0: absent	Not mentioned, The marker is adjacent to the noun but not treated as morphologically bound
GB062	teiw1235	Can possession be marked by a suffix?	2	n		nan	1: present;3:y;2:n;0: absent	Not mentioned, The marker is adjacent to the noun but not treated as morphologically bound
GB063	teiw1235	Can possession be marked on the nominal possessor?	2	n		nan	1: present;3:y;2:n;0: absent	Not mentioned, The marker is adjacent to the noun but not treated as morphologically bound
GB064	teiw1235	Can possession be marked on the nominal possessee?	2	y		nan	1: present;2:y;3:n;0: absent	Not mentioned, The marker is adjacent to the noun but not treated as morphologically bound
GB065	teiw1235	What is the order of possessor and possessed in the attributive possessive construction?	5	1		nan	2:Possessed-Possessor;1:Possessor-Possessed;5:1;4:both;6:3	Not mentioned, Pronouns use the opposite order
GB066	teiw1235	Are there different orders of elements in a possessive phrase for different classes of possession?	0	n		nan	1:y;0:n	
GB067	teiw1235	What is the counting system?	0	2		nan	2:decimal;1:1;0:2	
GB068	teiw1235	Do core adjectives (defined semantically as property concepts; value, shape, age, dimension) act like verbs in predicative position?	3	n	Adjectives do not take Realis inflection.	nan	5:?;0: absent;4:no data;1: present;2:y;3:n	Not mentioned, Neither verbs nor adjectives receive marking, Some TAM and voice marking on verbs is not shared by adjectives
GB069	teiw1235	Do core adjectives (defined semantically as property concepts; value, shape, age, dimension) used attributively require the same morphological treatment as verbs?	3	n		nan	1: present;2:y;3:n;0: absent	Not mentioned, Neither verbs nor adjectives receive marking, Some TAM and voice marking on verbs is not shared by adjectives
GB070	teiw1235	Is there case marking for core nominal NPs (i.e., S, A or O function)?	2	n		nan	1: present;3:y;2:n;0: absent	Not mentioned, The markers are adjacent to the noun but not treated as morphologically bound
GB071	teiw1235	Is there case marking for core pronouns?	3	y		nan	1: present;3:y;2:n;0: absent	Not mentioned, The markers are adjacent to the noun but not treated as morphologically bound
GB072	teiw1235	Is there case marking for oblique nominal NPs?	2	n		nan	1: present;2:n;0: absent	Not mentioned, The markers are adjacent to the noun but not treated as morphologically bound
GB073	teiw1235	Is there case marking for oblique pronouns?	2	n		nan	1: present;2:n;0: absent	Not mentioned, The markers are adjacent to the noun but not treated as morphologically bound
GB074	teiw1235	Are there prepositions?	2	n		nan	3:?;1: present;4:y;2:n;0: absent	Not mentioned, The markers are treated as bound to the noun, The adpositions are often also lexical nouns and verbs, Only one or very few
GB075	teiw1235	Are there postpositions?	3	y	Only one: ma 'come'> ma 'LOC'	nan	4:?;1: present;3:y;2:n;0: absent	Not mentioned, The markers are treated as bound to the noun, The adpositions are often also lexical nouns and verbs, Only one or very few
GB076	teiw1235	Are there adpositions to mark core NPs?	2	n		nan	4:?;0: absent;5:n/a;1: present;3:y;2:n	Not mentioned, The markers are treated as bound to the noun, The adpositions are often also lexical nouns and verbs
GB077	teiw1235	Are there adpositions to mark oblique NPs?	3	y		nan	4:?;0: absent;5:n/a;1: present;3:y;2:n	Not mentioned, The markers are treated as bound to the noun, The adpositions are often also lexical nouns and verbs
GB078	teiw1235	Is there a distinction between locational and directional adpositions?	0	n		nan	3:n/a;2:?;1:y;0:n	
GB079	teiw1235	Do verbs have prefixes/proclitics, other than those that ONLY mark A, S or O (do include portmanteau: A & S + TAM)?	3	y	One unproductive applicative prefix.	nan	1: present;3:y;2:n;0: absent	Not mentioned, The markers are adjacent to the verb but not treated as morphologically bound, Only one or very few
GB080	teiw1235	Do verbs have suffixes/enclitics, other than those that ONLY mark A, S or O (do include portmanteau: A & S + TAM)?	2	y	One realis suffix	nan	5:?;0: absent;4:no data;1: present;2:y;3:n	Not mentioned, The markers are adjacent to the verb but not treated as morphologically bound, Only one or very few
GB081	teiw1235	Can infixation be used on verbs for derivational, aspectual, or voice-changing purposes?	2	n		nan	1: present;3:y;2:n;0: absent	Not mentioned, It is a type of reduplication, Some other doubt about why it is an infix
GB082	teiw1235	Is there present tense regularly morphologically marked on the verb?	2	n		nan	1: present;2:n;0: absent	Not mentioned, The marker is described as non-past rather than specifically present, The marker conveys both tense and aspect, The markers are adjacent to the verb but not treated as morphologically bound
GB083	teiw1235	Is there past tense regularly morphologically marked on the verb?	2	n		nan	1: present;2:n;0: absent	Not mentioned, The markers are adjacent to the verb but not treated as morphologically bound
GB084	teiw1235	Is there future tense regularly morphologically marked on the verb?	2	n		nan	1: present;2:n;0: absent	Not mentioned, The marker is described as conveying non-past rather than specifically future, The markers are adjacent to the verb but not treated as morphologically bound
GB085	teiw1235	Are there multiple past or future tenses, distinguishing distance from Time of Reference, marked on the verb?	1	n/a		nan	1:n/a;0:n	
GB086	teiw1235	Is a distinction between punctual/continuous aspect available as a morphological choice?	3	n		nan	1: present;2:y;3:n;0: absent	Not mentioned, The marker is adjacent to the verb but not treated as morphologically bound
GB087	teiw1235	Is a distinction between realis/irrealis mood available as a morphological choice?	3	y		nan	1: present;3:y;2:n;0: absent	Not mentioned, The markers are adjacent to the verb but not treated as morphologically bound, It is called 'realis'/'irrealis' by the grammar
GB088	teiw1235	Is there an apprehensive modal category marked on the verb also known as 'evitative', 'lest', etc.?	2	n		nan	1: present;2:n;0: absent	Not mentioned, The markers are adjacent to the verb but not treated as morphologically bound, There is a marker but it has other functions
GB089	teiw1235	Is the S participant (at least sometimes) marked by a suffix/enclitic?	2	n		nan	1: present;3:y;2:n;0: absent	Not mentioned, The markers are adjacent to the verb but not treated as morphologically bound
GB090	teiw1235	Is the S participant (at least sometimes) marked by a prefix/proclitic?	3	n		nan	4:?;1: present;2:y;3:n;0: absent	Not mentioned, The markers are adjacent to the verb but not treated as morphologically bound
GB091	teiw1235	Is the A participant (at least sometimes) marked by a suffix/enclitic?	2	n		nan	3:?;1: present;4:y;2:n;0: absent	Not mentioned, The markers are adjacent to the verb but not treated as morphologically bound
GB092	teiw1235	Is the A participant (at least sometimes) marked by a prefix/proclitic?	2	n		nan	1: present;3:y;2:n;0: absent	Not mentioned, The markers are adjacent to the verb but not treated as morphologically bound
GB093	teiw1235	Is the O participant (at least sometimes) marked by a suffix/enclitic?	2	n		nan	1: present;3:y;2:n;0: absent	Not mentioned, The markers are adjacent to the verb but not treated as morphologically bound
GB094	teiw1235	Is the O participant (at least sometimes) marked by a prefix/proclitic?	2	y		nan	1: present;2:y;3:n;0: absent	Not mentioned, The markers are adjacent to the verb but not treated as morphologically bound
GB095	teiw1235	Are variations in marking strategies of core participants based on TAM distinctions?	4	n/a		nan	4:n/a;1: present;3:y;2:n;0: absent	Not mentioned
GB096	teiw1235	Are variations in marking strategies of core participants based on verb classes?	4	n/a		nan	4:n/a;1: present;2:y;3:n;0: absent	Not mentioned
GB097	teiw1235	Are variations in marking strategies of core participants based on clause type, e.g. main vs. subordinate?	5	n/a		nan	4:?;3:no data;0: absent;5:n/a;1: present;2:n	Not mentioned
GB098	teiw1235	Are variations in marking strategies of core participants based on person distinctions?	4	n/a		nan	4:n/a;1: present;3:y;2:n;0: absent	Not mentioned
GB099	teiw1235	Do verb stems alter according to the person of a core participant?	2	n		nan	3:?;1: present;2:n;0: absent	Not mentioned
GB100	teiw1235	Is number ever marked separately from person on the verb?	0	n		nan	1:y;0:n	
GB101	teiw1235	Are person, number and any TAM category (i.e. 3 or more categories in all) marked by portmanteau morphemes on verbs?	0	n		nan	0:n	
GB102	teiw1235	Are categories such as person, number, gender related to a single participant discontinuously marked on a verb?	0	n		nan	0:n	
GB103	teiw1235	Are benefactive nominals marked on the verb?	3	y		nan	1: present;3:y;2:n;0: absent	Not mentioned, The markers are adjacent to the verb but not treated as morphologically bound
GB104	teiw1235	Can instruments be marked on the verb?	3	y		nan	4:?;1: present;3:y;2:n;0: absent	Not mentioned, The markers are adjacent to the verb but not treated as morphologically bound
GB105	teiw1235	Can recipients be treated as a transitive object, i.e. as Direct Object?	2	y		nan	1: present;2:y;3:n;0: absent	Not mentioned
GB106	teiw1235	Are there syntactically ditransitive verbs?	2	n		nan	1: present;3:y;2:n;0: absent	Not mentioned, Only one or very few such as 'give'
GB107	teiw1235	Is negation marked morphologically on the verb?	2	n		nan	1: present;2:n;0: absent	Not mentioned, The marker is adjacent to the property word but not treated as morphologically bound
GB108	teiw1235	Can locative or direction be morphologically marked on the verb?	3	n		nan	4:?;1: present;2:y;3:n;0: absent	Not mentioned, The markers are adjacent to the verb but not treated as morphologically bound
GB109	teiw1235	Are there suppletive verbs for number of participants?	2	n		nan	1: present;3:y;2:n;0: absent	Not mentioned, Only one example
GB110	teiw1235	Are there suppletive verbs for tense or aspect?	2	n		nan	1: present;2:n;0: absent	Not mentioned, One or very few, Unclear whether the suppletive pattern is a conjugation class
GB111	teiw1235	Are there conjugation classes?	3	n		nan	1: present;2:y;3:n;0: absent	Not mentioned, The markers are adjacent to the verb but not treated as morphologically bound, They are transitive versus intransitive verbs
GB112	teiw1235	Are there (several) verbs which can be used either transitively or intransitively with no morphological marking?	3	y	p. 100	nan	4:?;1: present;3:y;2:n;0: absent	Not mentioned, There are only very few examples are or restricted in some way
GB113	teiw1235	Is there transitivising morphology (include clitics)?	2	n		nan	1: present;3:y;2:n;0: absent	Not mentioned, The markers are adjacent to the verb but not treated as morphologically bound
GB114	teiw1235	Is there morphology (include clitics) to mark a reflexive action?	2	n		nan	5:?;0: absent;4:no data;1: present;3:y;2:n	Not mentioned, The marker is adjacent to the verb but not treated as morphologically bound
GB115	teiw1235	Is there morphology (include clitics) to mark a reciprocal action?	2	y	prefix t- (from distributive pronoun ta'an)	nan	4:?;1: present;2:y;3:n;0: absent	Not mentioned, The markers are adjacent to the verb but not treated as morphologically bound
GB116	teiw1235	Do verbs classify the shape, size, consistency or position of absolutive arguments by means of incorporated nouns, verbal affixes or suppletive verb stems?	2	n		nan	1: present;3:y;2:n;0: absent	Not mentioned, Perhaps some examples but it does not seem to be a systematic feature of verbs, Resembles the noun class system, Resembles the noun classifier system
GB117	teiw1235	Is there a copula for predicate nominals?	2	n		nan	1: present;3:y;2:n;0: absent	Not mentioned, There is but it is not obligatory, There is but it is restricted such as in the past tense only, There is but it is a demonstrative
GB118	teiw1235	Are there serial verb constructions?	2	y		nan	1: present;2:y;0: absent	Not mentioned, Hard to distinguish from verb compounding, Limited to some verbs e.g. English 'go buy food'
GB119	teiw1235	Are there modal auxiliaries?	2	y		nan	5:?;0: absent;4:no data;1: present;2:y;3:n	
GB120	teiw1235	Are there aspectual auxiliaries?	2	y		nan	1: present;2:y;3:n;0: absent	
GB121	teiw1235	Are there tense auxiliaries?	2	n		nan	1: present;3:y;2:n;0: absent	
GB122	teiw1235	Is verb compounding a regular process?	2	y		nan	5:?;0: absent;4:no data;1: present;2:y;3:n	Not mentioned, Hard to distinguish from serial verb constructions
GB123	teiw1235	Are there verb-adjunct (aka light-verb) constructions?	3	n		nan	1: present;2:y;3:n;0: absent	Not mentioned
GB124	teiw1235	Is incorporation of nouns into verbs a productive intransitivizing process?	2	n		nan	4:?;1: present;3:y;2:n;0: absent	Not mentioned, The noun appears adjacent to the verb but is not treated as morphologically bound
GB125	teiw1235	Is there productive incorporation of non-nominal elements (adjectives, locatives, etc.) into verbs?	2	n		nan	4:?;1: present;3:y;2:n;0: absent	Not mentioned, The marker is adjacent to the verb but not treated as morphologically bound
GB126	teiw1235	Is there one or more existential verb?	2	y		nan	4:?;1: present;2:y;3:n;0: absent	Not mentioned, It exists but is the same as the copula, It exists but also encodes position
GB127	teiw1235	Are there positional (classificatory) verbs?	2	y		nan	6:?;0: absent;5:no data;2:y;1: present;3:n;4:y?	Not mentioned, They are not fully obligatory
GB128	teiw1235	Is the verb 'give' morphologically peculiar (different from most other verbs)?	0	n		nan	1:y;0:n	
GB129	teiw1235	Is there a notably small number, i.e. about 100 or less, of verbs in the language?	2	n		nan	1: present;2:n;0: absent	Not mentioned
GB130	teiw1235	What is the pragmatically unmarked order of S and V in intransitive clauses?	4	1		nan	3: both;4:1;1: SV;2: VS	Not mentioned, Pronouns have opposite order, Different depending on clause type or TAM etc., Occurs with a type of focus construction
GB131	teiw1235	Is a pragmatically unmarked constituent order verb-initial for transitive clauses?	2	n		nan	1: present;2:n;0: absent	Not mentioned, Pronouns have a different order, Different depending on clause type or TAM etc.
GB132	teiw1235	Is a pragmatically unmarked constituent order verb-medial for transitive clauses?	2	n		nan	1: present;3:y;2:n;0: absent	Not mentioned, Pronouns have a different order, Different depending on clause type or TAM etc.
GB133	teiw1235	Is a pragmatically unmarked constituent order verb-final for transitive clauses?	2	y		nan	1: present;2:y;3:n;0: absent	Not mentioned, Pronouns have a different order, Different depending on clause type or TAM etc.
GB134	teiw1235	Is the order of constituents the same in main and subordinate clauses?	2	y	Grammatically  subordinate clauses are only  nominalised clauses. 	nan	4:n/a;3:?;1: present;2:y;0: absent	Not mentioned, Only in some type of subordinate clauses, Order is more restricted in main clauses, Order is more restricted in subordinate clauses
GB135	teiw1235	Do clausal objects occur in the same position as nominal objects?	5	n/a		nan	4:?;0: absent;5:n/a;1: present;2:y;3:n	Not mentioned
GB136	teiw1235	Is constituent order fixed?	2	y		nan	1: present;2:y;0: absent	Not mentioned that there is any variation, There is variation due to topicalisation and focus
GB137	teiw1235	Can negation be marked clause-finally?	2	y		nan	1: present;2:y;3:n;0: absent	Not mentioned, Only in some sentences where a normally initial element such as the subject is not present, Negation is marked on the verb which appears clause-initially
GB138	teiw1235	Can negation be marked clause-initially?	2	n		nan	1: present;3:y;2:n;0: absent	Not mentioned, Only in some sentences where a normally final element such as the direct object is not present, Negation is marked on the verb which appears clause-finally
GB139	teiw1235	Is there a difference between imperative and declarative negation?	2	y	negative imperative expressed by the prohibitive verb gaxai 'do not'. Declarative negative is expressed with negator maan. 	nan	3:?;1: present;2:y;0: absent	Not mentioned, Difference in word order, Difference in the form of the negator, Difference in the presence of a particular element which is not analysed as part of the negator
GB140	teiw1235	Are verbal and non-verbal predicates marked by the same negator?	3	y	marked by maan 'NEG'.	nan	4:?;1: present;3:y;2:n;0: absent	Not mentioned, A special negator or negative form of the verb is used for existential meanings, A special negator or negative form of the copula is used with nominal predicates, A special negator or negative form of the copula is used with predicative adjectives, Other negative forms but which are discounted by the clarifying comment
GB141	teiw1235	Are S and O conflated morphologically in at least some basic constructions, i.e. simple main clauses?	3	n		nan	4:?;1: present;2:y;3:n;0: absent	Not mentioned
