Feature_ID	Language_ID	Feature	Value	Answer	Comment	Source	Possible Values	Suggested standardised comments
GB318	teiw1235	Can plural number of a noun be marked by a productive, obligatory and dedicated marker in the noun phrase that is not bound to the noun and is not an agreement exponent of a plural marker on the noun?	?	Not known		nan	1: present;0: absent	Not mentioned, The marker is adjacent to the verb and it is unclear whether it is morphologically bound to it
GB319	teiw1235	Can trial number of a noun be marked by a productive, obligatory and dedicated marker in the noun phrase that is not bound to the noun and is not an agreement exponent of a plural marker on the noun?	?	Not known		nan	1: present;0: absent	Not mentioned, The marker is adjacent to the verb and it is unclear whether it is morphologically bound to it
GB320	teiw1235	Can paucal number of a noun be marked by a productive, obligatory and dedicated marker in the noun phrase that is not bound to the noun and is not an agreement exponent of a plural marker on the noun?	?	Not known		nan	1: present;0: absent	Not mentioned, The marker is adjacent to the verb and it is unclear whether it is morphologically bound to it
GB321	teiw1235	Is there an open class of noun stems that are assigned to gender/noun class categories arbitrarily?	?	Not known		nan	1: present;0: absent	Not mentioned, There may be a gender or noun class system but it seems to be semantic
GB322	teiw1235	Does the language encode direct evidentiality (perceived with senses)?	?	Not known		nan	1: present;0: absent	Not mentioned
GB323	teiw1235	Does the language encode indirect evidentiality (hearsay, inference, etc.)?	?	Not known		nan	1: present;0: absent	Not mentioned
GB324	teiw1235	Are some content interrogatives (who?, what?, etc.) expressed in interrogative verbs?	?	Not known		nan	1: present;0: absent	Not mentioned
GB325	teiw1235	Is there a count/mass distinction in content interrogatives (e.g. English how many vs. how much)?	?	Not known		nan	1: present;0: absent	Not mentioned
GB326	teiw1235	Do (nominal) content interrogatives normally or frequently occur in situ (i.e. in the normal position for a non-interrogative NP in the same participant role)?	?	Not known		nan	1: present;0: absent	Not mentioned
GB327	teiw1235	Can the relative clause follow the noun?	?	Not known		nan	1: present;0: absent	Not mentioned
GB328	teiw1235	Can the relative clause precede the noun?	?	Not known		nan	1: present;0: absent	Not mentioned
GB329	teiw1235	Are there internally-headed relative clauses?	?	Not known		nan	1: present;0: absent	Not mentioned
GB330	teiw1235	Are there correlative relative clauses?	?	Not known		nan	1: present;0: absent	Not mentioned
GB331	teiw1235	Are there adjoined relative clauses?	?	Not known		nan	1: present;0: absent	Not mentioned
GB332	teiw1235	Are there double-headed relative clauses?	?	Not known		nan	1: present;0: absent	Not mentioned
GB333	teiw1235	Is there a decimal counting system?	2	y		nan	1: present;2:y;0: absent	Not mentioned
GB334	teiw1235	Is there synchronic evidence for any element of a quinary counting system?	?	Not known		nan	1: present;0: absent	Not mentioned
GB335	teiw1235	Is there synchronic evidence for any element of a vigesimal counting system?	?	Not known		nan	1: present;0: absent	Not mentioned
GB336	teiw1235	Is there a body-part tallying system?	2	n		nan	1: present;2:n;0: absent	Not mentioned
GB502	teiw1235	What is the relative position of possessor pronoun and possessed in the attributive possessive construction?	0	1		nan	3:n/a;0:1;2:2;1:n pospro	
GB503	teiw1235	Are S and A marked by the same affix/clitic?	2	n/a		nan	2:n/a;0:y;1:n	
GB508	teiw1235	Are there core adjectives (elements denoting property concepts) that act like nouns?	0	n		nan	0:n	
GB509	teiw1235	Are demonstratives used pronominally?	0	y		nan	2:?;0:y;1:n	
GB510	teiw1235	Are demonstratives used adnominally?	0	y		nan	0:y	
GB511	teiw1235	Do demonstratives encode elevation?	1	n		nan	2:?;0:y;1:n	
GB512	teiw1235	Is there an opposition between three or more elevation terms in the demonstrative system?	3	n/a		nan	3:n/a;2:?;0:y;1:n	
GB514	teiw1235	Is animacy distinguished in the demonstrative system?	0	n		nan	2:?;1:y;0:n	
GB515	teiw1235	Is humanness distinguished in the demonstrative system?	0	n		nan	1:?;0:n	
GB516	teiw1235	How are locationals and demonstratives formally related?	1	3	i-fo'o, a-fo'o contain a demonstrative marker i- and a-	nan	2:0;4:?;0:1;1:3;3:2	
GB517	teiw1235	Is there an opposition between three or more distance terms in the locational system?	1	n		nan	2:?;0:y;1:n	
GB518	teiw1235	Do locationals encode elevation?	0	y	locational nouns for up, down  and spatial deictics for uphill, downhill exist.	nan	2:?;0:y;1:n	
GB519	teiw1235	Is there an opposition between three or more elevation terms in the locational system?	1	n		nan	3:n/a;2:?;0:y;1:n	
GB520	teiw1235	Do locationals encode direction (based on a coordinate system)?	2	?	not known	nan	2:?;0:y;1:n	
GB521	teiw1235	Is the opposition visible-non-visible marked on locationals?	1	y	overthere (visible vs. invisible)	nan	2:?;1:y;0:n	
R1102	teiw1235	How many places of articulation are there for stops?	2	5		nan	2:5;1:3;0:4	
R1103	teiw1235	How many places of articulation are there for nasals?	0	3		nan	0:3;1:2	
R1103a	teiw1235	Are there as many points of articulation for nasals as there are for stops?	0	n		nan	1:y;0:n	
R1103b	teiw1235	Is there contrast between heterorganic and homorganic sequence of nasal and velar stop?	0	n		nan	0:n	
R1105	teiw1235	Are there fricative phonemes?	0	y		nan	0:y	
R1106	teiw1235	Are there phonemic prenasalised stops?	0	n		nan	0:n	
R1107	teiw1235	Is there a phonemic distinction between l/r?	0	y		nan	0:y	
R1108	teiw1235	Is there a phonemic velar fricative or glide?	0	n	but there is a pharyngeal fricative	nan	1:y;0:n	
R1109	teiw1235	Is there a voicing contrast between oral (i.e. non-prenasal) stops?	0	y		nan	0:y;1:n	
R1109a	teiw1235	Is there a laminal/apical contrast?	0	n		nan	0:n	
R1109b	teiw1235	Are there retroflexed consonants?	0	n		nan	0:n	
R1110	teiw1235	Is there phonemic consonant length?	0	n		nan	1:y;0:n	
R1111	teiw1235	Is there phonemic vowel length?	0	y		nan	0:y;1:n	
R1112	teiw1235	Are there contrastive phonation types for vowels?	0	n		nan	1:y;0:n	
R1113a	teiw1235	Are there two or more contrastive central vowels?	1	n		nan	0:y;1:n	
R1115	teiw1235	Is there lexically determined suprasegmental prominence?	1	n		nan	0:y;1:n	
R1116	teiw1235	Is there weight-sensitive suprasegmental prominence	?	Not known		nan	0:y;1:n	
R1117	teiw1235	Is there syllable position sensitive suprasegmental prominence?	0	y	Trochaic stress in Teiwa is established by either counting syllables or morae (p. 54)	nan	2:no data;3:?;0:y;1:n	
R1118	teiw1235	Is there a tonal system?	1	n		nan	0:y;1:n	
R1202	teiw1235	Are there word-final consonants?	0	y		nan	0:y	
R1203a	teiw1235	Are there consonant clusters (not counting prenasalized consonants) in syllable onset?	1	y	Teiwa consonant clusters are found only in word-initial position. The second consonant is always a liquid /l, r/. 	nan	1:y;0:n	
R1204	teiw1235	Are there consonant clusters (not counting prenasalized consonants) in syllable coda?	0	n		nan	1:y;0:n	
R2203	teiw1235	Is number marked in pronouns?	0	y		nan	0:y	
R2504a	teiw1235	Is plant status a relevant category in the noun class/gender system?	2	n/a		nan	2:n/a;0:y;1:n	
R2507	teiw1235	Is there concord beyond the NP, i.e. agreement of elements outside the NP with the noun class of a noun?	1	n/a		nan	1:n/a;0:n	
R2508	teiw1235	Are there classifiers?	0	y	numeral classifiers for fruits of certain shapes and one general classifier.	nan	2:?;0:y;1:n	
R2601	teiw1235	Are there possessive classes?	0	y		nan	0:y;1:n	
R2702	teiw1235	Is there evidence for any element of a quinary counting system?	0	y		nan	0:y;1:n	
R2703b	teiw1235	Is there a minimal counting system or no clear number altogether?	0	n		nan	0:n	
R3103	teiw1235	Do the same morphemes systematically encode both TAM and person?	1	n/a		nan	1:n/a;0:n	
R3502	teiw1235	Is gender marked anywhere separately to person?	0	n		nan	0:n	
R3605	teiw1235	Is there intransitivising morphology (include clitics)?	0	n		nan	1:?;2:y;0:n	
R4305a	teiw1235	Are there relative clauses, i.e. embedded construction by which a clause modifies a head N?	2	n		nan	1:?;0:y;2:n	
R4307	teiw1235	Are there purposive non-finite subordinate clauses?	1	y		Klamer 2010: 377	2:?;1:y;0:n	
R4308	teiw1235	Are there temporal non-finite subordinate clauses?	0	n		nan	2:?;1:y;0:n	
R4308a	teiw1235	Are there conditional non-finite subordinate clauses?	1	n		nan	2:?;0:y;1:n	
R4309a	teiw1235	Are there complement clauses for speech verbs?	1	n	They are not grammatically subordinate, semantically they are.	Klamer 2010: 363	3:no data;2:?;0:y;1:n	
R4309b	teiw1235	Are there complement clauses for perception verbs?	1	n	They are not grammatically subordinate, semantically they are.	Klamer 2010: 363	3:no data;2:?;0:y;1:n	
R4309c	teiw1235	Is there a complementizer that precedes a complement clause?	4	n/a		nan	1:no data;4:n/a;3:?;2:y;0:n	
R4309d	teiw1235	Is there a complementizer that follows a complement clause?	4	n/a		nan	1:no data;4:n/a;3:?;2:y;0:n	
R4311	teiw1235	Are there participle or gerund constructions, morphologically separate from RC or subordinate clauses?	0	n		nan	1:?;0:n	
R5202	teiw1235	Is there a construction encoding kin dyads?	3	?	Not known	nan	0:no data;3:?;2:y;1:n	
R5203	teiw1235	Is the term for father the same as the term for father's brother  (i.e. F = FB)?	1	y		nan	3:no data;2:?;1:y;0:n	
R5204	teiw1235	Is the term for mother's brother the same as the term for father's brother (i.e. MB = FB)?	0	n		nan	3:no data;2:?;1:y;0:n	
R5205	teiw1235	Are there self-converse grandparent terms?	2	?	Not known	nan	1:no data;2:?;0:n	
R5206	teiw1235	Is there a terminological distinction between cross- and parallel-cousins?	1	y		nan	3:no data;2:?;1:y;0:n	
R5207	teiw1235	Is there a terminological distinction between first and second cousins (for at least some types of cousin)?	0	n		nan	3:no data;2:?;1:y;0:n	
R5208	teiw1235	Is there a terminological distinction between patrilateral and matrilateral cousins (for at least some types of cousin)?	0	n		nan	3:no data;2:?;1:y;0:n	
R5209	teiw1235	Is the term for a man's child distinct from the term for a woman's child?	0	n		nan	2:no data;1:?;0:n	
R5210	teiw1235	Is the term for a man's child the same as the term for a woman's brother's child?	2	?	Not known	nan	3:no data;2:?;0:y;1:n	
R5211	teiw1235	Is relative age a factor in differentiating at least one sibling term?	0	y		nan	1:no data;2:?;0:y	
R5212	teiw1235	Is sex of referent a factor in differentiating at least one sibling term?	1	y		nan	3:no data;2:?;1:y;0:n	
SD224	teiw1235	What is the relative position of possessor noun and possessed in the attributive possessive construction?	0	1		nan	0:1;2:3;1:posn n	
SD295	teiw1235	Do demonstratives encode direction (based on a coordinate system)?	1	n		nan	2:?;0:y;1:n	
SD319	teiw1235	Are S and A marked by the same prefix/proclitic?	?	Not known		nan	1:y;0:n	
SD320	teiw1235	Are S and A marked by the same suffix/enclitic?	?	Not known		nan	1:?;0:n	
SD321	teiw1235	Are S and O marked by the same affix/clitic?	2	n/a		nan	2:n/a;0:y;1:n	
SD341	teiw1235	Can negation be marked postverbally?	0	y		nan	0:y;1:n	
SD342	teiw1235	Can negation be marked preverbally?	0	n		nan	1:y;0:n	
SD343	teiw1235	Are there negative verbs?	0	y	"naxa’ ‘not want’ (negative intention); paat ‘not be able to, not know’ (disability) gaxai ‘do not, should not, must not’ (prohibition)
gasaai ‘cannot’"	nan	2:?;0:y;1:n	
SD344	teiw1235	Are there adjectives (elements denoting property concepts) that act like nouns?	?	Not known		nan	1:y;0:n	
SD369	teiw1235	Can ideophones act like their own morphosyntactic class?	0	n		nan	1:no data;2:?;0:n	
SD381	teiw1235	Is sex of speaker a factor in differentiating at least one sibling term?	1	n		nan	3:no data;2:?;0:y;1:n	
SD388	teiw1235	Are there allophonic phonation types for vowels?	?	Not known		nan	0:y;1:n	
SD389	teiw1235	Is there nominalizing morphology?	?	Not known		nan	0:y	
SD390	teiw1235	Can horizontal direction be marked in demonstratives?	?	Not known		nan	1:y;0:n	
SD391	teiw1235	Is there a predicative possessive construction?	?	Not known		nan	0:y	
SD392	teiw1235	Are S and O marked by the same prefix/proclitic?	?	Not known		nan	0:n	
SD393	teiw1235	Are S and O marked by the same suffix/enclitic?	?	Not known		nan	0:n	
SD394	teiw1235	Are there suppletive forms for negated verbs?	?	Not known		nan	0:y	
SD395	teiw1235	Is topological information expressed by adpositions?	?	Not known		nan	0:n	
SD396	teiw1235	Is topological information expressed by nouns?	?	Not known		nan	0:y	
SD397	teiw1235	Are there native terms expressing directions in space on a geocentric coordinate system (geocentric terms)?	?	Not known		nan	0:y	
SD398	teiw1235	Do geocentric terms have deictic use?	?	Not known		nan	0:y	
SD399	teiw1235	Can geocentric terms function as adverbs?	?	Not known		nan	0:y	
SD400	teiw1235	Can geocentric terms function as adpositions?	?	Not known		nan	0:y	
SD401	teiw1235	Can demonstratives function as adverbs (without changing its form)?	?	Not known		nan	0:y;1:n	
SD402	teiw1235	Can demonstratives function as prepositions (without changing its form)?	?	Not known		nan	0:y;1:n	
SD403	teiw1235	Is it possible to employ an absolute frame of reference when expressing projective spatial relations?	?	Not known		nan	0:y	
SD404	teiw1235	Is it possible to employ an intrinsic frame of reference when expressing projective spatial relations?	?	Not known		nan	0:y	
SD405	teiw1235	Is it possible to employ a relative frame of reference when expressing projective spatial relations?	?	Not known		nan	1:?;0:n	
SD406	teiw1235	Is it possible to use another frame of reference?	?	Not known		nan	1:?;0:y	
SD407	teiw1235	Which frame of reference is preferred in the expression of projective spatial relations?	?	Not known		nan	1:?;0:a	
