Language_ID	Feature_ID	Feature	Value	Answer	Comment	Source	Possible Values	Suggested standardised comments
wers1238	GB315	Can diminutive be marked productively by a system of nominal classification?	?	Not known		nan	1: present;0: absent	Not mentioned
wers1238	GB316	Can singular number of a noun be marked by a productive, obligatory and dedicated marker in the noun phrase that is not bound to the noun and is not an agreement exponent of a plural marker on the noun?	?	Not known		nan	1: present;0: absent	Not mentioned, The marker is adjacent to the verb and it is unclear whether it is morphologically bound to it
wers1238	GB317	Can dual number of a noun be marked by a productive, obligatory and dedicated marker in the noun phrase that is not bound to the noun and is not an agreement exponent of a plural marker on the noun?	?	Not known		nan	1: present;0: absent	Not mentioned, The marker is adjacent to the verb and it is unclear whether it is morphologically bound to it
wers1238	GB318	Can plural number of a noun be marked by a productive, obligatory and dedicated marker in the noun phrase that is not bound to the noun and is not an agreement exponent of a plural marker on the noun?	?	Not known		nan	1: present;0: absent	Not mentioned, The marker is adjacent to the verb and it is unclear whether it is morphologically bound to it
wers1238	GB319	Can trial number of a noun be marked by a productive, obligatory and dedicated marker in the noun phrase that is not bound to the noun and is not an agreement exponent of a plural marker on the noun?	?	Not known		nan	1: present;0: absent	Not mentioned, The marker is adjacent to the verb and it is unclear whether it is morphologically bound to it
wers1238	GB320	Can paucal number of a noun be marked by a productive, obligatory and dedicated marker in the noun phrase that is not bound to the noun and is not an agreement exponent of a plural marker on the noun?	?	Not known		nan	1: present;0: absent	Not mentioned, The marker is adjacent to the verb and it is unclear whether it is morphologically bound to it
wers1238	GB321	Is there an open class of noun stems that are assigned to gender/noun class categories arbitrarily?	?	Not known		nan	1: present;0: absent	Not mentioned, There may be a gender or noun class system but it seems to be semantic
wers1238	GB322	Does the language encode direct evidentiality (perceived with senses)?	?	Not known		nan	1: present;0: absent	Not mentioned
wers1238	GB323	Does the language encode indirect evidentiality (hearsay, inference, etc.)?	?	Not known		nan	1: present;0: absent	Not mentioned
wers1238	GB324	Are some content interrogatives (who?, what?, etc.) expressed in interrogative verbs?	?	Not known		nan	1: present;0: absent	Not mentioned
wers1238	GB325	Is there a count/mass distinction in content interrogatives (e.g. English how many vs. how much)?	?	Not known		nan	1: present;0: absent	Not mentioned
wers1238	GB326	Do (nominal) content interrogatives normally or frequently occur in situ (i.e. in the normal position for a non-interrogative NP in the same participant role)?	?	Not known		nan	1: present;0: absent	Not mentioned
wers1238	GB327	Can the relative clause follow the noun?	?	Not known		nan	1: present;0: absent	Not mentioned
wers1238	GB328	Can the relative clause precede the noun?	?	Not known		nan	1: present;0: absent	Not mentioned
wers1238	GB329	Are there internally-headed relative clauses?	?	Not known		nan	1: present;0: absent	Not mentioned
wers1238	GB330	Are there correlative relative clauses?	?	Not known		nan	1: present;0: absent	Not mentioned
wers1238	GB331	Are there adjoined relative clauses?	?	Not known		nan	1: present;0: absent	Not mentioned
wers1238	GB332	Are there double-headed relative clauses?	?	Not known		nan	1: present;0: absent	Not mentioned
wers1238	GB333	Is there a decimal counting system?	2.0	y		nan	1: present;2:y;0: absent	Not mentioned
wers1238	GB334	Is there synchronic evidence for any element of a quinary counting system?	?	Not known		nan	1: present;0: absent	Not mentioned
wers1238	GB335	Is there synchronic evidence for any element of a vigesimal counting system?	?	Not known		nan	1: present;0: absent	Not mentioned
wers1238	GB336	Is there a body-part tallying system?	2.0	n		nan	1: present;2:n;0: absent	Not mentioned
wers1238	GB502	What is the relative position of possessor pronoun and possessed in the attributive possessive construction?	0.0	1		nan	3:n/a;0:1;2:2;1:n pospro	nan
wers1238	GB503	Are S and A marked by the same affix/clitic?	0.0	y		nan	2:n/a;0:y;1:n	nan
wers1238	GB508	Are there core adjectives (elements denoting property concepts) that act like nouns?	0.0	n		nan	0:n	nan
wers1238	GB509	Are demonstratives used pronominally?	0.0	y		S&H2014:470	2:?;0:y;1:n	nan
wers1238	GB510	Are demonstratives used adnominally?	0.0	y		S&H2014:470	0:y	nan
wers1238	GB511	Do demonstratives encode elevation?	1.0	n		nan	2:?;0:y;1:n	nan
wers1238	GB512	Is there an opposition between three or more elevation terms in the demonstrative system?	3.0	n/a		nan	3:n/a;2:?;0:y;1:n	nan
wers1238	GB514	Is animacy distinguished in the demonstrative system?	0.0	n		nan	2:?;1:y;0:n	nan
wers1238	GB515	Is humanness distinguished in the demonstrative system?	0.0	n		nan	1:?;0:n	nan
wers1238	GB516	How are locationals and demonstratives formally related?	2.0	0		nan	2:0;4:?;0:1;1:3;3:2	nan
wers1238	GB517	Is there an opposition between three or more distance terms in the locational system?	1.0	n		nan	2:?;0:y;1:n	nan
wers1238	GB518	Do locationals encode elevation?	0.0	y		S&H2014:457	2:?;0:y;1:n	nan
wers1238	GB519	Is there an opposition between three or more elevation terms in the locational system?	0.0	y		nan	3:n/a;2:?;0:y;1:n	nan
wers1238	GB520	Do locationals encode direction (based on a coordinate system)?	1.0	n		nan	2:?;0:y;1:n	nan
wers1238	GB521	Is the opposition visible-non-visible marked on locationals?	0.0	n		nan	2:?;1:y;0:n	nan
wers1238	R1102	How many places of articulation are there for stops?	1.0	3		nan	2:5;1:3;0:4	nan
wers1238	R1103	How many places of articulation are there for nasals?	0.0	3		nan	0:3;1:2	nan
wers1238	R1103a	Are there as many points of articulation for nasals as there are for stops?	1.0	y		nan	1:y;0:n	nan
wers1238	R1103b	Is there contrast between heterorganic and homorganic sequence of nasal and velar stop?	0.0	n		nan	0:n	nan
wers1238	R1105	Are there fricative phonemes?	0.0	y		nan	0:y	nan
wers1238	R1106	Are there phonemic prenasalised stops?	0.0	n		nan	0:n	nan
wers1238	R1107	Is there a phonemic distinction between l/r?	0.0	y		nan	0:y	nan
wers1238	R1108	Is there a phonemic velar fricative or glide?	0.0	n		nan	1:y;0:n	nan
wers1238	R1109	Is there a voicing contrast between oral (i.e. non-prenasal) stops?	0.0	y		nan	0:y;1:n	nan
wers1238	R1109a	Is there a laminal/apical contrast?	0.0	n		nan	0:n	nan
wers1238	R1109b	Are there retroflexed consonants?	0.0	n		nan	0:n	nan
wers1238	R1110	Is there phonemic consonant length?	0.0	n		nan	1:y;0:n	nan
wers1238	R1111	Is there phonemic vowel length?	1.0	n		nan	0:y;1:n	nan
wers1238	R1112	Are there contrastive phonation types for vowels?	0.0	n		nan	1:y;0:n	nan
wers1238	R1113a	Are there two or more contrastive central vowels?	1.0	n		nan	0:y;1:n	nan
wers1238	R1115	Is there lexically determined suprasegmental prominence?	0.0	y		nan	0:y;1:n	nan
wers1238	R1116	Is there weight-sensitive suprasegmental prominence	?	Not known		nan	0:y;1:n	nan
wers1238	R1117	Is there syllable position sensitive suprasegmental prominence?	3.0	?		nan	2:no data;3:?;0:y;1:n	nan
wers1238	R1118	Is there a tonal system?	1.0	n		nan	0:y;1:n	nan
wers1238	R1202	Are there word-final consonants?	0.0	y		nan	0:y	nan
wers1238	R1203a	Are there consonant clusters (not counting prenasalized consonants) in syllable onset?	1.0	y	most commonly stop + liquid	S&H2014: 448	1:y;0:n	nan
wers1238	R1204	Are there consonant clusters (not counting prenasalized consonants) in syllable coda?	0.0	n		nan	1:y;0:n	nan
wers1238	R2203	Is number marked in pronouns?	0.0	y		nan	0:y	nan
wers1238	R2504a	Is plant status a relevant category in the noun class/gender system?	2.0	n/a		nan	2:n/a;0:y;1:n	nan
wers1238	R2507	Is there concord beyond the NP, i.e. agreement of elements outside the NP with the noun class of a noun?	1.0	n/a		nan	1:n/a;0:n	nan
wers1238	R2508	Are there classifiers?	0.0	y	only one human classifier -(a)nin	S&H2014:467	2:?;0:y;1:n	nan
wers1238	R2601	Are there possessive classes?	0.0	y		nan	0:y;1:n	nan
wers1238	R2702	Is there evidence for any element of a quinary counting system?	0.0	y		nan	0:y;1:n	nan
wers1238	R2703b	Is there a minimal counting system or no clear number altogether?	0.0	n		nan	0:n	nan
wers1238	R3103	Do the same morphemes systematically encode both TAM and person?	1.0	n/a		nan	1:n/a;0:n	nan
wers1238	R3502	Is gender marked anywhere separately to person?	0.0	n		nan	0:n	nan
wers1238	R3605	Is there intransitivising morphology (include clitics)?	0.0	n		nan	1:?;2:y;0:n	nan
wers1238	R4305a	Are there relative clauses, i.e. embedded construction by which a clause modifies a head N?	0.0	y		nan	1:?;0:y;2:n	nan
wers1238	R4307	Are there purposive non-finite subordinate clauses?	0.0	n	serial verb constructions or clause juxtaposition 	S&H2014: 463	2:?;1:y;0:n	nan
wers1238	R4308	Are there temporal non-finite subordinate clauses?	0.0	n	serial verb constructions or clause juxtaposition 	nan	2:?;1:y;0:n	nan
wers1238	R4308a	Are there conditional non-finite subordinate clauses?	1.0	n	serial verb constructions or clause juxtaposition 	S&H2014: 462 ex (45)	2:?;0:y;1:n	nan
wers1238	R4309a	Are there complement clauses for speech verbs?	2.0	?	no examples	nan	3:no data;2:?;0:y;1:n	nan
wers1238	R4309b	Are there complement clauses for perception verbs?	1.0	n		nan	3:no data;2:?;0:y;1:n	nan
wers1238	R4309c	Is there a complementizer that precedes a complement clause?	3.0	?		nan	1:no data;4:n/a;3:?;2:y;0:n	nan
wers1238	R4309d	Is there a complementizer that follows a complement clause?	3.0	?		nan	1:no data;4:n/a;3:?;2:y;0:n	nan
wers1238	R4311	Are there participle or gerund constructions, morphologically separate from RC or subordinate clauses?	0.0	n		nan	1:?;0:n	nan
wers1238	R5202	Is there a construction encoding kin dyads?	3.0	?		nan	0:no data;3:?;2:y;1:n	nan
wers1238	R5203	Is the term for father the same as the term for father's brother  (i.e. F = FB)?	0.0	n		Holton 2014: 225-226	3:no data;2:?;1:y;0:n	nan
wers1238	R5204	Is the term for mother's brother the same as the term for father's brother (i.e. MB = FB)?	1.0	y		nan	3:no data;2:?;1:y;0:n	nan
wers1238	R5205	Are there self-converse grandparent terms?	2.0	?		nan	1:no data;2:?;0:n	nan
wers1238	R5206	Is there a terminological distinction between cross- and parallel-cousins?	0.0	n	all -nang / -kaku 	nan	3:no data;2:?;1:y;0:n	nan
wers1238	R5207	Is there a terminological distinction between first and second cousins (for at least some types of cousin)?	0.0	n	all -tam	Holton 2014: 225	3:no data;2:?;1:y;0:n	nan
wers1238	R5208	Is there a terminological distinction between patrilateral and matrilateral cousins (for at least some types of cousin)?	0.0	n		nan	3:no data;2:?;1:y;0:n	nan
wers1238	R5209	Is the term for a man's child distinct from the term for a woman's child?	0.0	n		nan	2:no data;1:?;0:n	nan
wers1238	R5210	Is the term for a man's child the same as the term for a woman's brother's child?	1.0	n		nan	3:no data;2:?;0:y;1:n	nan
wers1238	R5211	Is relative age a factor in differentiating at least one sibling term?	0.0	y		nan	1:no data;2:?;0:y	nan
wers1238	R5212	Is sex of referent a factor in differentiating at least one sibling term?	1.0	y		Holton 2014: 224	3:no data;2:?;1:y;0:n	nan
wers1238	SD224	What is the relative position of possessor noun and possessed in the attributive possessive construction?	0.0	1		nan	0:1;2:3;1:posn n	nan
wers1238	SD295	Do demonstratives encode direction (based on a coordinate system)?	1.0	n		nan	2:?;0:y;1:n	nan
wers1238	SD319	Are S and A marked by the same prefix/proclitic?	?	Not known		nan	1:y;0:n	nan
wers1238	SD320	Are S and A marked by the same suffix/enclitic?	?	Not known		nan	1:?;0:n	nan
wers1238	SD321	Are S and O marked by the same affix/clitic?	0.0	y		nan	2:n/a;0:y;1:n	nan
wers1238	SD341	Can negation be marked postverbally?	0.0	y		nan	0:y;1:n	nan
wers1238	SD342	Can negation be marked preverbally?	0.0	n		nan	1:y;0:n	nan
wers1238	SD343	Are there negative verbs?	0.0	y	amalosi 'not want'	S&H2014:470	2:?;0:y;1:n	nan
wers1238	SD344	Are there adjectives (elements denoting property concepts) that act like nouns?	?	Not known		nan	1:y;0:n	nan
wers1238	SD369	Can ideophones act like their own morphosyntactic class?	2.0	?		nan	1:no data;2:?;0:n	nan
wers1238	SD381	Is sex of speaker a factor in differentiating at least one sibling term?	1.0	n		nan	3:no data;2:?;0:y;1:n	nan
wers1238	SD388	Are there allophonic phonation types for vowels?	?	Not known		nan	0:y;1:n	nan
wers1238	SD389	Is there nominalizing morphology?	?	Not known		nan	0:y	nan
wers1238	SD390	Can horizontal direction be marked in demonstratives?	?	Not known		nan	1:y;0:n	nan
wers1238	SD391	Is there a predicative possessive construction?	?	Not known		nan	0:y	nan
wers1238	SD392	Are S and O marked by the same prefix/proclitic?	?	Not known		nan	0:n	nan
wers1238	SD393	Are S and O marked by the same suffix/enclitic?	?	Not known		nan	0:n	nan
wers1238	SD394	Are there suppletive forms for negated verbs?	?	Not known		nan	0:y	nan
wers1238	SD395	Is topological information expressed by adpositions?	?	Not known		nan	0:n	nan
wers1238	SD396	Is topological information expressed by nouns?	?	Not known		nan	0:y	nan
wers1238	SD397	Are there native terms expressing directions in space on a geocentric coordinate system (geocentric terms)?	?	Not known		nan	0:y	nan
wers1238	SD398	Do geocentric terms have deictic use?	?	Not known		nan	0:y	nan
wers1238	SD399	Can geocentric terms function as adverbs?	?	Not known		nan	0:y	nan
wers1238	SD400	Can geocentric terms function as adpositions?	?	Not known		nan	0:y	nan
wers1238	SD401	Can demonstratives function as adverbs (without changing its form)?	?	Not known		nan	0:y;1:n	nan
wers1238	SD402	Can demonstratives function as prepositions (without changing its form)?	?	Not known		nan	0:y;1:n	nan
wers1238	SD403	Is it possible to employ an absolute frame of reference when expressing projective spatial relations?	?	Not known		nan	0:y	nan
wers1238	SD404	Is it possible to employ an intrinsic frame of reference when expressing projective spatial relations?	?	Not known		nan	0:y	nan
wers1238	SD405	Is it possible to employ a relative frame of reference when expressing projective spatial relations?	?	Not known		nan	1:?;0:n	nan
wers1238	SD406	Is it possible to use another frame of reference?	?	Not known		nan	1:?;0:y	nan
wers1238	SD407	Which frame of reference is preferred in the expression of projective spatial relations?	?	Not known		nan	1:?;0:a	nan
