Language_ID	Feature_ID	Feature	Value	Answer	Comment	Source	Possible Values	Suggested standardised comments
wers1238	GB140	Are verbal and non-verbal predicates marked by the same negator?	3.0	y		nan	4:?;1: present;3:y;2:n;0: absent	Not mentioned, A special negator or negative form of the verb is used for existential meanings, A special negator or negative form of the copula is used with nominal predicates, A special negator or negative form of the copula is used with predicative adjectives, Other negative forms but which are discounted by the clarifying comment
wers1238	GB141	Are S and O conflated morphologically in at least some basic constructions, i.e. simple main clauses?	2.0	y		nan	4:?;1: present;2:y;3:n;0: absent	Not mentioned
wers1238	GB142	Are S and A conflated morphologically in at least some basic constructions, i.e. simple main clauses?	2.0	y		nan	4:?;1: present;2:y;3:n;0: absent	Not mentioned
wers1238	GB143	Are S and O conflated morphologically across clause boundaries, i.e. acting as syntactic pivot?	3.0	?		nan	2:no data;3:?;1:y;0:n	nan
wers1238	GB144	Are S and A conflated morphologically across clause boundaries, i.e. acting as syntactic pivot?	3.0	?		nan	2:no data;3:?;1:y;0:n	nan
wers1238	GB145	Do S and O operate in the same way, and differently from A, for the purpose of any syntactic construction?	0.0	y		nan	2:?;0:y;1:n	nan
wers1238	GB146	Is there a morpho-syntactic distinction between predicates expressing controlled versus uncontrolled events or states?	3.0	n		nan	4:?;1: present;2:y;3:n;0: absent	Not mentioned, The experiencer is expressed as an object, Only for mental states and emotions, There are verbs with unusual case frames but not necessarily controlled versus uncontrolled
wers1238	GB147	Is there a morphologically marked passive construction?	2.0	n		nan	3:?;1: present;2:n;0: absent	Not mentioned, The marker is adjacent to the verb but not treated as morphologically bound
wers1238	GB148	Is there a morphologically marked antipassive?	2.0	n		nan	3:?;1: present;2:n;0: absent	Not mentioned, The marker is adjacent to the verb but not treated as morphologically bound
wers1238	GB149	Is there a morphologically marked inverse?	2.0	n		nan	1: present;3:y;2:n;0: absent	Not mentioned, The marker is adjacent to the verb but not treated as morphologically bound
wers1238	GB150	Is there clause chaining?	3.0	n		nan	5:?;0: absent;4:no data;1: present;2:y;3:n	Not mentioned, Hard to distinguish from serial verb constructions
wers1238	GB151	Is there a morphologically-marked switch reference system?	2.0	n		nan	1: present;3:y;2:n;0: absent	Not mentioned
wers1238	GB152	Is there a morphologically marked distinction between simultaneous and sequential clauses?	3.0	n	the examples show no morphological distinction but rather a different use of conjunctions: pan=sa 'while', while sequential clauses are not marked with a conjunction	S&H2014: 470 ex (71) vs. 463 ex (49c)	4:?;1: present;2:y;3:n;0: absent	Not mentioned, There is a marker adjacent to the verb but not treated as morphologically bound
wers1238	GB153	Is the verb 'say' or a quotative construction used in desiderative constructions?	0.0	n		nan	1:?;2:y;0:n	nan
wers1238	GB154	Are causatives formed by serial verb constructions?	0.0	y	svc with ong 'use'	S&H2014: 482-483	2:?;0:y;1:n	nan
wers1238	GB155	Are causatives formed by affixes/clitics?	2.0	n		nan	1: present;3:y;2:n;0: absent	Not mentioned, The marker is adjacent to the verb but not treated as morphologically bound
wers1238	GB156	Are causatives formed by constructions involving 'say'?	2.0	n		nan	1: present;2:n;0: absent	Not mentioned
wers1238	GB157	Is there tail-head linkage?	6.0	?		nan	6:?;0: absent;5:no data;1: present;4:no d ata;2:y;3:n	Not mentioned
wers1238	GB158	Are verbs reduplicated?	5.0	?		nan	5:?;0: absent;4:no data;1: present;2:y;3:n	Not mentioned, Some examples but not productive, Possible partial reduplication, There are instances of repeated verbs but that does not count as reduplication
wers1238	GB159	Are nouns reduplicated?	5.0	?		nan	5:?;0: absent;4:no data;1: present;3:y;2:n	Not mentioned, Some examples but not productive, Possible partial reduplication, The prototypical noun 'book book' type reduplication is known to exist but not other types
wers1238	GB160	Are elements apart from verbs or nouns reduplicated?	5.0	?		nan	5:?;0: absent;3:no data;1: present;2:y;4:n	Not mentioned, Numerals are reduplicated, Adjectives are reduplicated but are arguably a type of verb, Possible partial reduplication
wers1238	GB162	Is there a distinction between masculine and feminine in 1st person pronouns?	0.0	n		nan	0:n	nan
wers1238	GB163	How many genders/noun classes are there?	4.0	n/a		nan	4:n/a;3:?;2:n;1:2;0:several	nan
wers1238	GB165	Can trial number be marked on the noun itself?	2.0	n		nan	1: present;2:n;0: absent	Not mentioned, The marker is adjacent to the noun but not treated as morphologically bound
wers1238	GB166	Can paucal number be marked on the noun itself?	2.0	n		nan	1: present;2:n;0: absent	Not mentioned, The marker is adjacent to the noun but not treated as morphologically bound
wers1238	GB167	Are there logophoric pronouns for the 3rd person?	2.0	n		nan	1: present;2:n;0: absent	Not mentioned
wers1238	GB168	Is there a distinction between inanimate and animate in 3rd person singular pronouns?	1.0	n		nan	0:y;1:n	nan
wers1238	GB169	Is there a distinction between masculine and feminine in 3rd person singular pronouns?	0.0	n		nan	0:n	nan
wers1238	GB170	Can an attributive nominal modifier denoting a property concept agree with any gender/noun class of the noun it modifies?	3.0	n/a		nan	3:n/a;1: present;2:n;0: absent	Not mentioned, An additional marker dependent on the gender of the noun is present but not called agreement
wers1238	GB171	Can an adnominal demonstrative agree in gender/noun class with the noun it modifies?	4.0	n/a		nan	4:n/a;1: present;3:y;2:n;0: absent	Not mentioned, An additional marker dependent on the gender of the noun is present but not called agreement
wers1238	GB172	Can articles agree with the gender/noun class of the noun they modify?	2.0	n		nan	3:n/a;1: present;2:n;0: absent	Not mentioned, An additional marker dependent on the gender of the noun is present but not called agreement, It is not clear whether it is an article
wers1238	GB173	Are noun class and number always marked by a portmanteau morpheme on the noun?	1.0	n/a		nan	1:n/a;0:n	nan
wers1238	GB174	Are noun class and number marked by a portmanteau morpheme on the noun in singular?	1.0	n/a		nan	1:n/a;0:n	nan
wers1238	GB175	Are noun class and number marked by a portmanteau morpheme on the noun in plural?	1.0	n/a		nan	1:n/a;0:n	nan
wers1238	GB176	Can agreement of gender/noun class and number be marked by a portmanteau morpheme on other items in the noun phrase?	1.0	n/a		nan	1:n/a;0:n	nan
wers1238	GB177	Can the verb carry a marker of animacy of argument, unrelated to any gender/noun class of the argument?	3.0	n		nan	4:?;1: present;2:y;3:n;0: absent	Not mentioned, Animacy is treated as a gender and therefore the question does not make sense, The marker is adjacent to the verb but not treated as morphologically bound
wers1238	GB178	Are there several different singular genders/noun classes that can have the same plural gender/noun class?	1.0	n/a		nan	1:n/a;0:n	nan
wers1238	GB179	Are there genders/noun classes that cannot take number marking?	1.0	n/a		nan	1:n/a;0:n	nan
wers1238	GB181	Is number marking obligatory on certain (types of) nouns?	3.0	n/a		nan	3:n/a;1:?;2:y;0:n	nan
wers1238	GB182	Is number marking obligatory on animate nouns?	2.0	n/a		nan	2:n/a;1:?;0:n	nan
wers1238	GB183	Is number marking obligatory on human nouns?	2.0	n/a		nan	2:n/a;1:?;0:n	nan
wers1238	GB184	Can an attributive nominal modifier denoting a property concept agree with the number of the noun it modifies?	2.0	n		nan	1: present;2:n;0: absent	Not mentioned, An additional marker dependent on the number of the noun is present but not called agreement
wers1238	GB185	Can an adnominal demonstrative agree in number with the noun it modifies?	2.0	n		nan	1: present;2:n;0: absent	Not mentioned, An additional marker dependent on the number of the noun is present but not called agreement
wers1238	GB186	Can articles agree in number with the noun they modify?	2.0	n		nan	3:n/a;1: present;2:n;0: absent	Not mentioned, An additional marker dependent on the number of the noun is present but not called agreement, It is not clear whether it is an article
wers1238	GB187	Is there any productive diminutive marking on the noun (exclude marking by system of nominal classification only)?	2.0	n		nan	3:n/a;1: present;2:n;0: absent	Not mentioned, The marker is adjacent to the noun but not treated as morphologically bound
wers1238	GB188	Is there any productive augmentative marking on the noun (exclude marking by system of nominal classification only)?	2.0	n		nan	1: present;2:n;0: absent	Not mentioned, The marker is adjacent to the noun but not treated as morphologically bound
wers1238	GB191	Is there a morphologically marked middle voice construction?	0.0	n		nan	1:?;0:n	nan
wers1238	GB192	Are the noun's phonological properties relevant for any gender assignment?	3.0	n/a		nan	3:n/a;1: present;2:n;0: absent	Not mentioned, There is gender and it is possible that phonology influences assignment
wers1238	GB193	What is the order of noun and attributive nominal modifier denoting a property concept?	5.0	2		nan	0: they cannot be used attributively;4:1;2: N - ANM;6:n att;3: both;5:2;1: ANM - N	Not mentioned, Certain adjectives take a different ordering, Adjectives can take either order
wers1238	GB194	Are there indefinite or non-specific articles?	0.0	n		nan	1:y;0:n	nan
wers1238	GB195	Can a noun receive more than one noun class marker at the same time?	1.0	n/a		nan	1:n/a;0:n	nan
wers1238	GB196	Is there a gender distinction in 2nd person pronouns?	2.0	n		nan	1: present;2:n;0: absent	Not mentioned
wers1238	GB197	Is there a gender distinction in 1st person pronouns?	2.0	n		nan	1: present;2:n;0: absent	Not mentioned
wers1238	GB198	Can a numeral used attributively agree with any gender/noun class of the noun it modifies?	4.0	n/a		nan	4:n/a;1: present;3:y;2:n;0: absent	Not mentioned, An additional marker dependent on the gender of the noun is present but not called agreement
wers1238	GB199	Can verbs agree with the gender/noun class of the nominal object?	2.0	n/a		nan	2:n/a;1:y;0:n	nan
wers1238	GB200	Can verbs agree in number with the nominal object?	0.0	y		nan	2:?;0:y;1:n	nan
wers1238	GB202	Is there a distinction between masculine and feminine in 2nd person pronouns?	0.0	n		nan	0:n	nan
wers1238	GB203	"What is the order of the collective universal quantifier (""all"") and the noun?"	5.0	2		nan	7:?;1: UQ-N;2: N-UQ;0: no UQ;4:0;3: both;6:3;5:2	Not mentioned, 'All' does not modify the noun e.g. it is an adverb
wers1238	GB204	Is there a distinction between collective ('all') and distributive ('every') universal quantifiers?	3.0	?		nan	3:?;6:no;0: absent;7:n/a;1: present;2:y;5:n;4:no data	Not mentioned
wers1238	GB205	Is number marking prohibited on inanimate nouns?	2.0	n/a		nan	2:n/a;1:?;0:n	nan
wers1238	GB206	Is number marking prohibited on mass nouns?	2.0	n/a		nan	2:n/a;1:?;0:n	nan
wers1238	GB207	Is number marking optional on certain (types of) nouns?	3.0	n/a		nan	3:n/a;2:?;1:y;0:n	nan
wers1238	GB208	Can singular number be marked by a prefix on the noun?	1.0	n/a		nan	1:n/a;0:n	nan
wers1238	GB209	Can singular number be marked by a suffix on the noun?	1.0	n/a		nan	1:n/a;0:n	nan
wers1238	GB210	Can singular number be marked by suppletion on the noun?	1.0	n/a		nan	1:n/a;0:n	nan
wers1238	GB211	Can singular number be marked by tone alone on the noun?	1.0	n/a		nan	1:n/a;0:n	nan
wers1238	GB212	Can dual number be marked by a prefix on the noun?	1.0	n/a		nan	1:n/a;0:n	nan
wers1238	GB213	Can dual number be marked by a suffix on the noun?	1.0	n/a		nan	1:n/a;0:n	nan
wers1238	GB214	Can dual number be marked by suppletion on the noun?	1.0	n/a		nan	1:n/a;0:n	nan
wers1238	GB215	Can dual number be marked by tone alone on the noun?	1.0	n/a		nan	1:n/a;0:n	nan
wers1238	GB216	Can dual number be marked by reduplication on the noun?	1.0	n/a		nan	1:n/a;0:n	nan
wers1238	GB217	Can plural number be marked by a prefix on the noun?	1.0	n/a		nan	1:n/a;0:n	nan
wers1238	GB218	Can plural number be marked by a suffix on the noun?	2.0	n/a		nan	2:n/a;1:y;0:n	nan
wers1238	GB219	Can plural number be marked by suppletion on the noun?	1.0	n/a		nan	1:n/a;0:n	nan
wers1238	GB220	Can plural number be marked by tone alone on the noun?	1.0	n/a		nan	1:n/a;0:n	nan
wers1238	GB221	Can plural number be marked by reduplication on the noun?	2.0	n/a		nan	2:n/a;1:y;0:n	nan
wers1238	GB222	Can trial number be marked by a prefix on the noun?	1.0	n/a		nan	1:n/a;0:n	nan
wers1238	GB223	Can trial number be marked by a suffix on the noun?	1.0	n/a		nan	1:n/a;0:n	nan
wers1238	GB224	Can trial number be marked by suppletion on the noun?	1.0	n/a		nan	1:n/a;0:n	nan
wers1238	GB225	Can trial number be marked by tone alone on the noun?	1.0	n/a		nan	1:n/a;0:n	nan
wers1238	GB226	Can trial number be marked by reduplication on the noun?	1.0	n/a		nan	1:n/a;0:n	nan
wers1238	GB227	Can paucal number be marked by a prefix on the noun?	1.0	n/a		nan	1:n/a;0:n	nan
wers1238	GB228	Can paucal number be marked by a suffix on the noun?	1.0	n/a		nan	1:n/a;0:n	nan
wers1238	GB229	Can paucal number be marked by suppletion on the noun?	1.0	n/a		nan	1:n/a;0:n	nan
wers1238	GB230	Can paucal number be marked by tone alone on the noun?	1.0	n/a		nan	1:n/a;0:n	nan
wers1238	GB231	Can paucal number be marked by reduplication on the noun?	1.0	n/a		nan	1:n/a;0:n	nan
wers1238	GB232	Can diminutive be marked by a prefix on the noun?	1.0	n/a		nan	1:n/a;0:n	nan
wers1238	GB234	Can diminutive be marked by a suffix on the noun?	1.0	n/a		nan	1:n/a;0:n	nan
wers1238	GB235	Can diminutive be marked by suppletion on the noun?	1.0	n/a		nan	1:n/a;0:n	nan
wers1238	GB236	Can diminutive be marked by tone on the noun?	1.0	n/a		nan	1:n/a;0:n	nan
wers1238	GB237	Can diminutive be marked by reduplication on the noun?	1.0	n/a		nan	1:n/a;0:n	nan
wers1238	GB238	Can diminutive be marked by noun class selection?	1.0	n/a		nan	1:n/a;0:n	nan
wers1238	GB239	Can augmentative be marked by a prefix on the noun?	1.0	n/a		nan	1:n/a;0:n	nan
wers1238	GB240	Can augmentative be marked by a suffix on the noun?	1.0	n/a		nan	1:n/a;0:n	nan
wers1238	GB241	Can augmentative be marked by suppletion on the noun?	1.0	n/a		nan	1:n/a;0:n	nan
wers1238	GB242	Can augmentative be marked by tone on the noun?	1.0	n/a		nan	1:n/a;0:n	nan
wers1238	GB243	Can augmentative be marked by reduplication on the noun?	1.0	n/a		nan	1:n/a;0:n	nan
wers1238	GB244	Can augmentative be marked by noun class selection?	1.0	n/a		nan	1:n/a;0:n	nan
wers1238	GB245	Can gender/noun class be marked by a prefix on the noun?	1.0	n/a		nan	1:n/a;0:n	nan
wers1238	GB246	Can gender/noun class be marked by a suffix on the noun?	1.0	n/a		nan	1:n/a;0:n	nan
wers1238	GB247	Can gender/noun class be marked by suppletion on the noun?	1.0	n/a		nan	1:n/a;0:n	nan
wers1238	GB248	Can gender/noun class be marked by tone on the noun only?	1.0	n/a		nan	1:n/a;0:n	nan
wers1238	GB249	Are there variations in marking strategies of core participants?	1.0	y		nan	1:y;0:n	nan
wers1238	GB250	Can predicative possession be formed with a habeo-verb?	3.0	n		nan	4:?;1: present;2:y;3:n;0: absent	Not mentioned, The habeo verb is also an existential verb
wers1238	GB251	Can predicative possession be formed by an intransitive construction with an locational/existential/copula predicate where the possessum is the subject?	1.0	n		nan	2:?;0:y;1:n	nan
wers1238	GB252	Can predicative possession be formed with a locative possessive?	3.0	n		nan	4:?;1: present;2:y;3:n;0: absent	Not mentioned
wers1238	GB253	Can predicative possession be formed with a dative possessive?	3.0	n		nan	4:?;1: present;2:y;3:n;0: absent	Not mentioned
wers1238	GB254	Can predicative possession be formed with a genitive possessive?	2.0	y	cloth DEF 1SG.POSS 'the cloth is mine'	S&H2014:479	4:?;1: present;2:y;3:n;0: absent	Not mentioned
wers1238	GB255	Can predicative possession be formed with a topic possessive?	2.0	n		nan	3:?;1: present;2:n;0: absent	Not mentioned
wers1238	GB256	Can predicative possession be formed with a conjunctional possessive?	2.0	n		nan	3:?;1: present;2:n;0: absent	Not mentioned
wers1238	GB257	Can polar interrogation be marked by intonation only?	3.0	n		nan	4:?;1: present;2:y;3:n;0: absent	Not mentioned, The question particle carries tone but this might also be intonation
wers1238	GB258	Is the polar interrogative intonation rising?	3.0	n/a		nan	2:no data;3:n/a;1:?;0:y	nan
wers1238	GB259	Is the polar interrogative intonation falling?	4.0	n/a		nan	2:no data;4:n/a;1:?;3:y;0:n	nan
wers1238	GB260	Can polar interrogation be marked by change in word order only?	2.0	n		nan	1: present;2:n;0: absent	Not mentioned
wers1238	GB261	Can polar interrogation be marked by a particle only?	1.0	y		nan	2:?;1:y;0:n	nan
wers1238	GB262	Is there a clause-initial polar interrogative particle?	2.0	n		nan	4:n/a;3:?;1: present;2:n;0: absent	Not mentioned, The elements used in polar interrogation are distributed over the clause
wers1238	GB263	Is there a clause-final polar interrogative particle?	2.0	y		nan	3:?;0: absent;5:n/a;1: present;2:y;4:n	Not mentioned, The elements used in polar interrogation are distributed over the clause
wers1238	GB264	Is there a clause-medial polar interrogative particle?	2.0	n		nan	4:n/a;3:?;1: present;2:n;0: absent	Not mentioned, The elements used in polar interrogation are distributed over the clause
wers1238	GB265	"Can comparative constructions be construed with a verb meaning ""surpass"" or ""exceed""?"	5.0	?		nan	5:?;0: absent;2:no data;1: present;4:y;3:n	Not mentioned
wers1238	GB266	Can comparative constructions be construed with a locative comparative?	5.0	?		nan	5:?;0: absent;4:no data;1: present;3:y;2:n	Not mentioned
wers1238	GB267	Can comparative constructions be construed with a from-comparative?	3.0	?		nan	1:no data;3:?;2:y;0:n	nan
wers1238	GB268	Can comparative constructions be construed with a to-comparative?	3.0	?		nan	2:no data;3:?;1:y;0:n	nan
wers1238	GB269	Can comparative constructions be construed with a benefactive comparative?	2.0	?		nan	1:no data;2:?;0:n	nan
wers1238	GB270	Can comparative constructions be construed with conjoined clauses?	5.0	?		nan	5:?;0: absent;2:no data;1: present;3:y;4:n	Not mentioned
wers1238	GB271	Are the predicates in the conjoined comparative construction antonyms?	2.0	?		nan	0:no data;4:n/a;2:?;3:y;1:n	nan
wers1238	GB272	Do the  predicates in the conjoined comparative construction differ in polarity?	2.0	?		nan	0:no data;4:n/a;2:?;3:y;1:n	nan
wers1238	GB273	Can comparative constructions be construed with a particle?	5.0	?		nan	5:?;0: absent;3:no data;1: present;4:y;2:n	Not mentioned
wers1238	GB274	Is the element marking the gradable property concepts in the comparative construction marked for comparison in any way?	3.0	?		nan	0:no data;3:?;2:y;1:n	nan
wers1238	GB275	Is the element marking the property concept in the comparative construction marked by an affix indicating comparision or grading?	5.0	?		nan	5:?;4:no data;0: absent;6:n/a;1: present;3:y;2:n	Not mentioned, The marker is adjacent to the property word but not treated as morphologically bound
wers1238	GB276	Is the element marking the property concept in the comparative construction marked by a sepeare degree word indicating comparision or grading?	5.0	?		nan	5:?;4:no data;0: absent;6:n/a;1: present;3:y;2:n	Not mentioned, The marker is adjacent to the property word but not treated as morphologically bound
wers1238	GB277	Can comparative constructions be construed with a at-comparative?	3.0	?		nan	2:no data;3:?;1:y;0:n	nan
wers1238	GB278	Is there variation in conflation of arguments marking core participants?	1.0	n		nan	2:no data;3:?;0:y;1:n	nan
wers1238	GB279	Is there variation in conflation of core participants based on TAM distinctions?	5.0	n/a		nan	4:?;3:no data;0: absent;5:n/a;1: present;2:n	Not mentioned
wers1238	GB280	Are variation in conflation of core participants based on verb classes?	4.0	n/a		nan	2:no data;4:n/a;3:?;0:y;1:n	nan
wers1238	GB281	Is there variation in conflation of core participants based on clause type, e.g. main vs. subordinate?	5.0	n/a		nan	4:?;3:no data;0: absent;5:n/a;1: present;2:n	Not mentioned
wers1238	GB282	Are variation in conflation of core participants based on person distinctions?	4.0	n/a		nan	2:no data;4:n/a;3:?;0:y;1:n	nan
wers1238	GB283	Can verbs agree with the gender/noun class of the nominal subject?	2.0	n/a		nan	2:n/a;1:y;0:n	nan
wers1238	GB284	Can verbs agree with the number of the nominal subject?	1.0	y		nan	2:?;1:y;0:n	nan
wers1238	GB285	Can polar interrogation be marked by a question particle and verbal morphology?	2.0	n		nan	1: present;3:y;2:n;0: absent	Not mentioned, The marker is adjacent to the verb but not treated as morphologically bound
wers1238	GB286	Can polar interrogation be marked by verbal morphology only?	2.0	n		nan	1: present;2:n;0: absent	Not mentioned, The marker is adjacent to the verb but not treated as morphologically bound
wers1238	GB287	Can recipients be treated as a transitive object, i.e. as Direct Object in terms of case marking?	0.0	n		nan	2:n/a;1:y?;0:n	nan
wers1238	GB288	Can recipients be treated as a transitive object, i.e. as Direct Object in terms of core argument marking by adpositions?	0.0	n		nan	1:n/a;0:n	nan
wers1238	GB289	Can recipients be treated as a transitive object, i.e. as Direct Object in terms of verbal agreement marking?	1.0	y		nan	3:n/a;2:?;1:y;0:n	nan
wers1238	GB290	Can recipients be treated as a transitive object, i.e. as Direct Object in terms of verbal person marking (not agreement)?	0.0	y		nan	2:n/a;0:y;1:n	nan
wers1238	GB291	Can polar interrogation be marked by tone?	2.0	n		nan	4:n/a;3:?;1: present;2:n;0: absent	Not mentioned, The question particle carries tone but this might also be intonation
wers1238	GB292	Is the particle marking polar interrogation not tone?	0.0	y		nan	3:n/a;2:?;0:y;1:n	nan
wers1238	GB294	Are there ideophones that depict sensory imagery beyond sound?	2.0	?		nan	1:no data;2:?;0:n	nan
wers1238	GB295	Can ideophones act like verbs?	3.0	?		nan	2:no data;3:?;0:y;1:n	nan
wers1238	GB295	Can ideophones act like verbs?	3.0	?		nan	2:no data;3:?;0:y;1:n	nan
wers1238	GB296	Is there a morphosyntactically definable class of ideophones (beyond sound)?	?	Not known		nan	4:no data;3:?;1: present;2:n;0: absent	Not mentioned
wers1238	GB297	Can polar interrogation be marked by a construction of the type “V Neg V”?	?	Not known		nan	1: present;0: absent	Not mentioned
wers1238	GB298	Can standard negation be marked by negative auxiliaries?	?	Not known		nan	1: present;0: absent	Not mentioned, Unclear whether it should count as an auxiliary given that no verbs carry inflection
wers1238	GB299	Can standard negation be marked by a freestanding particle?	?	Not known		nan	1: present;0: absent	Not mentioned
wers1238	GB300	Is there a verb for the function 'give' that is suppletive for any grammatical category?	?	Not known		nan	1: present;0: absent	Not mentioned
wers1238	GB301	Does the language have inclusory constructions productively?	?	Not known		nan	1: present;0: absent	Not mentioned
wers1238	GB302	Is there a dedicated, obligatory and productive construction that marks passive voice, not morphologically on the verb nor on the A argument?	?	Not known		nan	1: present;0: absent	Not mentioned, The marker is adjacent to the verb but it is unclear whether it is morphologically bound
wers1238	GB303	Is there a dedicated, obligatory, productive construction that marks antipassive voice, not morphologically on the verb?	?	Not known		nan	1: present;0: absent	Not mentioned, The marker is adjacent to the verb but it is unclear whether it is morphologically bound
wers1238	GB304	Can the A argument be overtly expressed in a passive clause or be overtly marked to signal a passive clause?	?	Not known		nan	1: present;0: absent	Not mentioned
wers1238	GB305	Are there phonologically independent reflexive pronouns?	?	Not known		nan	1: present;0: absent	Not mentioned, Not clear if they are phonologically independent
wers1238	GB306	Are there reciprocal pronouns that are not-bipartite?	?	Not known		nan	1: present;0: absent	Not mentioned
wers1238	GB307	Are there bipartite reciprocal pronouns?	?	Not known		nan	1: present;0: absent	Not mentioned
wers1238	GB308	Can tense be marked by a productive, obligatory and dedicated construction that is not morphologically bound to the verb?	?	Not known		nan	1: present;0: absent	Not mentioned, The marker is adjacent to the verb but not treated as morphologically bound
wers1238	GB309	Are there multiple past or future tenses, distinguishing distance from Time of Reference, in any form?	?	Not known		nan	1: present;0: absent	Not mentioned, The marker is adjacent to the verb but not treated as morphologically bound
wers1238	GB310	Can aspect be marked by a productive, obligatory and dedicated construction that is not morphologically bound to the verb?	?	Not known		nan	1: present;0: absent	Not mentioned, The marker is adjacent to the verb but not treated as morphologically bound
wers1238	GB311	Can mood be marked by a productive, obligatory and dedicated construction that is not morphologically bound to the verb?	?	Not known		nan	1: present;0: absent	Not mentioned, The marker is adjacent to the verb but not treated as morphologically bound
wers1238	GB312	Can modal distinctions be marked on the verb, productively, dedicatedly and obligatorily?	?	Not known		nan	1: present;0: absent	Not mentioned, The marker is adjacent to the verb but not treated as morphologically bound
wers1238	GB313	Are there possessive pronouns?	?	Not known		nan	1: present;0: absent	Not mentioned
wers1238	GB314	Can augmentative be marked productively by a system of nominal classification?	?	Not known		nan	1: present;0: absent	Not mentioned
